id,keyword,location,text,target
5038,eyewitness,Orlando Fl,WFTV Eyewitness TN school psychologist arrest Florida child porn charge,0
5039,eyewitness,Bakersfield California,wake up Kern County Eyewitness morning air right now KBAK CBS liveonKBAK,1
5040,eyewitness,Washington DC,on anniversary Hiroshima bombing illustrate timeline bombing Eyewitness account particularly horrify,1
5041,eyewitness,Los Angeles CA USA,Aug   Radio Show article Eyewitness Account Abortion Organ Harvesting Planned Parenthood,0
5043,eyewitness,,DK Eyewitness Travel Guide Denmark travel guide eBay auction keep eye,0
5044,eyewitness,,DK Eyewitness Travel Guide Denmark travel guide eBay auction keep eye,0
5046,eyewitness,UK,patrickjbutler Excellent damiengayle eyewitness account Kids Company closure you drop bomb expect,1
5047,eyewitness,,Monkeys abuse Notorious Laboratory Dealer A PETA Eyewitness Invest YouTube,0
5049,eyewitness,Pennsylvania,a true TBT Eyewitness WBRE WYOU,0
5050,eyewitness,,DK Eyewitness Travel Guide Chicago Dorling Kindersley Publishing Staff travel book eBay auction,0
5052,eyewitness,South Africa,it light stage two load shed stage two load shed force pm pm,0
5055,eyewitness,,DK Eyewitness Travel Guide Denmark travel guide eBay auction keep eye,0
5056,eyewitness,Orlando Fl,WFTV Eyewitness FBI Man steal secret marry honduran minor sex,0
5059,eyewitness,York NY,freed BokoHaram captive speak I sure go school guardian,0
5060,eyewitness,South Africa,I try save Mido Macia one murder accuse testify try save Mido Macias life,0
5061,famine,,russian food crematoria provoke outrage amid crisis famine memorie MOSCOW Reuters russian government,1
5062,famine,Florida I wanna n Texas,oct guy bitch famine,0
5063,famine,York USA,food crematoria provoke outrage amid crisis famine memory,1
5064,famine,Kyiv Ukraine,Russia food crematoria provoke outrage country withsoare poverty soviet famine memory,1
5065,famine,,hunger hit I can not function probably would last long famine zone thank God,0
5067,famine,,accord Gallup poll money likely suffer time famine Ari,0
5068,famine,JamDung,like unu feast famine tomorrow,0
5069,famine,PanamÌÁ,top Turn Darkness King Redeem Queen Serene Famine Wolf,0
5071,famine,,russian food crematoria provoke outrage amid crisis famine memory,1
5072,famine,,robertmeyer exle low food price farmer break famine next mean simple Capitalism fail feed,0
5073,famine,Washington DC,a memorial million perish Holodomor erect you capital,1
5074,famine,Earth Milky Way Universe,export food solve problem african end famine n poverty solve out of CONTROL TRIBAL war,1
5075,famine,,food crematoria provoke outrage amid crisis famine memory,1
5076,famine,,article russian food crematoria provoke outrage amid crisis famine memory read,1
5078,famine,EdappallyKochi,build Muscle with Feast and famine feed Most diet plan base around lose weight,0
5079,famine,Texas,the famine come end Bluebell,1
5080,famine,In Fairie else,she taste like feast famine and starve TRUSTING JACK writescoffee iartg RWA twrw RRBC,0
5082,famine,,russian food crematoria provoke outrage amid crisis famine memory,1
5083,famine,Massachusetts,Russia destroy food hungry we one insane government,1
5085,famine,,FinancialTimes ethiopian regime continue receive foreign aid famine strike year eastern Ethiopia,1
5087,famine,Ukraine,reuter russian food crematoria provoke outrage amid crisis famine memory,1
5088,famine,,a grade Black Horse famine MEGA Score Dynamix,0
5089,famine,,russian food crematoria provoke outrage amid crisis faminememorie,1
5092,famine,,Bolshevik government monopolize food supply seize power hunhry population Artificial famine result,1
5094,famine,United States,russian food crematoria provoke outrage amid crisis famine memorie YahooNews,1
5095,famine,Ireland,I experience smell rot potato first time the Famine must awful whole country smell like,1
5096,famine,San Francisco,russian food crematoria provoke outrage amid crisis famine memory,1
5097,famine,,thing become terrible great ethiopian famine,0
5098,famine,Rogersville MO,SavageNation remind Peasants destroy food Stalin army come redistribute wealth it cause famine death,1
5099,famine,Tampa FL,update russian food crematoria provoke outrage amid crisis famine memorie russian society still recal,1
5101,famine,,the Adventures Mineness the Famine be over,1
5102,famine,Ukraine,food crematoria Russia provoke outrage amid crisis famine memory,1
5103,famine,,Robert Conquest Famine Museum Kiev GuidoFawkes MediaGuido,0
5104,famine,,russian food crematoria provoke outrage amid crisis famine memory,1
5105,famine,,CNN end Times upon we Famine War Death Plague the presence grow strong,0
5106,famine,Telangana,Maratha raider scorch land Punjab refuse food aid famine wonder Bengalis harbor hard feeling,1
5107,famine,Chatham IL,Images Famine Hope in Christ a blog happen forget God HopeinChrist lifelettercafe,1
5109,famine,,SurfPhoto I squeeze tear famine plague tsunami chance Lego blubber,0
5110,famine,Charter Member VRWC,russian food crematoria provoke outrage amid crisis famine memorie Yahoo,1
5113,fatal,,year Old boy charge with Manslaughter Toddler Report an old boy charge manslaughter fatal sh,1
5114,fatal,Wood Buffalo Alberta,Roger Goodell Fatal Mistake Tom Brady an Innocent Man,0
5115,fatal,ÌT,boy charge manslaughter shooting death Elijah Walker the old appear Wednesday,1
5116,fatal,,fatal attraction common n common pain,0
5117,fatal,Anchorage AK,apd investigate fatal shoot old child southeast Anchorage,1
5119,fatal,Nakhon Si Thammarat,investigator shift focus cause fatal Waimate fire,1
5120,fatal,Somewhere Clyde,AsianShawtyy I sorry but I,0
5122,fatal,Buffalo NY,Police man early s die shoot Vermont St,1
5124,fatal,Quincy,man accuse fatal hit run get judge KHQA,0
5125,fatal,Winnipeg,winnipeg police seek witness Arlington William fatal crash,1
5126,fatal,Fresno CA,chrisdanielshow nearly Fatal Pee San Francisco,0
5127,fatal,Varanasi,year Old boy charge with Manslaughter Toddler Report an old boy charge manslaughter fatal sh,1
5128,fatal,Laredo TX,petition remaster Fatal Frame Windwaker style selfie mode,0
5130,fatal,Thane,year Old boy charge with Manslaughter Toddler Report an old boy charge manslaughter fatal sh,1
5131,fatal,South Wales Australia,man charge fatal crash near Dubbo refuse bail dailyliberal,1
5132,fatal,,California man face manslaughter charge Sunday wrong way fatal crash Ca,1
5134,fatal,Poconos,the five Fatal Flaws Iran Deal YouTube,0
5135,fatal,Sacramento CA,Stockton police investigate fatal drive shooting north Stockton,1
5136,fatal,Haddonfield NJ,Deputies Dog dispute lead fatal shoot Person County gunfail nra,1
5137,fatal,,year Old boy charge with Manslaughter Toddler Report an old boy charge manslaughter fatal sh,1
5138,fatal,Southern California,CA Cops illegal immigrant Prior Arrests charge Fatal Sex Attack,1
5139,fatal,,spookyfob feelslikefob I okay thank yes kindness fatal though like Patrick stump level kindness,0
5140,fatal,,year Old boy charge with Manslaughter Toddler Report an old boy charge manslaughter fatal sh,1
5141,fatal,Jaipur Rajasthan India,success permanent failure fatal,0
5142,fatal,,investigator shift focus cause fatal Waimate fire,1
5144,fatal,,year Old boy charge with Manslaughter Toddler Report an old boy charge manslaughter fatal sh,1
5145,fatal,Bangalore,year Old boy charge with Manslaughter Toddler Report an old boy charge manslaughter fatal sh,1
5146,fatal,,tell adopt way maybe I overlook something fatal whyor,0
5148,fatal,Also follow,boy charge manslaughter shooting death Elijah Walker,1
5149,fatal,,Robert Ballew log statement always fatal level,0
5150,fatal,Play For Ryan,fatal attraction,0
5152,fatal,,crime Police ID victim fatal crash close I near Franklin one person justice court,1
5153,fatal,Dimapur,year Old boy charge with Manslaughter Toddler Report an old boy charge manslaughter fatal sh,1
5154,fatal,,investigator shift focus cause fatal Waimate fire,1
5155,fatal,In potters hands,boy charge fatal shoot old,1
5157,fatal,,year Old boy charge with Manslaughter Toddler Report an old boy charge manslaughter fatal sh,1
5159,fatal,,year Old boy charge with Manslaughter Toddler Report an old boy charge manslaughter fatal sh,1
5160,fatal,,investigator shift focus cause fatal Waimate fire,1
5162,fatality,,EXCLUSIVE in fatality involve duty NYPD cop year,1
5164,fatality,York,NYC Legionnaires death toll rise York City all eight fatality old adult,1
5165,fatality,York City NY,let we fraction vital need our fatality how would break education econom,0
5166,fatality,,Las Vegas top city red light run fatality NewsLV,0
5168,fatality,Corpus Christi Texas,we totally unprepared EMP attack both China Russia probably isis possess fatality why push,1
5169,fatality,Cape Town,city implore motorist speed report animal fatality near nature reserve,1
5170,fatality,,kyrikoni ExpressandStar who say veg fruit good Hope injury fatality,0
5171,fatality,WolverhamptonBrumJersey,Understand fatality trap inside wholesale market fire engine fire fighter scene,1
5172,fatality,Chamblee Georgia,as month mark total fatality first half last,1
5174,fatality,Official Website,HSE release annual workplace facility datum have,0
5175,fatality,WashingtonState Seattle,Seattle deadly red light runner intersection reveal,1
5176,fatality,TechFish,reject Mortal Kombat Fatalities Mortal Kombat stretch boundary,0
5177,fatality,Washington DC Charlotte NC,unsuckdcmetro minor train leave rail Major   Smithsonian Interlocking derail crash barrier wall fatality,1
5178,fatality,,Injuries Illnesses Fatalities Latest number,1
5179,fatality,United States warm,osage Beach release name,0
5180,fatality,,I wonder Cool Weird it character MKX fatality Skinless Predator,0
5181,fatality,Washington DC,Saudi Arabia Abha Fatalities report follow suicide bombing mosque avoid area,1
5182,fatality,Hope Road Jamaica,use road wisely prevent carnage continue let we fatality holiday period ggindependencmessage,0
5183,fatality,jersey,mortal kombat fatality gross interesting,0
5184,fatality,,the X ray MKX look like fatality,0
5185,fatality,WestEnd Puritan Ave,dwilliam Ieansquad when fatality mortal Kombat,0
5186,fatality,,kitana fatality slay kody Vine KOMBATFANS,1
5187,fatality,Youngstown OH,OSP concern mount fatality,1
5188,fatality,,mortal Kombat X all Fatalities on Meat predator,0
5189,fatality,Nantes France,estimate damage fatality Hiroshima size atomic bomb drop hometown Hiroshima,1
5190,fatality,St Johns NL Canada,the RCMP report fatality serious injury result collision TCH near Whitbourne,1
5191,fatality,CasertaRoma Italy,Govt allocate   bn flood action Issue take centre stage fatality Veneto,1
5192,fatality,Pekanbaruå¡Batam Islandå¡Medan,there zero spider bite related fatality Australia since,0
5193,fatality,oman muscat al seeb,I like YouTube video tremor be no joke tremor DLC FATALITIES X RAY,1
5194,fatality,San Francisco,Motordom lobby change language around traffic fatality we need back future VisionZero,0
5195,fatality,Wisconsin,share help cousin family,0
5196,fatality,,among main factor behind pedestrian fatality fail yield car,1
5197,fatality,Jogja Indonesia Slowly Asia,Mortal Kombat X excellent fatality fun I have ever mortal kombat SEGA version,0
5198,fatality,Vancouver BC,uber reduce drunk driving fatality say independent study,0
5199,fatality,,I like YouTube video kevinedwardsjr Mortal Kombat X pc Gameplay Fatalities X Rays MKX,0
5200,fatality,USA,Las Vegas top city red light run fatality,1
5201,fatality,,RCMP confirm fatality two vehicle crash TCH remain close whitbourne due accident,1
5202,fatality,Avon OH,american casualty include fatality five ten million japanese fatality,1
5203,fatality,,no UK train accident fatality th run despite increase passenger journey healthandsafety,1
5204,fatality,The North,I fail would bring number road fatality IMMENSELY,0
5206,fatality,Philadelphia PA,policylab cecanf last public hearing NYC tomorrow address child abuse neglect fatality,1
5207,fatality,Just Happy Be Anywhere,Kurt Schlichter Yep consider million japanese fatality project Downfall FreeMarketeer dibang,1
5208,fatality,,Shipping Logistics eNCA Fatalities migrant boat capsize Med hundred onboard capsize,1
5209,fatality,Lima Ohio,message board display update traffic fatality message begin Traffic death slow worker,1
5210,fatality,Ireland,driver fatalitie irish road pedestrian cyclist risk,1
5211,fatality,Lowell MA,EBROINTHEAM jay big L pun biggie wrap zero question fatality flawless victory,0
5212,fatality,playing soccer eating pizza,jakeadavis FaTalityUS cuddle right,0
5213,fatality,,TrulyStings Yo Dm,1
5218,fatality,NY,so savage leak Thomas Brady gangstermail account wonder quick fatality Samsung mobile B real son,0
5219,fatality,Hueco Mundo,I like YouTube video vgbootc X sN vaBengal ZSS Vs SWS Fatality Captain Falcon,0
5220,fatality,,hibernate pbx irrespective pitch fatality careerism pan crbZFZ,0
5221,fatality,Nairobi,fatality,0
5222,fatality,Boston  Cape Cod,die Lyme disease case fatality rate nearly,1
5223,fatality,,hripsk fatality like corpse still jittere,1
5224,fatality,Rafael castillo,fatality,0
5226,fatality,,wow fatality big rig hit motorcyclist blood everywhere wow I sick,1
5227,fatality,Jersey,Tellyfckngo JayCootchi nah hit homie wit fatality son wit babality Cold Cold fuck lmfaoooo,0
5228,fatality,Fort Wayne IN,Kosciusko police investigate pedestrian fatality hit train Thursday,1
5229,fatality,Enterprise NV,fatality,0
5230,fatality,,Bardissimo yes life fatality rate,0
5231,fatality,,how many basket a Charming Fatality tonyakappe get Mystery Paranormal,0
5232,fatality,,they make Bad Boys   A must,0
5233,fatality,Grand Rapids MI,FaTalityUS need team we need,0
5234,fatality,USA,afghan soldier Kills General America Highest Ranking Fatality since Vietnam,1
5235,fatality,,that usually never happen,0
5236,fatality,York,babybackreeve FATALITY,0
5238,fatality,Utica NY,CAT fatality UTICA NY PLEASANT HOLLAND AVE Black cat white paws average size on grass next north side road,0
5242,fatality,,pxnatosil RenuncieDilma Fatality,0
5243,fatality,,Jax MK stage Fatality UUD LK Close,0
5244,fatality,Nunya,see video every fatality Mileena make sad,0
5245,fatality,Houston TX,chrisman fatality,0
5247,fatality,USA,Kosciusko police investigate pedestrian fatality hit train Thursday,0
5248,fatality,,fatality,1
5249,fatality,TX,fatality scary af probably good falcon still scary,0
5251,fatality,ChristianaTennessee,I like YouTube video vgbootc X sN vaBengal ZSS Vs SWS Fatality Captain Falcon,0
5252,fatality,Nashville TN,truck crash w US Lebanon fatality very sad expect long delay morning,1
5254,fatality,Bishops Stortford England,LindaSOCVAT TfL Bus Alerts yes apparently Report cow fatality well sadly,1
5255,fatality,Earth,I like YouTube video deathmule MK X Tremors Stalag might Fatality Ermac Tournament Pharaoh,0
5256,fatality,Brentwood NY,I add video YouTube playlist X SWS Fatality Captain Falcon Vs Snow Fox SSB loser,0
5257,fatality,,Death Loretta Fuddy responsible authenticating Obama birth certificate sole fatality nine plane,1
5259,fatality,Honduras,fatality,0
5260,fatality,,everyday near death fatality road thank god side,0
5262,fear,ChippenhamBath UK,fear Factory December do deal,0
5263,fear,,I make friend interesting combine,0
5264,fear,Yewa zone,the meaning I pick change life overcome fear behold wonder TCC catch light endless,0
5265,fear,sitting fence York,phnotf sometimes cheekiness bleed computer screen recoil fear,0
5266,fear,,every man fear strong minded woman I keeper get keep runnin,0
5267,fear,,my big fear disappointing believe,0
5269,fear,Carregado,I hurt fear drive midnight,0
5270,fear,Largo MD,man fear feel control woman or passive aggressively coerce commitment ready,0
5271,fear,,the thing fear organization fluctuation disturbance imbalance primary source creativity Margaret Wheatley,0
5272,fear,mexico,fear Factory Cars Official MusicVideo,0
5273,fear,Cape Town Khayelitsha,Luzukokoti understand umntu wakho if trust partner ok fear anything,0
5274,fear,Florida,photo referencereference xekstrin I think the NOSTRILS be eye and I almost cried from FEAR partake,0
5276,fear,Indianapolis IN,baileysmsteach the fear look like doingahhhthat big PerryChat,0
5278,fear,,the opposite love fear here be why,1
5280,fear,,FEAR YouTube,0
5281,fear,Stanford University,help win share article a Lifetime of Fear Thanks BlackInAmerica GrowingUpBlack,0
5282,fear,Midwestern USA,CowgirlLawyer we must refuse become nation everyone live fear shoot unawares intoxicate crazy,1
5283,fear,Bedford IN,horror film make incredibly creative artist we interview depth the Anatomy Fear,1
5284,fear,,I forever stay side on special night Fear Loathing Las Vegas Solitude X mas,0
5285,fear,Thibodaux LA,bad fear,0
5286,fear,,shakjn C Magnums shake fear go hack planet,0
5287,fear,Brazil,when world finish God say fear ChooseGod RestoringPaths,0
5290,fear,In moment,by replace fear unknown curiosity open,0
5291,fear,,love God fear hell,0
5292,fear,,tell bride give fear,0
5293,fear,Alliston Ontario,ScottDPierce billharristv HarrisGle Beezersun I forfeit year fantasy football pool fear I may win n get ass kick,0
5295,fear,,as right I reopen x Files that fear thexfilesday,0
5296,fear,SaudI arabia riyadh,live balanced life balance fear Allah hope his mercy love he,0
5297,fear,York NY,big fear eventually way,0
5298,fear,Athens Nicosia,couple less sex fear let internet movie book say sex ought p,0
5299,fear,,nothing fear it take risk,1
5300,fear,Southern California,Untangle require partner fill need love without fear besttalkradio listen,0
5301,fear,Bremerton WA,the walk dead spin fear walk dead rd,1
5302,fear,Tulalip Washington,mcnabbychic I fear,0
5304,fear,Indonesia,the fear Lord start knowledge foolish use wisdom teach Amsal,0
5305,fear,Halifax,the number deny climate change polar bear article make fear future also humanity general,0
5306,fear,Hilton Head SC,SenSanders Gd idea I wrke hard almost nothing fear live poor Fran Reed,0
5308,fear,York,never let fear get way achieve dream deltachildren instaquote quoteoftheday Disney WaltDisney,0
5309,fear,St Louis MO,fear motivator,0
5310,fear,USA,Daily Reflections August drive drive hundred form fear self delusion self seek self pity,0
5313,fire,,Morganite Gemstone White Fire Opal Sterling Silver Ring Size r,0
5315,fire,SÌ£o Paulo,Marquei como visto Game Thrones x Kissed Fire banco de series,0
5316,fire,,Save Date Saturday August   Salisbury Fire Department Open House Cypress St be,0
5317,fire,,why put fire still burn,0
5319,fire,high,misshomasttopa fire fire fire yeah fire fire fire nowwwwww,1
5320,fire,,my avi and header combo fire,0
5321,fire,Wrex,auction shoe Retro fire red,0
5322,fire,,my asshole fire,0
5323,fire,big boy ,I cry song end set fire,0
5324,fire,,set thing fire always option,1
5325,fire,,sit around fire sound great right,0
5326,fire,,I see Fire,0
5328,fire,Brooklyn,but put Flood Fire top list,1
5330,fire,Canada,I on Fire,0
5331,fire,To The Right You,PolitiFact Harry Reid Percent Women serve Planned Parenthood Claim be Pants Fire Lie tcot,0
5332,fire,StCloud MN,dear canonusaimaging I bring CanonBringIt Fire CanonTattoo MN TheresMoreWhereThatCameFrom,0
5335,fire,,seanhannity Scott Walker yeah need another middle class hate republican get hard work cop fire fighter teacher,0
5336,fire,,this fire WAY close wtf go,1
5337,fire,catwalk somewhere,Fire Meet Gasoline always get get play twice lol,0
5338,fire,å,WCW catsandsyrup THA BITCH be FIRE,0
5339,fire,Zac Newsome loves,well feel like fire,0
5341,fire,louisville kentucky,eye word icy burn like rum fire,0
5342,fire,,PolitiFact Harry Reid Percent Women serve Planned Parenthood Claim be Pants Fire lie,0
5343,fire,,nothing like good fire,1
5344,fire,Makai,DaughterofNai Tenshi activate Yuki fire card,0
5345,fire,Fort ValleyGAFayettevilleAR,California shake catch fire overcharge rent past year go nowhere,1
5346,fire,Arizona,there fire Catalinas look kind cool this picture justice,1
5347,fire,,zaynmalik overwork your album go fire overwork stress I love take care,0
5349,fire,Vancouver BC,JustinLing I promise tax pancake rainbow die fire,0
5350,fire,Newark NJ,this nigga Cyhi diss Meek suppose this shit actually fire,0
5351,fire,road success,I set shit fire,1
5352,fire,The Desert,in word Charlie Daniels Fire mountain run boy run,1
5353,fire,Sydney Australia,I check on Fire ZomatoAUS LoveFood,1
5354,fire,Yuba City CA,when heart big obstacle front euro dontexpectnothe july fire euro,0
5355,fire,,fire wave darkness,0
5356,fire,University South Florida,it may seem like fire little burn,0
5357,fire,,smell Bon fire driving make sit near make more,1
5359,fire,moon,will drop fire selfie tomorrow say welcome ahead time,0
5362,fire truck,Niagara Falls Ontario,fire call brant av DRUMMOND RD Fire Structure Single Units car on Call truck,1
5365,fire truck,Woodcreek HS Roseville CA,your PSA day if fire truck behind light go MOVE OVER get call,0
5366,fire truck,United States,RFP Fire Truck Service Body F Fire fight rescue safety equipment Transporta,0
5367,fire truck,,reno Truck trailer catch fire Reno,1
5368,fire truck,,wild night village pugwash every fire truck town like fire truck every house population,1
5371,fire truck,Here There,an wheeler come along strike fire truck spin around degree cause roll,1
5372,fire truck,District Orange County,sigalert update n CLOSED AT FWY UFN TRASH TRUCK fire,1
5373,fire truck,Plain O Texas,BrookTekle like murder scene cop fire truck fire assistance car along helicopter,1
5375,fire truck,SouthEast Asia,former Township fire truck use Philippines Langley Times Philippines,1
5377,fire truck,,former Township fire truck use Philippines Township Langley assistant fire chief Pat Walker spen,1
5378,fire truck,,our garbage truck really catch fire lmfao,0
5379,fire truck,,KapoKekito northgate taco truck fire,1
5380,fire truck,,it never good sign pull work five ambulance fire truck bay Wompppp least Friday,1
5381,fire truck,Saipan CNMI,fire truck ambulance K Phase Hope everyone okay PrayForSaipan,1
5382,fire truck,Orange County Calif,SigAlert North Southbound closed btwn fwy Irvine Blvd due truck fire CHP detour traffic,1
5383,fire truck,lost thoughts,eeenice true truck catch fire,1
5384,fire truck,,JustineJayyy OHGOD XD I mean p but fire truck back good xD,0
5385,fire truck,Five Coffeeshop,come across fire video mine enjoy Babes way say hi fire truck fireman,0
5386,fire truck,Los Angeles,n past L lane reopen all lane close all lane open Trash truck fire cleanup KNX,1
5387,fire truck,Orange County CA,SigAlert North Southbound closed btwn fwy Irvine Blvd due truck fire CHP detour traffic,1
5389,fire truck,Five Coffeeshop,find cool photo mine Dodge Wayne bodied window bus Ex Libby MT Fire Department truck all ori,1
5391,fire truck,,Trident Chevy fire Truck Pumper IMS Fire Dept Red HO   plastic,0
5392,fire truck,Tallahassee FL,toddler Bedding Firetruck Bundle Fire Truck Firefighter Sticker Decals Sign Wall,0
5396,fire truck,,monster truck racer catch fire fair,1
5397,fire truck,Laguna Beach Calif,truck fire clog canyon road,1
5400,fire truck,Nevada Carson CityFreeman St,rgj Truck trailer catch fire Reno,1
5403,fire truck,,Philippines former Township fire truck use Philippines emergency equipment Cebu Philippi,1
5404,fire truck,LA,fire truck parking lot,0
5406,fire truck,,evening Sun article NNO,0
5407,fire truck,,choose happy Fire truck rest Review Kick Push jaymcleanauthor,0
5408,fire truck,,former Township fire truck use Philippines Langley Times filipino,0
5409,fire truck,,Jacksonville Fire Rescue Engine AWESOME TRUCK official JADE FL YouTube,1
5410,fire truck,Aracaju Sergipe,Jersey Turnpike Jersey Turnpike Reopens hour after Truck Fire in,1
5411,first responder,,LukeBox something first responder military true Hero besides music,0
5412,first responder,Nashville Tennessee,I grateful first responder Metropolitan Nashville Police Department NashvilleFD other act swiftly save countless life,1
5413,first responder,Texas,USA pray for GOD healing and safety of FIRST responder,0
5416,first responder,Long Eaton åá Derbyshire åá UK,join charity k run event DoningtonDash be start Sun Sept Castle Donington Community First Responders,0
5417,first responder,WorldWide,love way book write include many vantage point First Responders DetKenLang kindle,0
5418,first responder,,first responder would never send wrong address SmartTek GPS base panic button mper safety,0
5420,first responder,Portage IN Worldwide,we can help say Denver Firefighter Working to curb First Responder Suicide,1
5423,first responder,Victoria BC Canada,what cool teen become I like call digital first responder friend need little help support,0
5425,first responder,,Carmike Cinemas Antioch Shooting we be grateful Staff First Responders Safety be Highest priority,1
5426,first responder,RoadsTrails Everywhere,roadid Thanks Alex story first responder need,0
5428,first responder,York City,I add Sandy First Responders lose their Homes VIP Home Page Group Vimeo,1
5430,first responder,Nashville TN,thankful first responder especially Metropolitan Nashville Police Department life save response Antioch,1
5432,first responder,,Juneau Empire First responder turn National Night Out,0
5437,first responder,Liberty Township Ohio,red I throw word hero around lightly usually reserve first responder military but hero,0
5439,first responder,Aberdeenshire,want future first responder high tech,0
5442,first responder,Los Angeles CA,there still room party first responder around country rd annual well ever,0
5443,first responder,A Hoop Somewhere,incase accident first responder would baby present,0
5444,first responder,Michigan,Kirsten Gillibrand Extend Health Care to First responder,1
5445,first responder,Bloomington Indiana,we can help say Denver Firefighter Working to curb First Responder Suicide,1
5446,first responder,USA,First Responders Convene National Summit Awards GIS Technology gisuserPR geotech,0
