id,keyword,location,text,target
7909,rainstorm,Darnley Prince Edward Island,due rainstorm last night cupcake decorate happen now Rec Hall proceed IWK,0
7910,rainstorm,Gloucester MA,rainstorm downtown Gloucester gloucester capeann seagull triciaoneill triciaoneillphoto,1
7912,rainstorm,vancouver usa,myrtlegroggin I forget Sunday OMG,0
7913,rainstorm,Alberta,wow beauty lie within every storm take rainstorm a B Pipeliners,1
7914,rainstorm,Yobe State,Rainstorm Destroys Houses Yobe State Rainstorm Destroys Houses Yobe State Daily Trust Damatu,1
7915,rainstorm,Coventry Rhode Island,go beach Jim Alves mean guarantee rainstorm lucky,0
7916,rainstorm,,DnB NewRelease edge Jimmy Summer Rainstorm Lapaka sound,0
7918,rainstorm,United States America,three kill severe rainstorm Italian Alps cause landslide,1
7923,rainstorm,,landslide Italian Alps kill three ROME Reuters Three kill severe rainstorm th,1
7924,rainstorm,Federal Capital Territory,rainstorm destroy Houses in Yobe iReporter sharethis,1
7926,rainstorm,La Puente CA,stuck rainstorm stay toward middle road Most street crown water tend pool side,0
7929,rainstorm,music,major rainstorm happen I go lie drift away storm around little bebacksoon,1
7930,rainstorm,online,landslide Italian Alps kill three ROME Reuters Three kill severe rainstorm I,1
7932,rainstorm,Memphis TN,if can not roar wave rainstorm roll,0
7933,rainstorm,,RobotRainstorm we two vacancy Castle Fantasy Football team join we its fun,0
7934,rainstorm,,Calum Hood like get catch rainstorm amazing disgusting time,0
7935,rainstorm,,rainstorm Update Further North Further South,1
7936,rainstorm,Thailand Malaysia Indonesia,Nigeria Rainstorm Destroys Houses Yobe State Daily Trust Damaturu over,1
7937,rainstorm,Earth,landslide Italian Alps kill three ROME Reuters Three kill severe rainstorm th,1
7938,rainstorm,Pennsylvania USA,RAIN RAIN away a soaker way,0
7939,rainstorm,vancouver usa,NathanFillion hardly,0
7940,rainstorm,Fairfax VA,tomorrow evening commute receive RED LIGHT a rainstorm impacting region push way late evening,1
7941,rainstorm,Memphis TN,that rainstorm last nearly long enough,1
7943,rainstorm,Seattle,robotrainstorm I sort interested font use,0
7944,rainstorm,Sicamous British Columbia,lizzie CstSmith I drive thru deep water flash flood rainstorm repair cost   yr later still thnk car float,1
7945,rainstorm,North MemphisGlobal Citizen,good believe wrong decision make Memphis street rainstorm lol folk doe,0
7949,rainstorm,Bridport England,I rainstorm please,0
7950,rainstorm,Porto Alegre Rio Grande Sul,wake sick rainstorm outside would usually sad not though put the Kooks stereo let we,0
7952,rainstorm,North Vancouver BC,yay I feel wind gear rainstorm Vancouver Bring drought deadgrassandflower wildfire,1
7953,rainstorm,Seattle,robotrainstorm I huge football fan I never do fantasy league Patience newbie,0
7954,rainstorm,Pioneer Village KY,the way move like full rainstorm I house card,1
7955,rainstorm,Port Harcourt Nigeria,Rainstorm Destroys Houses Yobe State,1
7957,rainstorm,ECSU,the way move like full rainstorm I house card,0
7958,rainstorm,UK,landslide cause severe rainstorm kill italianalp,1
7959,raze,,former Freedom Surf Spa Razed make Way home,0
7960,raze,,the late More home raze Northern California Wildfire ABC,1
7962,raze,Nigeria,tension in ABIA as inec office razed governor IKPEAZU PDP APGA REACT,1
7963,raze,Tulsa OK,the late More home raze Northern California wildfire the late wildfire burn California,1
7965,raze,,the late More home raze Northern California wildfire,1
7968,raze,,the late More home raze Northern California Wildfire ABC,1
7969,raze,,the late More home raze Northern California Wildfire ABC,1
7970,raze,,the late More home raze northern California wildfire Lynchburg Advance,1
7971,raze,WorldWide,the late More home raze Northern California Wildfire York Times TAFS FB,1
7972,raze,,the late More home raze Northern California Wildfire ABC,1
7973,raze,,the late More home raze Northern California Wildfire ABC,1
7976,raze,,the late More home raze Northern California wildfire,1
7977,raze,,the late More home raze Northern California wildfire,1
7978,raze,,the late More home raze Northern California wildfire,1
7980,raze,North,petereallen huffpostuk bbclive how significant iconic pic Church maybe ruin less substantial effort raze,0
7981,raze,,the late More home raze Northern California wildfire,1
7982,raze,,the late More home raze Northern California wildfire,1
7983,raze,,the late More home raze Northern California Wildfire ABC,1
7984,raze,Ames IA,David Vonderhaar at least sincere,1
7987,raze,,the late More home raze Northern California Wildfire ABC,1
7988,raze,,the late More home raze Northern California Wildfire ABC,1
7989,raze,,the late More home raze Northern California wildfire,1
7990,raze,San Diego California,More home raze Northern Calif wildfire sandiego,1
7991,raze,NairobiKENYA,George Njenga hero save burn friend raze wildfire,1
7992,raze,Erie PA,another dualcom ImRazed enjoy yesterday check today pm easter,0
7994,raze,,the late More home raze Northern California Wildfire ABC GN,1
7996,raze,,the late More home raze Northern California Wildfire ABC,1
7999,raze,,the late More home raze Northern California Wildfire ABC,1
8000,raze,,the late More home raze Northern California Wildfire ABC,1
8001,raze,,the late More home raze NorthernCalifornia wildfire Zipped,1
8002,raze,,the late More home raze Northern California wildfire,1
8003,raze,NairobiKENYA,George Njenga hero save burn friend raze wildfire,1
8005,raze,,the late More home raze Northern California wildfire,1
8006,raze,,the late More home raze Northern California Wildfire ABC,1
8008,raze,Augusta Maine,Vassalboro house raze way public gazebo petelmcguire report,0
8009,refugee,,this married turkish couple give syrian refugee incredible gift Fed instead family friend,1
8010,refugee,Ad Majorem Dei Glorium,Police Monitoring Jihadis Poland freedomoutpost,1
8012,refugee,Aurora Ontario,turkish newlywed donate wedding money beautiful gesture still faith humanity,0
8013,refugee,Baku Erzurum,this married turkish couple give syrian refugee incredible gift WashingtonPost,1
8015,refugee,Statute Of Limitations,Repulsive Refugees Victimiser Dutton Evangelical Liar Abbott c LNP dupe press overdrive CHOPPERGATE BRONWYNBISHOP auspol,0
8016,refugee,paradise,retweet Cameroon repatriate nigerian refugee due Boko Haram,1
8017,refugee,BC Asia Europe,newlywed feed syrian refugee wed CBC Latest Canada World Entertainment Business,0
8018,refugee,,wowo nigerian refugee repatriate Cameroon,1
8019,refugee,,hmm nigerian refugee repatriate Cameroon,1
8020,refugee,,whao nigerian refugee repatriate Cameroon,1
8021,refugee,St PetersburgFL,imagine entire aisle dedicated make like serbian refugee director whole food clothing section,0
8023,refugee,EspaÌ±a,viral Spell Couple spend wedding day feed syrian refugee http,0
8024,refugee,,reaad plsss nigerian refugee repatriate Cameroon,1
8025,refugee,Tarragona,top story Viral Spell Couple spend wedding day feed syrian refugee,0
8026,refugee,,Refugee Connections Indiegogo caign go live tomorrow support we help launch online community refugee,1
8028,refugee,,read nigerian refugee repatriate Cameroon,1
8029,refugee,,short throwing overboard I leader could much bad refugee Tony Abbott bad pm ever,1
8030,refugee,Warri,Cameroon Repatriated nigerian refugee,1
8031,refugee,Melbourne Australia,Captain Abbott must LNP boat refugee christianvalue,0
8032,refugee,,a turkish couple spend wedding day feed syrian refugee a turkish couple get marrie,0
8034,refugee,,how one couple be use Drones Save Refugees World Deadliest Border,1
8035,refugee,,whao nigerian refugee repatriate Cameroon,1
8036,refugee,,hmm nigerian refugee repatriate Cameroon,1
8037,refugee,Bangalore India,turkish couple decide feed syrian refugee part wedding celebration,0
8038,refugee,Skyhold,fadelurker dalinthanelan right even two year still refugee ce south Redcliffe village Aidan,1
8039,refugee,Australia,newlywed feed thousand syrian refugee instead host banquet wedding dinner age,0
8040,refugee,AmmanJordan,in Photos the Young Refugees force Flee Burundi Violence VICE,1
8043,refugee,tripoli international airport,KristinDavis UN Refugees thank UN Refugees help many need world,0
8044,refugee,,wowo nigerian refugee repatriate Cameroon,0
8045,refugee,,newlywed feed thousand syrian refugee instead host banquet wedding dinner smh,1
8047,refugee,Auckland Zealand,Paci c Media Centre article AUSTRALIA RSF protest security gag report,0
8049,refugee,,recap nigerian refugee repatriate Cameroon,1
8055,refugee,NYCUS Cali Colombia,the most generous Bride Earth Couple feed syrian Refugees their wedding Day thedailybeast love,0
8056,refugee,,whao nigerian refugee repatriate Cameroon,1
8057,refugee,QLD Australia,the return refugee flee Vietnamese Govt treat return Dutton presser,1
8058,refugee,Geneva Switzerland,CHPSRE Refugees for follower Paris visit a Dream Humanity exhibition rezaphotography,1
8060,rescue,Trinidad Tobago,policyholder object Clico rescue plan,1
8061,rescue,SF Bay Area,Panik KelbyTomlinson rescue,0
8062,rescue,HarleyChickPJNTRunBenRun,coastal german Shepherd Rescue OC share link animal rescue,0
8064,rescue,Toronto Ontario,UD Rescue Structural Collapse Scott Road Ypres Road York Trucks,1
8065,rescue,Jersey,rescue day its World Cat Day Saturday Aug th Black Black White Cats NewBeginningsAnimalRescue,0
8066,rescue,Big NorthEast Litter Box,I blood pressure med still probably roof Long PPact story break I involve animal rescue,0
8067,rescue,Sand springs oklahoma,coastal german Shepherd Rescue OC share link animal rescue,0
8068,rescue,,coastal german Shepherd Rescue OC share link Ecstatic rescue Racco animal rescue,0
8069,rescue,,Suggs Vivian rescue psychrewatch,0
8070,rescue,Surry Hills Sydney,any length rescue cat need,0
8071,rescue,Sand springs oklahoma,last Chance Animal Rescue post animal rescue,0
8073,rescue,HarleyChickPJNTRunBenRun,last Chance Animal Rescue post animal rescue,0
8074,rescue,,sammy todd always rescue may uniform still rescue laugh ass forever KFC fam,0
8079,rescue,USA,lunch crew make Night night long day PeaceLoveRescue,0
8081,rescue,Thornton Colorado,tell United Nations Plantations not forest RainforestResq,0
8083,rescue,Wanderlust,Mary come Troy rescue,0
8084,rescue,Toronto Ontario,UD Rescue Structural Collapse Scott Road Ypres Road York Trucks,1
8085,rescue,Karachi,flood zone General Raheel Sharif visit Chitral he also laud effort FWO army troop army aviation rescue opera,1
8087,rescue,,last Chance Animal Rescue post animal rescue,0
8088,rescue,,lisavanderpump how many dog rescue dog,0
8089,rescue,India,official rescue migrant Libya body find Fox,1
8091,rescue,USA FEMA Region,coastal german Shepherd Rescue OC share link animal rescue,0
8094,rescue,United States,ZakBagans Sabrina dad rescue dude keep cage we since I,1
8095,rescue,,briton rescue amid Himalaya flood,1
8096,rescue,Nigeria,kidnap lady rescue police Enugu Nigerian Tribune,1
8097,rescue,Jakarta,rescue Med migrant arrive Sicily,1
8098,rescue,Ohio USA,tennoatax I hand glass water sit I rescue Tenno I live ship around dojo,0
8100,rescue,watford,trust we get rescue dopey one Val hilarious shame probably go die emmerdale,0
8101,rescue,West Hollywood,summer summervibe california puppy pitmix rescue brixton banksy happy mybabie,0
8102,rescue,Kent,man who bury Dog Alive Thought no one would find she but she be rescue just in time,0
8103,rescue,Canada,Month Old Baby Girl rescue Coastguard she float HALF a MILE Out Sea social,1
8105,rescue,The Multiverse,but Skyrim await rescue,0
8106,rescue,USA,rescue Med migrant arrive Sicily,1
8109,rescue,Bournemouth,the finnish hip hop pioneer Paleface rescue drift raft bring container later enkelbiljett menolippu,0
8110,rescue,Jammu Kashmir Delhi,bovine rescue smugglersnabbed,1
8111,rescue,,fund need rescue Abandoned Cocker Spaniels,0
8112,rescue,,I like YouTube video romanatwoodvlog RESCUED SICK KITTENS,0
8113,rescue,,briton rescue amid Himalaya flood,1
8116,rescue,southern california,a brave little dog get rescue river his recovery inspi YouTube,0
8118,rescue,Philadelphia Pennsylvania USA,Homeless Man Traveling across USA with Stray Dogs he rescue get a Helping hand from Strangers Reshareworthy,0
8119,rescue,,BrittanyPetko break tonight kid rescue play room week food water parent sex life haha,1
8120,rescue,WinstonSalem NC,you rescue actually pretend Giorgio Hiatt,0
8121,rescue,Huntley IL,we rescue dog least year ago old still sweet ever ZakBagans,0
8122,rescue,NIGERIA,rescue Med migrant arrive Sicily Hundreds migrant rescue,1
8125,rescue,The green pleasant land,why take back Africa rescue c,1
8126,rescue,Earth,migrant rescue after Boat capsize off Libya,1
8128,rescue,,young child among rescue capsize boat Libya IrishTimesWorld,1
8129,rescue,,Heroes A Springer Spaniel dog dad rescue strand baby dolphin,1
8130,rescue,Leeds UK,trust we get rescue dopey one Emmerdale Summer Fate,0
8131,rescue,Ireland,three beach whale rescue Kerry,1
8133,rescue,,rescue TB go ribbon HITS offtrackhorse,0
8135,rescue,,turn back I rescue sweep away sin though cloud Isaiah   Contemporary English Version,0
8136,rescue,Pennsylvania USA,zakbagan pet r like part family I love animal the last pet I I rescue Breaks heart animal mistreat,0
8137,rescue,Boston MA,I like YouTube video Homeless dog live cardboard box get rescue heartwarming,0
8138,rescue,Canada,angry mistrustful rescue Elephant find Peace Friendship her Home photo onegreenplanet,0
8140,rescue,JakartaKuala LumpurSpore,Photo Hundreds rescue migrant await disembarkment irish naval vessel Palermo Italy tconnellyR,1
8141,rescue,Cape Town,rescue Med migrant arrive Sicily,1
8142,rescuer,Nigeria,video we pick body water Rescuers search hundred migrant Africa,1
8143,rescuer,Westerland,video we pick body water Rescuers search hundred migrant Mediterran,1
8144,rescuer,Kuala Lumpur,video we pick body water Rescuers search hundred migrant Mediterran,1
8146,rescuer,Surabaya,video we pick body water Rescuers search hundred migrant Mediterran,1
8147,rescuer,iminchina,video we pick body water Rescuers search hundred migrant Mediterranean,1
8149,rescuer,,world fear miss migrant Med Rescuers search survivor boat carry many,1
8150,rescuer,Africa,DurbanKnight Rescuers search hundred migrant Mediterranean boat carr nosybe,1
8154,rescuer,,I unexplainable desire watch the Rescuers childhooddefine,0
8155,rescuer,Nigeria,RoddyPiperAutos Fears miss migrant Med Rescuers search survivor boat carry,1
8156,rescuer,Birmingham,AndyGilder Channel RSPCA Dog Rescuers the Infomercial creep back door,0
8158,rescuer,,video we pick body water Rescuers search hundred migrant Mediterranean boat carryi,1
8159,rescuer,,Womans gps app guide rescuer injure biker Marin County,1
8161,rescuer,,video we pick body water Rescuers search hundred migrant Mediterran,1
8162,rescuer,London,video we pick body water Rescuers search hundred migrant Mediterran,1
8163,rescuer,,video we pick body water Rescuers search hundred migrant Mediterranean boat carryi,1
8164,rescuer,,video we pick body water Rescuers search hundred migrant Africa,1
8165,rescuer,,last Second Ebay Bid Shaolin Rescuers dvd Shen Chan Nan Chiang Five venom Kung Fu please Favori,0
8168,rescuer,,video we pick body water Rescuers search hundred migrant Mediterranean boat carryi,1
8169,rescuer,,WorldNews video we pick body water BBC Home Rescuers search hundred,1
8170,rescuer,Thailand,video we pick body water Rescuers search hundred migrant Mediterran,1
8171,rescuer,,video we pick body water Rescuers search hundred,1
8172,rescuer,th Dimension,AH maze story power animal rescuer a starve homeless dog future rescue person,1
8175,rescuer,,rescuer search hundred migrant Mediterranean boat carry many capsize coast,1
8176,rescuer,Washington,many death shipwreck Rescuers try save hundred migrant thenewshype,1
8177,rescuer,USA Canada Europe Asia,video we pick body water Rescuers search hundred migrant Mediterran,1
8180,rescuer,worldwide,video we pick body water Rescuers search hundred migrant Mediterran,1
8181,rescuer,Phoenix,when Rescuers find he he be barely alive but they have no Idea he be allergic to this,1
8182,rescuer,,fear miss migrant Med Rescuers search survivor boat carry many migrant,1
8183,rescuer,,video we pick body water Rescuers search hundred migrant Mediterranean boat carryi,1
8184,rescuer,,woman gps app guide rescuer injure biker Marin County SFGate,1
8187,rescuer,,fear miss migrant Med Rescuers search survivor boat carry many migrant,1
8188,rescuer,,rescuer find survivor Nepal earthquake bury,1
8189,rescuer,Paris France,rescuer recover body old Calgary man lake near Vulcan,1
8190,rescuer,,fear miss migrant Med Rescuers search survivor boat carry many migrant,1
8191,rescuer,Here everywhere,video we pick body water Rescuers search hundred migrant BBC,1
8195,riot,Belgrade,to all the meat Loving Feminists of the World Riot Grill have arrive pop quiz which prefer fem art,0
8196,riot,India,Stuart Broad take eight before Joe Root Runs Riot against Aussies,0
8201,riot,Cardiff UK,PipRhys I predict riot,1
8202,riot,,teamvodg discover Nick Cannon Listen Buy Mandy Rain RIOT iTunes Music iTunes blowmandyup,0
8203,riot,,to all the meat Loving Feminists of the World Riot Grill have arrive art,0
8204,riot,Bossland,Rascal Flatts Riot Tour Atlantic City Beach Concert August   ticket,0
8205,riot,World Wide Web,to all the meat Loving Feminists of the World Riot Grill HasArrived,0
8208,riot,Uppsala Sweden,seriously tactical riot headquarters Disney Marvel,0
8209,riot,East London,DaniRiot keep eye look lot team member come day week,0
8210,riot,Detroit MI,to all the meat Loving Feminists of the World Riot Grill have arrive pop quiz which prefer feminist,0
8211,riot,,LiveWorkshop selfie booth riot Kappa,1
8212,riot,,AcaciaPenn I start big ass riot send jail mfs shidddd,0
8213,riot,,Riot Kit Bah part concept Gear come Autumn Winter menswear fashion urbanfashion,0
8214,riot,,abrancaballero Discovered Nick Cannon Listen Buy Mandy Rain RIOT iTunes Music iTunes blowmandyup,0
8215,riot,,I like YouTube video Thorin Thoughts Riot Sandbox Mode lol,0
8216,riot,,Stuart Broad take eight before Joe Root Runs Riot against Aussies Stuart Broad take career good figure,0
8217,riot,Los Angeles CA,retweeted Sarah Silverman sarahksilverman Soundtrack walk start w Tracey Ullman they know perfect,0
8218,riot,,to all the meat Loving Feminists of the World Riot Grill have arrive,1
8219,riot,,after time Riot really official Satan Teemo skin,0
8221,riot,Montana USA,I like YouTube video Sick Riot Shield Slide spot,0
8223,riot,Utah USA,ByTorrecilla Torrecilla we always info Secret LoL Game Check Secret get   Riot Points Bio,0
8224,riot,Frankfort KY,transwoman drag queen color lead riot well know butch lesbian usually credit incite,0
8225,riot,Los Angeles,eacAU you pre order film ITUNES watch   yay,0
8226,riot,United Kingdom,without ally near can not use skill how get hire really make every Riot staff member incompetent,0
8231,riot,In Space,pop quiz which prefer feminist revolution fry ravioliwith porcini ricotta,0
8232,riot,,to all the meat Loving Feminists of the World Riot Grill have arrive OliviaMiles,0
8234,riot,Sligo Galway Ireland,DavidJordan Stephanenny except start riot even make sense credit particular individual,1
8235,riot,Los Angeles CA,Trollkrattos Juan Carlos Salvador the Secret Tips Get   Riot Points LoL check Secret Bio,0
8236,riot,Seattle,Southeast Dirt Riot Series Crowns Chions Southeast Dirt Riot Series Crowns chionsblackfoot ID the so,0
8237,riot,Tipperary Long Way,sweetpea run riot allotment brighten rainy day,1
8238,riot,Mumbai,Stuart Broad take eight before Joe Root Runs Riot against Aussies,0
8239,riot,Malang,Riot police intervene Southton Vitesse Arnhem supporter clash fan clash buildup second,1
8240,riot,,JWalkerLyle Discovered Nick Cannon Listen Buy Mandy Rain RIOT iTunes Music iTunes blowmandyup,0
8241,riot,San Francisco CA,Cracker White Riot nowplaying,0
8242,riot,hertfordshire,but government care Police stop riot eventually protestor eventually skyscraper become plant cover,1
8243,riot,Dublin,doco tonight pm Setanta Sports Ireland freeview the large police presence soccer game Ireland stop prevent rioting,0
8244,riot,,Eric Clapton shoot sheriff guess many rioting right none,1
8245,riot,Spare Oom,kill Val I riot Emmerdale,0
8246,riot,SURROUNDED BY WEEABOOS,money can not buy happiness lie tell poor keep riot,1
8247,riot,,bloody hell already upgrade riot hyperbole saintsfc,1
8250,riot,Australia,twitter count riot financial collapse Brazil Rio,1
8251,riot,,would black dude Antioch would rioting,0
8252,riot,NYC,runjewel recently meet BBC discuss race relation America benefit riot LoveIsLove,0
8253,riot,Vidalia GA,reuter like charge inevitable rioting contribute lie,0
8254,riot,Vista CA,Cindy Noonan Cindy Noonan heartbreak Baltimore Rioting YAHIstorical Underground Railraod,1
8256,riot,Serva Fidem,leed fan rioting Embra low tier league cup final dee dum,1
8257,riot,,still riot couple hour leave I class,1
8258,riot,Bellville Ohio,CloydRivers plenty black rioting tosu chionship well,0
8259,riot,trapped America,evacide the Ferguson riots work this next time rioting change anything there fix,1
8261,riot,A little house outback,bbc the Ass British Insurers say rioting cost insurer   million but police number reduce blind fat contr,1
8262,riot,tri state,BHRAMABULL Watch run the Jewels Use fact Defend Rioting Ferguson the socially minded duo take,1
8264,riot,Upstate York,I Twitter invent keep we insomniac riot wee small hour,0
8266,riot,,BLutz rioting justice serve murderer behind bar Simple no justice peace Justice peace,1
8267,riot,,still riot Gmail,0
8270,riot,Scotland United Kingdom,jasalhad brianboru Jimskiv hijink rioting,1
8271,riot,,RyleeDowns nevaehburton I get money tomorrow rioting,0
8274,riot,,why Sweden Venezuela there day riot Venezuela riot direct gr,1
8276,riot,Chicora Oakland,davidolszak riot happy valley penn state lose,0
8278,riot,,aelinrhee group mascara smear girl riot horrific I,1
8279,riot,,the last time high profile name due sign nffc City rioting Wesley Verhoek household name notpanic,1
8280,riot,heart darkness unholy,georgous alternative legal alternative protest Rioting may peaceful thing demonstration,0
8283,riot,Colonial Heights VA,halljh I sick criminal parent friend rioting kill police you give Damn officer,1
8284,riot,,BLutz but rioting begin prior decision indictment really make sense point,1
8285,riot,India,the Ashes Test match currently interesting stupid Congress rioting,1
8286,riot,The Weird Part Wonderland,riot everywhere I I would Usami san love,1
8287,riot,,football hooligan jail rioting game Scotland already ban match England UkNews,1
8288,riot,Alabama,Cindy Noonan Cindy Noonan heartbreak Baltimore Rioting YAHIstorical Underground Railraod,0
8289,riot,A little house outback,AM bbc the Ass British Insurers say rioting cost insurer million but police number reduce blind fat controller,1
8291,riot,Cassadaga Florida,faafa I live family live country looter shoot sight rioting tolerate why,1
8292,rubble,Columbus Georgia,refuse let life reduce rubble when shit keep pile get shovel expirehc,0
8294,rubble,Minna Nigeria,China Stock Market Crash be there gem in the Rubble China stock market crash su Forbes,0
8295,rubble,,if nuclear arm race go rubble bounce Winston Churchill,0
8296,rubble,,accionempresa China stock market crash summer spark interest bargain hunt gerenciatodo,1
8297,rubble,,accionempresa China stock market crash summer spark interest bargain hunt gerenciatodo,0
8298,rubble,,my parent impulsive sometimes I remember come home room fill dust rubble want redesign,0
8300,rubble,,turn rubble disaster Lego brick build house this belong crazyideascollege,0
8301,rubble,AccraGhana,WiseNews China Stock Market Crash be there gem in the rubble,0
8304,rubble,World,FORBES China Stock Market Crash be there gem in the Rubble China stock market crash summer ha,0
8309,rubble,Dubai UAE,forbes europe China Stock Market Crash be there gem in the rubble,1
8310,rubble,,China stock market crash summer spark interest bargain hunter bull bet rebound d,0
8311,rubble,Phoenix Az,JasonPope JohnFugelsang I I refer main building hit rubble,1
8312,rubble,Italy,China Stock Market Crash be there gem in the rubble,0
8314,rubble,London,WiseNews China Stock Market Crash be there gem in the rubble,1
8315,rubble,,Jun Yemenis search survivor rubble house old city Sana follow,1
8317,rubble,ON,China Stock Market Crash be there gem in the Rubble forbesasia,1
8318,rubble,St Louis MO,Steve Buscemi firefightr before fame workd hr shift diggin thru WTC rubble lookg survivor,1
8320,rubble,United States,China Stock Market Crash be there gem in the Rubble tcot p,0
8321,rubble,Spain China Latin America,China Stock Market Crash be there gem in the Rubble China stock market crash summer h forbe,0
8324,rubble,Chester IL,I find diamond rubble,0
8329,rubble,West Africa,TNN China Stock Market Crash be there gem in the rubble,1
8330,rubble,Calgary AB Canada,China Stock Market Crash be there gem in the Rubble roimentor yycwalk,1
8332,rubble,California,China Stock Market Crash be there gem in the rubble,0
8334,rubble,Made Here In Detroit,WiseNews China Stock Market Crash be there gem in the rubble,1
8335,rubble,Portland OR,post China Stock Market Crash be there gem in the rubble,0
8337,rubble,,China Stock Market Crash be there gem in the Rubble China stock market crash summer spark,0
8339,rubble,Dallas Tejas,photo postapocalypticflimflam Prodding around rubble,0
8341,rubble,ATLANTA GEORGIA,WiseNews China Stock Market Crash be there gem in the rubble,0
8344,ruin,CA  GA,okgabby damn suh let ruin bruh well start carpoole like back day,0
8345,ruin,Nashville TN,if I can not ruin mood I may lost direction,0
8346,ruin,,I ruin everything,0
8347,ruin,Depok,quote never let problem ruin faith,0
