id,keyword,location,text,target
1,,,our Deeds Reason earthquake may ALLAH Forgive we,1
4,,,forest fire near La Ronge Sask Canada,1
5,,,all resident ask shelter place notify officer no evacuation shelter place order expect,1
6,,,receive wildfire evacuation order California,1
7,,,just get send photo Ruby Alaska smoke wildfire pour school,1
8,,,Rocky Fire Update California Hwy close direction due Lake County fire CAfire wildfire,1
10,,,flood disaster heavy rain cause flash flooding street Manitou Colorado Springs area,1
13,,,I top hill I fire wood,1
14,,,there emergency evacuation happen building across street,1
15,,,I afraid tornado come area,1
16,,,three die heat wave far,1
17,,,Haha South Ta getting flood hah wait a second I live in south tampa what am I go to do what am I go to do FVCK flood,1
18,,,rain flooding Florida TaBay Ta   day I lose count,1
19,,,Flood Bago Myanmar we arrive Bago,1
20,,,damage school bus multi car crash breaking,1
23,,,what man,0
24,,,I love fruit,0
25,,,summer lovely,0
26,,,my car fast,0
28,,,what goal,0
31,,,ridiculous,0
32,,,London cool,0
33,,,love skiing,0
34,,,what wonderful day,0
36,,,lol,0
37,,,no way I can not eat shit,0
38,,,be NYC last week,0
39,,,love girlfriend,0
40,,,Cooool,0
41,,,do like pasta,0
44,,,the end,0
48,ablaze,Birmingham,bbcmtd Wholesale Markets ablaze,1
49,ablaze,Est September Bristol,we always try bring heavy metal,0
50,ablaze,AFRICA,AFRICANBAZE break Nigeria flag set ablaze Aba,1
52,ablaze,Philadelphia PA,cry Set ablaze,0
53,ablaze,London UK,on plus side LOOK at the SKY last night it be ABLAZE,0
54,ablaze,Pretoria,phdsquare mufc build much hype around acquisition I doubt set EPL ablaze season,0
55,ablaze,World Wide,INEC Office Abia Set Ablaze,1
56,ablaze,,Barbados Bridgetown JAMAICA two car set ablaze SANTA CRUZ Head St Elizabeth Police Superintende,1
57,ablaze,Paranaque City,ablaze Lord D,0
59,ablaze,Live On Webcam,check nsfw,0
61,ablaze,,outside ablaze alive dead inside,0
62,ablaze,milky way,have awesome time visit CFC head office ancop site ablaze Thanks Tita Vida taking care we,0
63,ablaze,,soooo PUMPED for ABLAZE southridgelife,0
64,ablaze,,I want set Chicago ablaze preaching but hotel,0
65,ablaze,,I gain follower last week you know stat grow,0
66,ablaze,GREENSBORONORTH CAROLINA,how West burn Thousands wildfire ablaze California alone,1
67,ablaze,,build perfect tracklist life leave street ablaze,0
68,ablaze,Live On Webcam,check nsfw,0
71,ablaze,England,first night retainer it quite weird well get use I wear every single night next least,0
73,ablaze,Sheffield Township Ohio,deputy Man shoot Brighton home set ablaze,1
74,ablaze,India,man wife get six year jail set ablaze niece,1
76,ablaze,Barbados,SANTA CRUZ Head St Elizabeth Police Superintendent Lanford Salmon,0
77,ablaze,Anaheim,Police Arsonist deliberately Set Black Church in North CarolinaAblaze,1
78,ablaze,Abuja,Noches El Bestia AlexisSanchez happy teammate train hard goodnight gunner,0
79,ablaze,USA,kurd trle Turkmen flag later set ablaze other vandalize office Turkmen Front Diyala,1
80,ablaze,South Africa,TRUCK ablaze r voortrekker AVE OUTSIDE or tambo INTL CARGO section,1
81,ablaze,Sao Paulo Brazil,set heart ablaze every city gift and every skyline like kiss upon lip,0
82,ablaze,hollywoodland,they sky ablaze tonight Los Angeles I expect IG FB fill sunset shot I peep,0
83,ablaze,Edmonton Alberta Treaty,how West burn Thousands wildfire ablaze California alone climate energy,1
85,ablaze,,revel wmv video mean mac farewell ablaze wmv en route dvd GtxRWm,0
86,ablaze,Inang Pamantasan,progressive greeting in month student would set pen ablaze the Torch Publications,0
89,ablaze,Twitter Lockout progress,Rene Ablaze Jacinta Secret k Fallen Skies Edit Mar,0
91,ablaze,Concord CA,Navista Steve fire something else California tinderbox clown set hood ablaze news,1
92,ablaze,Calgary AB,NowPlaying Rene Ablaze Ian Buff Magnitude EDM,0
93,ablaze,Birmingham,nxwestmidland huge fire wholesale market ablaze,1
95,ablaze,San Francisco,ablaze time talk I I due work,0
96,accident,CLVLND,I can not kid cuz I get bicycle accident split testicle impossible kid MICHAEL you be the FATHER,0
97,accident,Nashville TN,accident I W NashvilleTraffic Traffic move m slow usual,1
98,accident,Santa Clara CA,accident center lane block SantaClara NB Great America Pkwy BayArea Traffic,1
100,accident,UK,have personalinjury accident summer Read advice solicitor help OtleyHour,0
102,accident,St Louis MO,stlouis caraccidentlawyer speeding among Top Causes Teen Accidents Car Accident tee,0
104,accident,Walker County Alabama,report motor vehicle accident Curry Herman Rd near Stephenson involve overturn vehicle please use,1
105,accident,Australia,bigrigradio live Accident Awareness,1
107,accident,North Carolina,I Mile Marker South Mooresville Iredell Vehicle Accident R Closed    pm,1
109,accident,,sleepjunkie sleep pill double risk car accident,0
110,accident,Norf Carolina,by accident know gon happen,0
112,accident,San Mateo County CA,traffic accident N CABRILLO HWY MAGELLAN AV MIR,1
113,accident,North Carolina,I Mile Marker   South Mooresville Iredell Vehicle Accident Congestion    pm,1
114,accident,Njoro Kenya,pastor scene accident owner range rover,1
117,accident,,mom get home fast wish mom accident truck spilt mayonnaise,0
118,accident,Your Sisters Bedroom,I horrible car accident past Sunday I finally able get around thank GOD,1
119,accident,,can wait piss Donnie I tell I another accident,0
120,accident,Arlington TX,TruckCrash overturn on FortWorth Interstate Click crash,1
121,accident,South Bloomfield OH,Accident Ashville SB SR traffic,1
126,accident,,Carolina accident Motorcyclist die I crash with car that cross Median a motorcycle rider travel,1
128,accident,Hanover County NC,FYI CAD FYI accident property damage NHS Piner RD Horndale DR,1
129,accident,Maldives,naayf first accident year turn onto Chandanee Magu near MMA Taxi ram I halfway turn everyone conf,1
130,accident,Manchester NH,accident leave lane block Manchester Rt NB Eddy Rd stop traffic back NH a delay min traffic,1
131,accident,Wilmington NC,accident property DAMAGE Piner RD Horndale DR,1
132,accident,,accident,0
133,accident,Hanover County NC,FYI CAD FYI accident property damage WPD TH ST,1
134,accident,,PM TRAFFIC accident no INJURY WILLIS FOREMAN RD,1
135,accident,global,Aashiqui Actress Anu Aggarwal on her Near Fatal accident,1
136,accident,Alberta Sask Montana,Suffield Alberta Accident,1
137,accident,Charlotte,mile backup I south accident block Right Lanes Exit Langtree Rd consider NC NC NC alternate,1
138,accident,Baton Rouge LA,have accident change life we help determine option financially support life care plan go treatment,0
139,accident,Hagerstown MD,break deadly motorcycle car accident happen Hagerstown I detail YourState WHAG,1
141,accident,Gloucestershire UK,flowri marinade accident,0
143,accident,,car even week get fucking car accident Mfs can not fucking drive,1
144,accident,UK,norwaymfa Bahrain police previously die road accident kill explosion,1
145,accident,Nairobi Kenya,I still hear Church Leaders Kenya come forward comment accident issue disciplinary measure arrestpastornganga,0
146,aftershock,Instagram heyimginog,aftershockdelo scuf ps live game ya,0
149,aftershock,,the man drive effort get painful man win Roger Bannister,0
151,aftershock,Switzerland,IR icemoon AFTERSHOCK dj icemoon Dubstep Trap Music dnb EDM Dance Ices,0
153,aftershock,,there victory bargain basement price Dwight David Eisenhower,0
156,aftershock,,IR icemoon AFTERSHOCK dj icemoon Dubstep Trap Music dnb EDM Dance Ices,0
157,aftershock,,nobody remember come second Charles Schulz,0
158,aftershock,Instagram heyimginog,aftershockdelo speak someone use scuf xb end get ps also,0
159,aftershock,,the hard conflict glorious triumph Thomas Paine,0
160,aftershock,,GrowingUpSpoiled go clay pigeon shoot cry aftershock,0
161,aftershock,Somewhere Only We Know,so guess actually want free Aftershock TC,0
162,aftershock,,aftershock terrify good roller coaster I ever disclaimer I,0
163,aftershock,Belgium,aftershock,0
164,aftershock,Switzerland,IR icemoon AFTERSHOCK dj icemoon Dubstep Trap Music dnb EDM Dance Ices,0
165,aftershock,,IR icemoon AFTERSHOCK dj icemoon Dubstep Trap Music dnb EDM Dance Ices,0
168,aftershock,,IR icemoon AFTERSHOCK dj icemoon Dubstep Trap Music dnb EDM Dance Ices,0
170,aftershock,dope show,KJForDays I see issue aftershock,0
171,aftershock,Switzerland,IR icemoon AFTERSHOCK dj icemoon Dubstep Trap Music dnb EDM Dance Ices,0
172,aftershock,Switzerland,IR icemoon AFTERSHOCK dj icemoon Dubstep Trap Music dnb EDM Dance Ices,0
173,aftershock,Oshawa Canada,WisdomWed BONUS Minute Daily Habits could really improve life how many already lifehack,0
174,aftershock,Baker City Oregon,Aftershock Protect Yourself Profit Next Global Financial Meltdown David Wiedemer http,0
175,aftershock,,that moment get scary roller coaster guy behind scream bloody murder silverwood aftershock,0
176,aftershock,,aftershock a Fulla Streaming YouTube,0
178,aftershock,United States,Aftershock Protect Yourself Profit Next Global Financial book esquireattire,0
180,aftershock,,sometimes face difficulty something wrong something right Joel Osteen,0
182,aftershock,,the thing stand dream try belief actually possible Joel Brown,0
183,aftershock,marysville ca,praise God ministry tell like wdyouth biblestudy,0
184,aftershock,,remember go die good way I avoid trap think something lose Steve Jobs,0
185,aftershock,Hermosa Beach CA,try orange aftershock my life never,0
187,aftershock,,onfireander I love bb,0
190,aftershock,,aftershock,0
191,aftershock,,aftershock back school kick great I thank everyone make possible what great night,0
193,aftershock,,can not do interrupt George Bernard Shaw,0
194,aftershock,,the first man get oyster second man get Andrew Carnegie,0
195,aftershock,,anyone need p you tonight I play Hybrid Slayer ps EU HMU Codsandscrims EmpirikGaming codawscrim TPKOTC TPFA aftershockorg,0
196,airplane accident,,expert France begin examine airplane debris find Reunion Island french air accident expert,1
197,airplane accident,Pennsylvania,strict liability context airplane accident Pilot error common component aviation cr,1
198,airplane accident,Salt Lake City Utah,crobscarla lifetime odd die airplane accident,0
199,airplane accident,Palo Alto CA,expert France begin examine airplane debris find Reunion Island french air accident expert Wedn,1
201,airplane accident,,AlexAllTimeLow awwww airplane accident go die cutie good job,1
203,airplane accident,Spain OpaLocka FL,family member osama bin laden die airplane accident ironic mhmmm gov shit suspect,1
204,airplane accident,Jaipur India,man go Airplane Engine Accident YouTube,1
205,airplane accident,Hyderabad Telangana INDIA,horrible Accident man die in Wings Airplane,1
208,airplane accident,Eagle Pass Texas,a Cessna airplane accident Oco Coahuila Mexico July   kill four man include State Coahuila government official,1
209,airplane accident,bangalore,horrible Accident man die in Wings Airplane   WatchTheVideo,1
210,airplane accident,Financial Views,expert France begin examine airplane debris find Reunion Island french air accident expert Wednesday,1
211,airplane accident,,expert France begin examine airplane debris find Reunion Island french air accident expert Wednesday begin examine,1
212,airplane accident,Indonesia,KCA VoteJKTID mbataweel RIP BINLADEN Family member kill airplane accident,1
213,airplane accident,boyfriends legs,I almost send coworker nude accident thank god airplane mode,0
215,airplane accident,Mexico USA,mickinyman TheAtlantic that might kill airplane accident night car wreck politic good,0
216,airplane accident,Somewhere Out There,expert France begin examine airplane debris find Reunion Island french air accident expert MLB,1
218,airplane accident,,this unbelievably insane man airport airplane aircraft aeroplane runway accident freaky,1
219,airplane accident,Mumbai india,horrible Accident man die in Wings Airplane,1
220,airplane accident,sri lanka,horrible Accident man die in Wings Airplane,1
221,airplane accident,Not resident,Usama bin Ladins family dead airplane crash naturally accident,1
222,airplane accident,,pilot die in Plane Crash at Car Festival YouTube Crash Aircraft Airplane Pilot Death Accident CarFest,1
225,airplane accident,Lehigh Valley PA,strict liability context airplane accident,1
226,airplane accident,Canada,DTN Brazil Experts France begin examine airplane debris find Reunion Island french air accident exp,1
229,airplane accident,,expert France begin examine airplane debris find Reunion Island french air accident expert Wedn,1
231,airplane accident,Thrissur,horrible Accident man die in wing of Airplane   WTF you can not believe your eyes,1
232,airplane accident,Havenford,Nicole Fletcher victim crash airplane time ago the accident leave little bit trauma although,1
235,airplane accident,India,OMG Horrible Accident man die Wings airplane,1
237,airplane accident,,OMG I believe RIP bro AirPlane Accident JetEngine TurboJet boe g,1
238,airplane accident,,expert France begin examine airplane debris find Reunion Island french air accident expert Wednesday begin examine,1
240,airplane accident,Israel,I airplane accident,1
241,airplane accident,Fashion Heaven IG TMId,my phone look like car ship airplane accident Terrible,0
242,airplane accident,San Francisco CA,statistically I risk getting kill cop I die airplane accident,0
243,airplane accident,italy,airplane crash house Colombia die accident,1
244,airplane accident,nyc,the shoot airplane accident,1
245,airplane accident,Toronto,could drone airplane accident Pilots worried use drone esp close vicinity airport,1
246,ambulance,,early wake call sister beg ride withher ambulance hospital RODKiai,1
247,ambulance,Jackson,twelve fear kill pakistani air ambulance helicopter crash,1
248,ambulance,York Worldwide,two air ambulance scene serious crash two car lorry EMSNe,1
249,ambulance,,twelve fear kill pakistani air ambulance helicopter crash Reuters yugvani,1
251,ambulance,Orleans LA,lead emergency service boss welcome ambulance charity,0
252,ambulance,West Wales,anyone travel Aberystwyth Shrewsbury right incident Services halt outside Shrews Ambulance scene,1
253,ambulance,,twelve fear kill pakistani air ambulance helicopter crash,1
254,ambulance,Happily Married kids,AMBULANCE SPRINTER AUTOMATIC frontline vehicle choice of LEZ COMPLIANT eBay,0
256,ambulance,Cambridge MA,Nanotech device will be able to target and destroy blood clot,0
258,ambulance,Arizona,skyhawkmm traplord fredosantana LilReese hella crazy fight ambulance couple mosh pit,1
260,ambulance,Mumbai,if I get run ambulance I lucky justsaye randomthought,0
261,ambulance,,twelve fear kill pakistani air ambulance helicopter crash dna,1
262,ambulance,Amsterdam,twelve fear kill pakistani air ambulance helicopter crash,1
263,ambulance,SwindonEngland,TanSlash wait ambulance,0
264,ambulance,,fouseyTUBE ok Need ambulance Hahahah good,0
265,ambulance,Happily Married kids,AMBULANCE SPRINTER AUTOMATIC frontline vehicle choice of LEZ COMPLIANT eBay,0
266,ambulance,,Pakistan air ambulance helicopter crash kill nine,1
267,ambulance,Williamstown VT,thenissonian RejectdCartoons nissan ok need medical assistance call ambulance need,0
268,ambulance,North Carolina USA,EMS NY emt petition per hour minimum wage ems paramedics ambulance,0
269,ambulance,,twelve fear kill pakistani air ambulance helicopter crash,1
270,ambulance,Karachi,twelve fear kill pakistani air ambulance helicopter crash,1
271,ambulance,Happily Married kids,AMBULANCE SPRINTER AUTOMATIC frontline vehicle choice of LEZ COMPLIANT eBay,0
272,ambulance,Happily Married kids,AMBULANCE SPRINTER AUTOMATIC frontline vehicle choice of LEZ COMPLIANT eBay,0
273,ambulance,Loveland Colorado,KiwiKaryn Check parking lot he say last ambulance St Johns,0
274,ambulance,c h c g,way ambulance come,1
276,ambulance,,reuter Twelve fear kill pakistani air ambulance helicopter crash,1
277,ambulance,L A,twelve fear kill pakistani air ambulance helicopter crash,1
279,ambulance,,why ambulance right outside work,0
280,ambulance,Canada,LeoBlakeCarter this dog think ambulance natasharideout,0
281,ambulance,VISIT MY YOUTUBE CHANNEL,happen now HATZOLAH EMS AMBULANCE respond with dual sirens and,0
283,ambulance,Lexington,twelve fear kill pakistani air ambulance helicopter crash,1
285,ambulance,,twelve fear kill pakistani air ambulance helicopter crash,1
287,ambulance,USA,twelve fear kill pakistani air ambulance helicopter crash worldnew,1
289,ambulance,Hannover Germany,twelve fear kill pakistani air ambulance helicopter crash worldnew,1
290,ambulance,,what police ambulance number Lesotho any body,0
291,ambulance,,medic AACEorg I surprise still can not standardised clinical practice across NHS ambulance trust,0
293,ambulance,Playa,twelve fear kill pakistani air ambulance helicopter crash,1
294,ambulance,Davidson NC,try j walk ambulance pass I hate,0
296,annihilate,Higher Places,the episode trunk annihilate Freiza clean shit ever he show nigga mercy,0
297,annihilate,Horsemind MI,they shall be annihilated and all of their petebest dessicate and LAID BARE then you shall kneel before I,0
298,annihilate,York NY,Uribe annihilate baseball met,0
299,annihilate,Boksburg,marksmaponyane Hey Sundowns annihilate previous meeting Celtic indeed improvement,0
301,annihilate,,Volfan TNeazzy Mizzou annihilate florida past season even end musch career can not compete Bama,0
302,annihilate,,Annihilated abs,1
303,annihilate,,be annihilate status education mba behalf easy street careen eOvm,0
307,annihilate,VRP OZRP MV AU R,Luka they die all everything annihilate Alois Trancy,0
309,annihilate,Greater Manchester UK,acarewornheart have good un fella sorry I get annihilate,0
310,annihilate,Boston,cop pull drunk driver safety SECONDS car hit train Viral Spell,1
312,annihilate,,you must annihilate,0
313,annihilate,,cop pull drunk driver safety SECONDS car hit train Viral Spell,1
314,annihilate,The Canopy Kingdom,BOOM your country entirely annihilate h Britain,0
315,annihilate,,AmirKingKhan would annihilated might well thank FloydMayweather,0
316,annihilate,USA,one thing sure God promise Israel annihilate but horror Iran withnuke,0
318,annihilate,,violentfeminazi I guess ok Armenians since spend history getting annihilate,1
320,annihilate,,year since annihilate instantly become aware ability annihilate whole humanity,1
321,annihilate,zone layer,day tryout go good minus fact I stop quickly get short ball annihilated toenail injury even,0
322,annihilate,London,during s oryx symbol Arabian Peninsula annihilate hunter,1
327,annihilate,Trancy Manor,to Luka they die all everything annihilate Alois Trancy,0
328,annihilate,,ready get annihilate BUCS game,1
329,annihilate,South,PhilipDuncan breakfastone annihilate last night weather Really Philip think would forecast,1
330,annihilate,,domain sophistication annihilate closely minute feat ZrNf,0
331,annihilate,West Lancashire UK,stormbeard steellord I see Judas Priest Rob come back Scorpions support fucking annihilated place Astonishing gig,0
332,annihilate,PA,officially skip Fantastic Four Fantstic whatever hashtag it get annihilated review Bummer,0
334,annihilate,,tomcatart thus explain annihilate but case survivor evolve become godlike,1
335,annihilate, Views From The Six ,completely annihilate cech paul keegan time alive,0
336,annihilate,,tomcatart annihilate legion the survivor imperfect hybrid project quickly form secret cell,0
337,annihilate,University Toronto,sirbrandonknt exactly that lesnar cena match summerslam last great brock annihilate guy,0
338,annihilate,,cop pull drunk driver safety SECONDS car hit train Viral Spell,1
340,annihilate,Swaning Around,ANNIHILATED in DAMASCUS syrian army grind ALLOOSH and his gang into the MANURE pile,1
341,annihilate,,thatde ok completely forthright may also food coma kebab tahini pickle also annihilate withfrie,0
344,annihilate,London,a fun fill happy hour Simmons bar Camden handsome I get annihilate apart game,0
345,annihilate,AlbanyNY,Juanny Beisbol Sr Annihilated ball LGM,0
346,annihilation,California USA,rvfriedmann Hell fraction belief total annihilation destruction USA LodiSilverado ritzyjewel,1
347,annihilation,,POTUS maybe call Israel tell sorry Pres sell river annihilation,0
348,annihilation,,Evildead Annihilation Civilization,0
349,annihilation,,you National Park Services Tonto National Forest Stop Annihilation Salt River Wild Horse change,0
352,annihilation,Wild Wild Web,annihilate quarterstaff annihilation,1
353,annihilation,Subconscious LA,World Annihilation vs Self Transformation Aliens Attack Exterminate Humans,0
354,annihilation,Spain,StarMade Stardate Planetary Annihilation YouTube,1
355,annihilation,,you National Park Services Tonto National Forest Stop Annihilation Salt River Wild Horse change,0
356,annihilation,CA physically Boston Strong,you National Park Services Tonto National Forest Stop Annihilation Salt River Wild Horse change,1
358,annihilation,Yeezy Taught Me NV,kimkardashian please sign share petition save wild horse Arizona,0
360,annihilation,,you National Park Services Tonto National Forest Stop Annihilation Salt River Wild Horse change,1
361,annihilation,CA physically Boston Strong,theellenshow please check Salt River horse help stop annihilation happen without signature change org thank,0
363,annihilation,United States,be soul punish withannihilation,0
364,annihilation,,CalFreedomMom steph mention major contributor annihilation Israel,1
365,annihilation,,willienelson we need help horse die please sign petition take stand voice gilbert,1
368,annihilation,Rock Hill SC,I reject law misguide false prophet imprison nation fuel self annihilation,0
370,annihilation,Coolidge AZ,you National Park Services Tonto National Forest Stop Annihilation Salt River Wild Horse change,0
371,annihilation,Republic Texas,the annihilation Jeb Christie Kasich less hour away please God allow least full day,0
372,annihilation,,BarbiTwins we need help horse die please sign petition take stand voice gilbert,0
375,annihilation,,Whippenz we need help horse die please sign petition take stand voice gilbert,0
380,annihilation,Phoenix AZ,hey AZ Sign petition save Wild horse tantonationalforest a RollingStones sing long order,0
381,annihilation,Ljubljana Slovenia,stop Annihilation Salt River Wild Horses change,1
383,annihilation,Connecticut,SonofBaldwin current Nova bookslast I check tie book Rider die annihilation,0
384,annihilation,TacomaWashington,you National Park Services Tonto National Forest Stop Annihilation Salt River Wild Horse change,0
386,annihilation,,please sign save SaltRiverWild horse,0
389,annihilation,,thank count DANTE do JOIN by follow the ANNIHILATION zone JOHNNY,0
390,annihilation,Subconscious LA,World Annihilation vs Self Transformation Aliens Attack Exterminate Humans,1
393,annihilation,BIG D HOUSTONBOSTONDENVER,you National Park Services Tonto National Forest Stop Annihilation Salt River Wild Horse change,0
394,annihilation,Chandler AZ,you National Park Services Tonto National Forest Stop Annihilation Salt River Wild Horse change,1
396,apocalypse,ColoRADo,I go fight Taylor soon I get,0
397,apocalypse,sindria,ohh no FUKURODANI DIDN t SURVIVE the apocalypse BOKUTO feels horrible poor boy ppor child,1
398,apocalypse,,another jocelyn birthday apocalypse,0
401,apocalypse,,janenelson StephenSCIFI Adaptation Watch Charlie Human apocalypse now now optione Film sciencefiction,0
402,apocalypse,Texas,apocalypse please,0
404,apocalypse,Elk Grove CA USA,another hour it August    pm here Red Rover Zombie Apocalypse internetradio collegeradi,1
406,apocalypse,Texas,HoneyBunzGem primalkitchen I feel like pull stage apocalypse,0
407,apocalypse,,she kind hot play radio what next Disease the apocalypse start everyone be careful,0
409,apocalypse,The Shire,but apocalypse lol gf m,0
410,apocalypse,Austin TX,I question interpretation sign apocalypse I call,1
412,apocalypse,Oakland,Julie R apocalypse version Romeo Juliet warmbodie,0
413,apocalypse,,apocalypse upon we,0
415,apocalypse,,fittscott Minecraft NIGHT LUCKY BLOCK MOD BOB apocalypse WITHER   MORE Mod Showcase Popular MMOs vi,0
418,apocalypse,Albuquerque,and begin day snow apocalypse,1
419,apocalypse,,OurMotherMary Short Reading Apocalypse   in spirit angel take top enormous high mountain,0
420,apocalypse,Buenos Aires Argentina,candylit Imagine sarumi zombie apocalypse fight back back Heart heart conversation,0
421,apocalypse,,ZONEWolf I like YouTube video Minecraft NIGHT LUCKY BLOCK MOD BOB apocalypse WITHER   MORE mo,0
423,apocalypse,,and planet lone audience apocalypse,0
424,apocalypse,San Antonioish TX,Dad buy DVD look like science doc front I read back actually impend biblical apocalypse,1
426,apocalypse,San Francisco,alexandrapullin it indeed if apocalypse come week I I,0
427,apocalypse,Oregon USA,look at GRIZZLY PEAK right now it look like begin dystopian apocalypse movie,0
429,apocalypse,Harlingen TX,my niece ask would scared apocalypse,0
432,apocalypse,Buffalo NY,there Storm Cairo late X Men apocalypse set photo YahooTV,1
435,apocalypse,,Minecraft NIGHT LUCKY BLOCK MOD BOB apocalypse WITHER   MORE Mod Showcase Popular mmo YouTube,0
436,apocalypse,,shoot through the Heart XV you going totally give love bad name heart pierc,0
437,apocalypse,,GeekApocalypse pm GMT Hesse play dark soul day etcpb,0
438,apocalypse,Las Vegas,I zombie take,0
440,apocalypse,,the late BryanSinger reveal storm queen Apocalypse RuPaul AlexShipppp,1
442,apocalypse,,shadow box apocalypse,1
443,apocalypse,,short Reading Apocalypse   in spirit angel take top enormous high mountain,1
444,apocalypse,Tokyo,enjoy live action Attack Titan every time I poster I remind freshly clean coiffed everyone apocalypse,0
445,apocalypse,,I like YouTube video Minecraft NIGHT LUCKY BLOCK MOD BOB apocalypse WITHER   MORE Mod Showcase,0
446,armageddon,California United States,PBBan Temporary avYsss armageddon do not kill FLAGS only Fast XP reason,0
