id,keyword,location,text,target
2560,crash,,sterlingknight who car crashsterle who drive carmel JoeySterling Knight,0
2561,crash,AixenProvence France,daewony alright I go crash I exhaust,0
2564,crash,Liverpool,Party Bestival crash victim Michael Molloy would st,1
2565,crash,I Florida,CLEARED Crash Hamilton I south MM,1
2566,crash,,deliver Value a Cash Source Crash Course course,1
2568,crash,,the Next Financial Crash the writing Wall Say you be warn,0
2569,crash,Cleveland OH,boy crash,0
2570,crash,,make man pikin crash,1
2571,crash,Melbourne Australia,INCIDENT Crash Pascoe Vale South outbound Tullamarine Fwy CityLink near Moreland Rd Vehicles emergency lane no delay,1
2572,crash,,I let another love crash burn,0
2573,crash,Darlington,if sit rant snapchat apparent fan follower I hope train crash xoxo,0
2575,crash,,crash burn,1
2576,crash,,cPanel Crash Course course,0
2579,crash,Melbourne Australia,DestinyTheGame Bungie PlayStation Getting kick crash bad experience I play video game,0
2582,crash,Kenton Ohio,chelsdelong kendraleigh I crash,1
2585,crash,Galatians,please keep Josh Salyers Blair Hall family Jenna friend prayer she take far soon RIP,0
2587,crash,,one night go crash party be invite feelin,0
2588,crash,Charleston SC,fatal crash report Johns Island,1
2590,crash,,Photoshop Tools Crash course Complete Photoshop Tool Guide course,0
2591,crash,,Photoshop CS Crash Course course,0
2592,crash,,Kinetic Typography Crash course after Effects Video course,0
2593,crash,Lancaster Pennsylvania USA,Police respond crash find suspect heroin,1
2594,crash,,I dat liable fuck crash,0
2597,crash,In world,AKILAH WORLD Cop pull man car avoid,1
2598,crash,,man kill crash Barrington Hills A Hoffman Estates man kill single car crash Wednesday afte,1
2599,crash,,crash helmet silvery floor karnal fat shoot sle PBCaNPCx,0
2602,crash,San Francisco CA,Crash Test Trailer Paul Scheer Rob Huebel Comedy Special record,0
2603,crash,Definitely NOT stables,spicybread coxytown try download crash tutorial,0
2604,crash,Pakistan,Maj Muzzamil Pilot Offr MI crash near Mansehra,1
2605,crash,Cuernavaca Morelos MÌ©xico,Bin Laden family plane crash avoid microlight landi PeritoEnGrafoscopia,1
2606,crash,,my son sleep night finally be I lay bed crash,0
2608,crash,Scotland,NeilEastwood I be a KNOBHEAD Bin Laden family plane crash avoid microlight landing,1
2609,crash,,Bin Laden family plane crash avoid microlight landing far runway three member,1
2611,crash,,brianroemmele UX fail EMV insert remove quickly like gas pump stripe reader person tell crash POS,1
2612,crash,,Major Hamayun Shaheed pilot MI heli crash Mansehra,1
2614,crash,Va Beach Virginia,UK Bin Laden family plane crash avoid microlight landing far runway three member,1
2616,crash,,rosewell crash many time past couple hour,0
2617,crash,The Pig Sty,Bin Laden family plane crash avoid microlight landing far runway rochdale heywood,1
2619,crash,,my iPod crash WeLoveYouLouis MTV Hottest one direction,1
2621,crash,Bangor CoDown,johndcgow hear day ago drive near crashed car laugh much,0
2622,crash,Weston super mare,olliebailey havnt crash,0
2624,crash,,could anyone tell crash take long time Windows PLEASE,0
2625,crash,Victoria Tx,intact Malaysia Airlines Flight Part Lifts Odds plane glide not crash into Sea YahooFinance Hope answer,1
2627,crash,Pakistan Islamabad,Pak Army Helicopter crash Mansehra,1
2628,crash,Lincoln NE,the bug almost crash Euro,1
2629,crash,,Pakistan say army helicopter crash country restive northwest killing least,1
2631,crash,,Bin Laden family plane crash avoid microlight landing far runway,1
2632,crash,London,this guy buy car Tuesday police knock door yday cos crash n run day text ask send log book,1
2633,crash,Gujranwala Pakistan,Maj Muzzamil Pilot Offr MI crash near Mansehra May Almighty give strength family bear loss,1
2635,crash,Lindenhurst,thief break Front Window of Hicksville Store Stole Cell Phones flee crash into,0
2637,crash,Islamabad,army source person board include team doctor die helicopter crash near Mansehra weather seem crash,1
2640,crash,Somewhere,SmusX Skype crash host,0
2641,crash,,I already phone update   somehow phone crash I restore let restore,0
2642,crash,far,he second fast I overtook twice crash tru love love love,0
2643,crash,Kingswinford,I nearly crash car type Paul Rudd attack fly ant note phone,0
2644,crash,love smurfs,honestly nightmarish God drive place always stressful shit hate much Ugh almost crash time,0
2645,crash,,I crash car park car day modestmouseremix truestory,0
2647,crash,,fD mhtwfnet Pakistan say army helicopter crash country restive northwest Fox,1
2648,crash,International,TTW today Bin Laden family plane crash avoid microlight landing far runway,1
2649,crash,Viterbo BFA Acting,Heard SKH radio first time almost crash car SOS AshtonSOS LukeSOS MichaelSOS Calum Hood,1
2651,crash,Buenos Aires,Malaysia Airlines Flight Intact part lift odd plane glide crash sea,1
2655,crush,Kaneohe,kuualohax like love husband post another man man crush Monday lol,0
2656,crush,Houma La,Womem Crush Wednesday mommyisbomb,0
2657,crush,,jorrynja bf gf crush Terell,1
2658,crush,,this guy make woman crush first ever,0
2659,crush,EastAtlanta WestGeorgia,WCE I can not even lie even though I can not stand still always crush explicitpretty,0
2660,crush,San Antonio TX,woman crush,0
2661,crush,Cleveland Ohio,my woman crush wedneday go beautiful taykreidler loveyouuuu aintsheperty,0
2663,crush,,be bestfriend high school crush yourboyshawn,0
2664,crush,,Ina Buted Girl crush,1
2666,crush,Everywhere,samelsamel crush,0
2667,crush,,I woman crush,0
2668,crush,San Diego Texas,love love love remember first crush,0
2670,crush,GLOBAL,have minute alone crush overrate experience smh,0
2671,crush,,pydisney que crush MTV Hottest Justin Bieber,0
2672,crush,Everywhere,masterfsloth crush,0
2673,crush,,my Lil brother crush mariah,0
2675,crush,,Ron Fez Dave High School Crush YouTube,1
2676,crush,Bolivar MO,when girlfriend completely gorgeous woman crush stuff,0
2677,crush,taking pain like pleasure,I high moe I bouta crush Friday,0
2679,crush,San Fransokyo,I big crush I ever,0
2680,crush,Washington DC NATIVE,mrrobinson give TheSteveHarveyShow vibe Music teacher look student crush girl go high school,0
2682,crush,,seriously big girl crush ever Blake Lively,0
2683,crush,,when crush stand Vine KhadiDon,0
2684,crush,Everywhere,yhngsjlg tweet secret crush,0
2687,crush,Miami FL,starflamegirl yeah I crush,0
2688,crush,,I try cute wen crush pass,0
2689,crush,Utah,Crush Content MarketingMediocrity,0
2691,crush,,only crush girl high school even realize lol,0
2692,crush,Everywhere,sevenfigz crush,1
2693,crush,,MEN CRUSH every FUCKING DAY,0
2694,crush,Everywhere,tiffanyfrizzell crush,0
2695,crush,w Nykae,More crush WCE nykaeD,0
2696,crush,honeymoon avenue,jaureguiswisdom laugh ass well crush sooo,0
2698,crush,Toronto Worldwide,NowPlaying Fitz and the Tantrums out of my League Crush listen NowPlaying,0
2700,crush,,man crush everyday CristianInspire,0
2701,crush,,love love I playa I crush lot,0
2702,crush,,kenny holland crush da vida,0
2703,crush,,crush,0
2706,crush,,popeyes bout get crush,0
2707,crush,,that crush holy shit,0
2708,crush,wherever theres netflix,bhavana mom have crushed everyone SOUL,0
2709,crush,,crush,0
2711,crush,,wrapup you cable tv company share crush Disney disappoint,0
2714,crush,Chicago IL,jimmy fallon I crush squirrel bone mortar pestle school bio dept really sure bad Summer Job,0
2715,crush,HAMont,Edwin wow crush,0
2719,crush,,Mango juice crush ice,0
2720,crush,UK,man crush death car,1
2723,crush,ph,a diamond piece charcoal handle stress exceptionally well we hard press every side crush cor,1
2724,crush,,wow he crush EDWING BlueJays,0
2725,crush,,crush gym crush butterfinger flurry clearly priority straight,0
2726,crush,online,wrapup you cable tv company share crush Disney disappoint,0
2727,crush,,jmastrodonato question would crush Ortiz bunt sport writing forefather crush Williams,0
2728,crush,Conroe TX,big Brother ouch Clelli could almost hear hope dream crush,0
2729,crush,Ontario Canada,Jesus Christ ball fucking crush BlueJays,0
2730,crush,Guayaquil,I crush   km run pace   Nike SportWatch gps nike plus,0
2731,crush,bahstunporta reeko,papi absolutely crush ball,0
2732,crush,Bucks County Pa,crush mile run tonight awesome,0
2733,crush,Sunny South florida,wrapup you cable tv company share crush Disney disappoint,0
2734,crush,Rio,oil price fall driver could reap benefit,0
2736,crush,Neverland,I crush   km run pace   Nike SportWatch gps nike plus,0
2739,crush,Pennsylvania,Nick Williams hit another bomb just crush,0
2740,crush,,Holy moly crush,1
2741,crush,,AyekoRadio play Brasswork Agency crush Shaken Radio NetLabel ElectronicMusic listen CCMusic,0
2743,crush,,so many Youtube commenter say Dothraki would get crush come Westeros nah bro underestimate Dothraki,1
2744,crush,Trinidad Tobago,disillusioned lead character Check Happy lucky free spirit girl Check Dream life crush Check great music check all Crowe trope intact,0
2748,crush,Chicago Lake Buena Vista,remember Nora Jones crush two Weeks Notice,0
2749,crush,Toronto Ontario,how Empire Avenue crush soul markwschaefer,0
2752,crush,Liberty Lake WA,M Chapoutier croze Hermitage much purple violet slate crush gravel white pepper Yum france wine DC,0
2753,curfew,,thecomedyquote shadezofgrey thirst curfew PPerez,0
2755,curfew,Ankara Malatya ad Orontem,ARA report JaN fighter infiltrate Ashrafiyah district Afrin aim carry suicide attack YPG impose curfew,1
2756,curfew,,keurley thirst curfew,0
2757,curfew,,and fact curfew,0
2758,curfew,antioch california,michelleellle shut freshman past curfew need sleep spend much time watch tv instead go outside,0
2759,curfew,State College PA,be night curfew cus find,0
2760,curfew,Chicago IL,Police Teenagers arrest curfew violation Evanston ride steal bicycle two teenager take cus Chicago,1
2761,curfew,,reason listen curfew overtime stick kodak,0
2763,curfew,somewhere cali,bobbyxfish I give curfew,0
2765,curfew,Im Around Jersey,curfew really help if because,0
2766,curfew,Garden Grove,ExOfficio Men Boxer Brief Curfew Large,0
2767,curfew,Adelaide Australia,INFO WND   CLD SCT BKN EXP INST APCH RWY CURFEW in OPER until z taxi way FOXTROT FOXTROT NAVBL TMP,0
2768,curfew,,emaaalay thank I city wide curfew,0
2769,curfew,,she say curfew nope,0
2770,curfew,BKIKUA,her curfew start right private class end tutor must woman preferably someone,0
2771,curfew,,aptlyengineerd there curfew,0
2773,curfew,urÌ£nus,it past curfew Grove,0
2774,curfew,Illinois USA,emmychappy because clock mom say everyone home curfew,1
2777,curfew,AAS Aztec Princess,Reddakushgodd say month but I get curfew time smfh,0
2778,curfew,turner fenton,ball curfew,0
2780,curfew,,ScotRail see turn blind eye bloke drinking smoking curfew time cos worth hassle,1
2782,curfew,KLAUganda,next May I free school obligation like family Best damn curfew,1
2783,curfew,Uganda,DavisKawalya I Mauryn say final goodbye grandpa see RiP I always open idea may curfew,0
2784,curfew,,really still curfew even graduate high school,0
2785,curfew,,stupidniggr I tell mom past curfew oth,0
2786,curfew,Elkhart IN,have cancel cat doctor appointment decide play home curfew,0
2787,curfew,Adelaide Australia,INFO be CURFEW in OPER until z taxi way FOXTROT FOXTROT NAVBL WND   EXP INST APCH RWY DAMP TMP QNH,0
2788,curfew,California,but lie though it pay old sometimes like first get car curfew freedom donthate,0
2792,curfew,Adelaide Australia,INFO you CLD SCT BKN EXP INST APCH RWY CURFEW in OPER until z taxi way FOXTROT FOXTROT NAVBL TMP WND,0
2793,curfew,Pon Di Gully,rite man tlk widout nuh curfew long side Aka cum fi steal di show itz rubbery di whole dem fi knw Sound music,0
2794,curfew,Benedict College,do not even worried curfew BC,0
2795,curfew,HTX,you get whole curfew,0
2796,curfew,,when hour late curfew pray dog bark unlocking door,0
2797,curfew,IM LOST,Da Judge give Dis Girl pm Curfew,0
2799,curfew,Miami,in beginning summer mom make curfew back I never wonder I always home,0
2801,curfew,,why Charlie Lim start pm Sunday I curfew leh,0
2802,curfew,Hamilton ON,when you bomb and you try get home for curfew,0
2803,cyclone,United Kingdom,awwww Baby Walter rewatchingthepilot TeamScorpion Cyclone,0
2807,cyclone,Des Moines Iowa,the Big ten annual football medium day get Cyclone hoop recruit nugget,1
2808,cyclone,USA,camera Art Photography BoltCyclone DR PP DR Dual Outlet Power PackFor External Camera Flash,0
2811,cyclone,Rural Northern Nevada,mccauleysdesign abysmaljoiner DyamiPlotke work purpose a large cyclone would better I K this,0
2813,cyclone,Republic Philippines,a tropical cyclone form near Guam once form call Molave,1
2815,cyclone,,video DE Jhaustin Thomas Cyclone Ames Tribune Ames Tribune Video DE Jhaustin Thomas,0
2817,cyclone,,XHNews we need plant pacific cyclone season would help,1
2819,cyclone,,BBC force to retract False Claims about Cyclone Pam wordpress,1
2820,cyclone,,GREAT condition Easton Cyclone Softball Bat Fastpitch   SK,1
2821,cyclone,Philippines,SEVERE weather BULLETIN no for TYPHOON Typhoon Hanna Soudelor TROPICAL cyclone WARNING issued AT   pm,1
2822,cyclone,Washington DC,the cyclone derive power calm center so person Norman Vincent Peale,1
2825,cyclone,hyderabad,roughdeal ante hudhud cyclone Chandrababu Valle ne ante Ga,1
2826,cyclone,Vancouver HQ worldwide,Cyclone Komen devastate family Myanmar week we need help,1
2827,cyclone,Quezon City Philippines,SEVERE weather BULLETIN TROPICAL cyclone WARNING TYPHOON HANNA issue   p Thursday August,1
2828,cyclone,Geneva,back future Vanuatu Cyclone Pam encourage traditional way live,1
2829,cyclone,Hartford connecticut,bank manager ask Tom interview what cyclone Tom it loan give purchase bicycle,0
2830,cyclone,Sioux Falls SD,Excited Cyclone football,0
2831,cyclone,Cornwall,BBC force to retract False Claims about Cyclone Pam wordpress,1
2832,cyclone,Beside Basketball,talent Misdirection Cyclone Pass Ignite Pass Vanishing Drive Phantom Shot KurokoBot,1
2833,cyclone,Rome Italy,now ComDev Asia Radio station Bangladesh broadcasting program address upcoming cyclone koman,1
2835,cyclone,Tafekop GaMatsepe,like cyclone imperialism spin across globe militarism crush people suck blood like,1
2836,cyclone,,Mercury Cyclone GT Hood moulding very nice core Cobra Jet cj gt,0
2838,cyclone,,I cyclone passion overblown,0
2839,cyclone,,his MAJESTY EMPEROR SALMAN KHAN UNSTOPPABLE CYCLONE of ENTERTAINMENT HUMANITY BAJRANGI BHAIJAAN create HISTORY EVERYWHERE CROSED CR,0
2841,cyclone,,Mercury Cyclone GT Quarter Panel D Rear Trim moulding Cobra Jet cj,1
2842,cyclone,,Tropical Cyclone Info Soudelor hpa maximum wind speed m maximum wind gust speed m,1
2843,cyclone,Melbourne,cyclonereizei if I may ask Cyclone sama read Jailed Fate Rindou,0
2844,cyclone,Vilnius,some drug alcohol Jackson Vroman house,0
2846,cyclone,Geneva,blend old Vanuatu prepare future emergency,0
2849,cyclone,,WFP WFP deliver Food to Bangladesh Flood Victims after Tropical Cyclone Komen DHAKA the United Na,1
2851,cyclone,,Rohingya house Kyee NockThie hamlet Taungbazar region Buthidaung severely damage Cyclone KasitaRoch VivianUNHCR,1
2852,cyclone,Made America,Cyclone double g would cherry top outfit OOTD doubleghat,0
2853,damage,PS stop asking,thelegendblue Cozmo probably allow we ascend get damage max value,0
2854,damage,,drop nigga damage,0
2855,damage,Cheshire London allover,union supportive London yet prepare damage economically aPSm last time,0
2856,damage,Texas USA,I like YouTube video GTA Online COLLATERAL damage GTA V Online pc,0
2857,damage,Bartholomew County Indiana,FYI accident property damage LIMESTONE LN col YELLOWSTONE WAY FIELDSTONE DR,1
2858,damage,,fitness Knee Damage Solution,0
2860,damage,My mind world,and I complain Phoenix Mode Fire Emblem turn Ray Gigant difficulty option take damage,0
2861,damage,,capicapricapri BrentoBento wha kid damage,0
2863,damage,Catskills,Cleared Accident property damage NY EB ny,1
2864,damage,,it crazy phone much damage person,0
2865,damage,Columbia SC,writebothfist it get pretty windy but damage,0
2866,damage,,reuse advanced life equipment transit drum chaign damage FdbDP,0
2867,damage,Right,IndiGoE but carful spot damage time check time give away baggage it loss wy,0
2869,damage,Texas,storm damage report West Tennessee,1
2870,damage,Lawrence KS Emporia KS,Hey Royals love damage out,1
2871,damage,httptwitchtvjcmonkey,drothvader cmnevalistis keep please Arachys Pieces now deal weapon damage,1
2872,damage,Indonesia,Mages Fairy Tail Specialize property damage Natsu Dragneel,0
2873,damage,Unknown,bradley Brad yeah fast extremely high damage fast go get,1
2875,damage,Unknown,Bradley Brad see fast af great damage upgrade shitton use exclusively whole playthrough,0
2877,damage,Marysville MI,let we tree fall fence do homeowner insurance may help,0
2878,damage,Haven Connecticut,JoeDawg TOR TOR situation wind damage enhance wording key I be go to,1
2879,damage,,HfxStanfield beelieveDC DiscoveryCntr happen hear runway lighting damage contractor,1
2880,damage,Austin San Diego,swb NDA write damage ability offer service future probably work anyway,0
2881,damage,,if trillion crosse line rd time field wide attack instant kill damage,1
2882,damage,Pontevedra Galicia,NP Metallica Damage Inc,0
2883,damage,Somewhere Canada,nine inmate charge cause damage Calgary Remand Centre riot,1
2884,damage,LondonNew York,pt Cross sectarian protest powerful Shia cleric say militia must withdraw fightin ISIS forget damage uve do,1
2885,damage,th Avenue York NY,do homeowner insurance cover water damage here good thing,1
2886,damage,,beach damage shit,1
2887,damage,,wonderousallure cross arm cover hand anymore damage H Hello,0
2888,damage,,post blog thesensualeye Model Cam Damage Toronto Apr nsfw pussy ass boob asian nude,0
2889,damage,Charlotte NC,report HIT RUN in roadway property damage STATESVILLE RD,1
2890,damage,,Devil may cry Special Edition Vergil Vs Agnus Window Mission DMD No damage by leedstraif,0
2891,damage,Rockville Maryland,Glaucoma occur fluid build pressure inside eye level may damage optic nerve eyefact,1
2893,damage,,JSunNews Storm damage report Madison County Thunderstorm damage report ar,1
2895,damage,,s A Puncture wound without foreign body leave index finger without damage nail initial encounter icd,1
2896,damage,Australia,thank RicharkKirkArch AusInstArchitect word warn QueensWharf Brisbane FinancialReview,0
2898,damage,Your Conversation,this real shit damage bitch,0
2899,damage,USAoV,laugh ass fuckboy change damage control Pseudojuuzo,0
2900,damage,Bhopal Madhya Pradesh India,MichaelWestBiz standard damage control,1
2902,damage,Tennessee,GettingLost JennEllensBB Munclejim it say superficial wound pepper spray damage,1
2905,danger,,Heroes Storm DustinBrowder DAD I chase constantly time frequently with great deal danger distraction love,0
2907,danger,LemonGang,I believe shirt company every animal ever danger I well start see change wildlife,0
2908,danger,ayr,Danger union bear,0
2909,danger,,the sign open falling for DANGER release day blast review tour Sign,1
2910,danger,Worldwide,DyannBridges yeshayad check rockin preview Clayton Bryant Danger Zone come soon Artists United,0
2911,danger,San Jose California,Red Flag warning fire danger dry thunderstorm Bay Area weather California Weather NWSBayArea,1
2912,danger,Worldwide,CarsonRex SpaceAngelSeven Check rockin preview Clayton Bryant Danger Zone come soon Artists United,0
2913,danger,Loughborough England,what like I could danger something,1
2915,danger,Killarney,when last tree be cut down last fish eat last Stream poison you will realize that you,0
2916,danger,Brooklyn NY,my take away preservation park r imposition danger African I never imagine,0
2917,danger,Lahar Gwalior,Indian Govt Media take serious concern safety they danger,1
2920,danger,St Paul MN,training grain wheat bare gold August heat anger I trespass lest seek danger,0
2921,danger,Atlanta Georgia,therealRITTZ FETTILOOTCH be slanglucci oppression greatest danger come soon the ALBUM,0
2922,danger,,morehouse it appear Govt lose ethical moral relevance this mean whole USA population danger,0
2924,danger,Lincoln IL,like head first slide especially home danger,0
2925,danger,World,permit bear hunt danger outnumber actual bear the license Florida fir st petersburg,0
2927,danger,Spinning time,riverroame and much danger please,0
2929,danger,Atlanta Georgia,bluebirddenver FETTILOOTCH be slanglucci oppression greatest danger come soon the ALBUM,1
2931,danger,Boston MA,uber look repair recent bad rap nonprofit partnership,0
2932,danger,Hailing Dayton,I wish I could get Victoria secret front I good,0
2933,danger,Worldwide,TurnedonFetaboo HSjb check rockin preview Clayton Bryant Danger Zone come soon Artists United,0
2934,danger,Newcastle Upon Tyne England,TheTXI GunnersFan would arsenal fan West Ham relegation battle season danger AFC sun,0
2935,danger,Atlanta Georgia,remainontop FETTILOOTCH be slanglucci oppression greatest danger come soon the ALBUM,0
2936,danger,Atlanta Georgia,nugget FETTILOOTCH be slanglucci oppression greatest danger come soon the ALBUM,0
2937,danger,,the Danger Excitement Underwater Cave Diving,0
2939,danger,,the girl I save like danger health try somebody somebody else,0
2941,danger,Instagram trillrebel,gun protection that shit really use unless life danger,0
2942,danger,ALWAYS DYING NEVER RESTING,so thirsty you all in danger of dehydration,1
2943,danger,San Jose CA,thunderstorm little rain expect Central California high fire danger weather California Weather,1
2944,danger,,get danger day tattoo bad cool would spider like someone wrist smth,0
2945,danger,Israel,in experience always angry critical pundit grave danger go rail,0
2946,danger,Uruguay Westeros Gallifrey,I danger Skyler I be the danger,0
2947,danger,Kansas City MO,too dangerous but ok rest we danger,0
2948,danger,Silver Spring MD,investigate Robert mueller respond complaint since Nov leave son danger,0
2950,danger,Jersey CI,honestly though Modibo Maiga steal live fuck past good still danger fucktard coyi,1
2952,danger,,fear way make we danger none contemplate logic behind situation find courage engage,0
2953,dead,,Joel   and book act,0
2954,dead,Afghanistan,dead Afghanistan aircraft crash an afghan military helicopter crash remote region,1
2955,dead,Sweden,Silentsiris even awesome norse landscapes load atmosphere life bore dead snotgreen wasteland,0
2956,dead,,miss long hair dead anyways even hair,0
2957,dead,,cjbanning sake argsuppose pre bear attain individl right generally courtof law forbid kill unless dead person something,0
2959,dead,London,remember time goku give life dead birb hell goku,0
2960,dead,Orlando FL,naaa I bee dead like legit zombie I feel every sore part body,0
2963,dead,,we happen get road right behind bus I dead serious,0
2965,dead,Atmosphere,lmfao fucking luis hhahaha dead,0
2969,dead,,I watch emmerdale nd I slightly attractive man name Ross get beat nd dead,1
2970,dead,Glasgow,soapscoop need confirm ross dead trust anyone else yh,0
2971,dead,,GailSimone IWasDisappointedBy TellTale the walk Dead good character story real gameplay many performance issue,0
2973,dead,,beforeitsnew hundred fear dead libyan migrant boat capsize rescue,1
2974,dead,somewhere Portugal,if war came never wave white flag front I can not end dead I mislead,0
2975,dead,South Stand,JonesKyle oh fuck sake dead,0
2976,dead,dundalk ireland,emmerdale Ross really dead ask Charley,0
2980,dead,,Don avoid wear dead black flame red stark white much esp debate blue gold brown even shoe,0
2982,dead,,perspective grateful Dead Critical Writings Contributions Study,1
2983,dead,Sochi KDA RU,hlportal hello I look mod Cold Ice I see site link download dead maybe share thank,0
2984,dead,ÌT,kgvaal laugh ass offv v hard Ny trend babalaughe ass welcome Nyozi kwaAaaA dead,0
2987,dead,South Stand,JonesKyle I say dead else die,0
2988,dead,Youre forever,be ROSS dead noooooooooooo Michael Parr,0
2990,dead,Kettering OH,think time friend bail nite dead show go alone great time all alone free dance Front row,0
2991,dead,United States,Typhoon Soudelor take dead aim Taiwan,1
2992,dead,,ask Charley Emmerdale how emotional Ross dead emmerdale,0
2993,dead,Planet Earth,Man find Dead Demi Moore Swimming Pool,1
2995,dead,Spare Oom,val dead suing,1
2998,dead,,atchisonsean dead,0
3000,dead,United States,Wyrmwood Road dead fucking awesome awesome end Awesome,0
3001,dead,Milton Keynes,can not believe Ross dead emmerdale Michael Parr Emmerdale summerfate,0
3003,death,,I call text niggas bff boyfriend I love boy death no niggas hold attention like,0
3004,death,ATLAL,I hate to talk Otp with my Grandma I mean I love she as to Death but she talk so Damn much Ssshhheeesshh,0
3005,death,UPTOWN,until death I forever rep jet,1
3006,death,,vibrator shape vape done bust,0
3009,death,PROV,death threat nigga life well gon,0
3010,death,Novi MI,adult die plague Colorado,1
3011,death,York,Xbox Pro Console Red Ring Death Full read eBay,0
3012,death,Buenos Aires Argentina,go back Gainesville death,1
3013,death,,a year later Ferguson see change ask its real,0
3014,death,,papiichoo what I enjoy Obama era civility Prez say GOP support iranian death,0
3015,death,,I feel like death,0
3016,death,The UK,I like YouTube video jeromekem DJ Hazard Death Sport,0
3018,death,,I tell cousin I hang text say come honestly death wish,0
3019,death,,RSS Judge order Texas recognize spouse sex death certificate,0
3021,death,mpls,loyalty mission involve kick shitty nobleman death I love elven weirdo,0
3022,death,Kensington MD,there way seemeth right unto man end thereof way death,1
3023,death,BuffaloDC,kellkane thank I narrowly avert death fun right,1
3025,death,,Ariana Grande Scream Queens Katherine Death,0
3026,death,Sylacauga Alabama,allahsfinest death muslim,1
3027,death,,go starve death,0
3029,death,,Ted Cruz Bashes Obama Comparison GOP to Iranians shout Death to America,0
3030,death,,Ariana Grande Scream Queens Katherine death,0
