id,keyword,location,text,target
5072,famine,,robertmeyer exle low food price farmer break famine next year mean simple capitalism fail feed peoplegt,0
5073,famine,"Washington, D.C.",memorial million perish holodomor erect us capital,1
5074,famine,"Earth, Milky Way, Universe",export food solve problem african end famine n poverty solve control tribal war,1
5075,famine,,food crematoria provoke outrage amid crisis famine memory,1
5076,famine,,article russian food crematoria provoke outrage amid crisis famine memory read,1
5078,famine,"Edappally,Kochi",build muscle feast famine feed diet plan base around lose weight youu,0
5079,famine,Texas,famine come end bluebell,1
5080,famine,"In #Fairie, where else? ;-)",taste like feast famine starve trust jack writescoffee iartg rwa twrw rrbc,0
5082,famine,,russian food crematoria provoke outrage amid crisis famine memory,1
5083,famine,Massachusetts,russia destroy food people hungry one insane government,1
5085,famine,,financialtimes ethiopian regime continue receive foreign aid famine strike year eastern ethiopia,1
5087,famine,Ukraine,reuters russian food crematoria provoke outrage amid crisis famine memory,1
5088,famine,,grade black horse faminemega score dynamix,0
5089,famine,???? ???????,russian u / food crematoriaua provoke outrage amid crisis famineaememorie,1
5092,famine,,bolshevik government monopolize food supply seize power hunhry population artificial famine result,1
5094,famine,United States,russian food crematoria provoke outrage amid crisis famine memorie yahoonew,1
5095,famine,Ireland,experience smell rot potato first time famine must awful whole country smell like,1
5096,famine,San Francisco,russian food crematoria provoke outrage amid crisis famine memory,1
5097,famine,,thing become terrible great ethiopian famine,0
5098,famine,"Rogersville, MO",savagenation remind peasant destroy food stalin army come redistribute wealth cause faminedeath,1
5099,famine,"Tampa, FL",update russian food crematoria provoke outrage amid crisis famine memorie russian society still recal,1
5101,famine,,adventure mineness famine,1
5102,famine,Ukraine,food crematoria russia provoke outrage amid crisis famine memory,1
5103,famine,,robert conquest famine museum kiev guidofawke mediaguido,0
5104,famine,,russian food crematoria provoke outrage amid crisis famine memory,1
5105,famine,,cnn end time upon we famine war death plague presence grow strong,0
5106,famine,Telangana,maratha raider scorch land punjab refuse food aid famine wonder bengalis harbor hard feeling,1
5107,famine,"Chatham, IL",image famine uo hope christ blog happen forget god hopeinchrist lifelettercafe,1
5109,famine,,surfphoto squeeze tear famine plague tsunami chance lego blubber,0
5110,famine,Charter Member of the VRWC,russian food crematoria provoke outrage amid crisis famine memorie yahoo,1
5113,fatal,,yearold boy charge manslaughter toddler report yearold boy charge manslaughter fatal sh,1
5114,fatal,"Wood Buffalo, Alberta",roger goodells fatal mistake tom brady innocent man,0
5115,fatal,"ÌÏT: 10.614817868480726,12.195582811791382",boy charge manslaughter shooting death elijah walker yearold appear wednesday,1
5116,fatal,,fatal attraction common n common pain,0
5117,fatal,"Anchorage, AK",apd investigate fatal shoot year old child southeast anchorage,1
5119,fatal,Nakhon Si Thammarat,investigator shift focus cause fatal waimate fire,1
5120,fatal,Somewhere with Clyde,asianshawtyy sorry,0
5122,fatal,"Buffalo, NY",police man early s die shoot vermont st,1
5124,fatal,Quincy,man accuse fatal hitandrun get judge khqa,0
5125,fatal,Winnipeg,winnipeg police seek witness arlington william fatal crash,1
5126,fatal,"Fresno, CA",chrisdanielshow nearlyfatal pee san francisco,0
5127,fatal,Varanasi,yearold boy charge manslaughter toddler report yearold boy charge manslaughter fatal sh,1
5128,fatal,"Laredo, TX",petition remaster fatal frame windwakerstyle selfie mode,0
5130,fatal,Thane,yearold boy charge manslaughter toddler report yearold boy charge manslaughter fatal sh,1
5131,fatal,"New South Wales, Australia",man charge fatal crash near dubbo refuse bail dailyliberal,1
5132,fatal,,california man face manslaughter charge sunday wrongway fatal crash can,1
5134,fatal,Poconos,five fatal flaw iran deal youtube,0
5135,fatal,"Sacramento, CA",stockton police investigate fatal driveby shoot north stockton,1
5136,fatal,"Haddonfield, NJ",deputy dog dispute lead fatal shoot person county gunfail nra,1
5137,fatal,,yearold boy charge manslaughter toddler report yearold boy charge manslaughter fatal sh,1
5138,fatal,Southern California,can cops illegal immigrant prior arrest charge fatal sex attack,1
5139,fatal,,spookyfob feelslikefob okay thank yes kindness fatal though like patrick stump level kindness,0
5140,fatal,,yearold boy charge manslaughter toddler report yearold boy charge manslaughter fatal sh,1
5141,fatal,"Jaipur, Rajasthan, India",success permanent failure fatal,0
5142,fatal,??? ???? ??????,investigator shift focus cause fatal waimate fire,1
5144,fatal,,yearold boy charge manslaughter toddler report yearold boy charge manslaughter fatal sh,1
5145,fatal,Bangalore,yearold boy charge manslaughter toddler report yearold boy charge manslaughter fatal sh,1
5146,fatal,,tell adopt way maybe overlook something fatal whyor,0
5148,fatal,Also follow ?,boy charge manslaughter shooting death elijah walker,1
5149,fatal,,robert ballews log statement always fatal level,0
5150,fatal,Play For Ryan ??,fatal attraction,0
5152,fatal,,crime police i d victim fatal crash close I near franklin person justice court,1
5153,fatal,Dimapur,yearold boy charge manslaughter toddler report yearold boy charge manslaughter fatal sh,1
5154,fatal,,investigator shift focus cause fatal waimate fire,1
5155,fatal,In the potters hands,boy charge fatal shooting yearold,1
5157,fatal,,yearold boy charge manslaughter toddler report yearold boy charge manslaughter fatal sh,1
5159,fatal,,yearold boy charge manslaughter toddler report yearold boy charge manslaughter fatal sh,1
5160,fatal,,investigator shift focus cause fatal waimate fire,1
5162,fatalities,,exclusive fatality involve onduty nypd cop year aeu,1
5164,fatalities,New York,nyc legionnaire death toll rise york city eight fatality old adult,1
5165,fatalities,"New York City ,NY",let we fraction vital need fatality would break education econom,0
5166,fatalities,,las vegas top city redlight run fatality newslv,0
5168,fatalities,"Corpus Christi, Texas",totally unprepared emp attack china russia probably isis possess fatality push,1
5169,fatalities,Cape Town,city implore motorist speed report animal fatality near nature reserve gt,1
5170,fatalities,,kyrikoni expressandstar say veg fruit good hope injury fatality,0
5171,fatalities,Wolverhampton/Brum/Jersey,understand fatality trap inside wholesale market fire engine fire fighter scene,1
5172,fatalities,"Chamblee, Georgia",month mark total fatality first half last year,1
5174,fatalities,Official Website,hse release annual workplace facility datum,0
5175,fatalities,#WashingtonState #Seattle,seattle deadly red light runner intersection reveal,1
5176,fatalities,TechFish ,reject mortal kombat fatality mortal kombat stretch boundary itsu,0
5177,fatalities,"Washington, DC & Charlotte, NC",unsuckdcmetro minor train leave rail major smithsonian interlock derail crash barrier wall w fatality,1
5178,fatalities,,injury illnesse fatality late number,1
5179,fatalities,United States where it's warm,osage beach release name,0
5180,fatalities,,wonder coolweird characters mkx fatality skinless predator,0
5181,fatalities,"Washington, DC",saudi arabia abha fatality report follow suicide bombing mosque avoid area,1
5182,fatalities,"Hope Road, Jamaica ",use road wisely prevent carnage continuinglet we fatality holiday period ggindependencmessage,0
5183,fatalities,jersey ,mortal kombat fatality gross interesting,0
5184,fatalities,,xrays mkx look like fatality,0
5185,fatalities,"WestEnd, Puritan Ave ",dwilliam ieansquad donuat fatality mortal kombat,0
5186,fatalities,,kitana fatality slay uokody vine kombatfan,1
5187,fatalities,"Youngstown, OH",osp concerned mount fatality,1
5188,fatalities,,mortal kombat x fatality meat predator,0
5189,fatalities,"Nantes, France",estimate damage fatality hiroshimasize atomic bomb drop hometown hiroshima,1
5190,fatalities,"St. John's, NL, Canada",rcmp report fatality serious injury result collision tch near whitbourne,1
5191,fatalities,"Caserta-Roma, Italy ",govt allocate bn flood action issue take centre stage fatality veneto,1
5192,fatalities,Pekanbaruå¡Batam Islandå¡Medan,zero spider biterelate fatality australia since,0
5193,fatalities,oman muscat al seeb ,like youtube video tremor joke tremor dlc fatalitiesxray,1
5194,fatalities,San Francisco,motordom lobby change language around traffic fatality need back future visionzero,0
5195,fatalities,Wisconsin,share help cousin family,0
5196,fatalities,,among main factor behind pedestrian fatality people fail yield car,1
5197,fatalities,"Jogja, Indonesia Slowly Asia",mortal kombat x excellent fatality fun iuave ever mortal kombat segas version,0
5198,fatalities,Vancouver BC,uber reduce drunk driving fatality say independent study,0
5199,fatalities,,like youtube video kevinedwardsjr mortal kombat x pc gameplay fatalitiesxray mkx,0
5200,fatalities,USA,las vegas top city redlight run fatality,1
5201,fatalities,,rcmp confirm fatality twovehicle crash tch remain closed whitbourne due accident,1
5202,fatalities,"Avon, OH",american casualty include uo fatality five ten million japanese fatality,1
5203,fatalities,,uk train accident fatality th year run despite increase passenger journey healthandsafety,1
5204,fatalities,The North,fail would bring number road fatality immensely,0
5206,fatalities,"Philadelphia, PA",policylab cecanfs last public hearing nyc today tomorrow address child abuse neglect fatality,1
5207,fatalities,Just Happy to Be Anywhere,kurtschlichter yep consider million japanese fatality project downfall freemarketeer dibang,1
5208,fatalities,,shipping logistic enca fatality migrant boat capsize med hundred onboard u capsize,1
5209,fatalities,"Lima, Ohio",message board display update traffic fatality message begin today traffic death slow worker,1
5210,fatalities,Ireland,driver fatality irish road pedestrian cyclist risk,1
5211,fatality,"Lowell, MA",ebrointheam jaybig lpunbiggiewrap overzero questionfatalityflawless victory,0
5212,fatality,playing soccer & eating pizza,jakeadavis fatalityus cuddle right,0
5213,fatality,,trulysting yo dm,1
5218,fatality,NY,savage leak thomas brady gangstermail account wonder quick fatality samsung mobile b real son,0
5219,fatality,Hueco Mundo,like youtube video vgbootc sx sn vabengal zss vs sws fatality captain falcon,0
5220,fatality,,hibernate pbx irrespective pitch fatality careerism pan crbzfz,0
5221,fatality,Nairobi,fatality,0
5222,fatality,Boston Û¢ Cape Cod ?,die lyme disease case fatality rate nearly,1
5223,fatality,,hripsk fatality like corpse still jittere,1
5224,fatality,Rafael castillo,fatality,0
5226,fatality,,wow fatality big rig hit motorcyclist blood everywhere wow sick,1
5227,fatality,New Jersey,tellyfckngo jaycootchi nah hit homie wit fatality sond wit babality cold cold fuck lmfaoooo,0
5228,fatality,"Fort Wayne, IN",kosciusko police investigate pedestrian fatality hit train thursday,1
5229,fatality,"Enterprise, NV",fatality,0
5230,fatality,,bardissimo yes life fatality rate,0
5231,fatality,,many basket charming fatality tonyakappe get mystery paranormal,0
5232,fatality,434,make bad boy   must,0
5233,fatality,Grand Rapids MI,fatalityus need team need,0
5234,fatality,U.S.A,afghan soldier kill us general americas highestranke fatality since vietnam,1
5235,fatality,434,usually never happen,0
5236,fatality,New York ,babybackreeve fatality,0
5238,fatality,Utica NY,cat fatality utica ny pleasant holland aveblack cat white paws average size grass next north side road,0
5242,fatality,,pxnatosil renunciedilma fatality,0
5243,fatality,,jaxmk stage fatalityuudlk close,0
5244,fatality,Nunya,see video every fatality mileena make sad,0
5245,fatality,"Houston, TX  ",chrisman fatality,0
5247,fatality,USA,kosciusko police investigate pedestrian fatality hit train thursday,0
5248,fatality,,fatality,1
5249,fatality,TX,fatality scary af probably good falcon still scary,0
5251,fatality,"Christiana,Tennessee",like youtube video vgbootc sx sn vabengal zss vs sws fatality captain falcon,0
5252,fatality,"Nashville, TN",truck crash w us lebanon fatality sad expect long delay morning,1
5254,fatality,"Bishops Stortford, England",lindasocvat tflbusalert yes apparently report cow fatality well sadly,1
5255,fatality,Earth ,like youtube video deathmule mk x tremors stalag might fatality ermac tournament pharaoh,0
5256,fatality,"Brentwood, NY",add video youtube playlist sx sws fatality captain falcon vs snow fox ssb loser,0
5257,fatality,,death loretta fuddy responsible authenticating obama birth certificate sole fatality nine plane,1
5259,fatality,Honduras,fatality,0
5260,fatality,,everyday near death fatality road thank god side,0
5262,fear,"Chippenham/Bath, UK",fear factory december do deal,0
5263,fear,,make friend interesting combine,0
5264,fear,Yewa zone,mean pick change life overcome fear behold wonder tcc catch light endless,0
5265,fear,"sitting on the fence, New York",phnotf sometimes cheekiness bleed computer screen recoil fear,0
5266,fear,,every man fear strongminde woman keeper get keep runnin,0
5267,fear,,big fear disappoint people believe,0
5269,fear,Carregado,hurt fear drive midnight,0
5270,fear,"Largo, MD",man fear feel control woman passive aggressively coerce commitment ready,0
5271,fear,,thing fear organizationsfluctuation disturbance imbalancesare primary source creativity margaret wheatley,0
5272,fear,mexico,fear factory car official musicvideo,0
5273,fear,"Cape Town, Khayelitsha",luzukokoti understand umntu wakho trust partner ok fear anything,0
5274,fear,Florida,photo referencereference xekstrin think nostril eye almost cry fear partake,0
5276,fear,"Indianapolis, IN",baileysmsteach fear look like doinguahhhuthat big perrychat,0
5278,fear,,opposite love fear hereuas,1
5280,fear,,fear youtube,0
5281,fear,Stanford University,help win share article lifetime fear thanks blackinamerica growingupblack,0
5282,fear,Midwestern USA,cowgirllawyer must refuse become nation everyone live fear shoot unawares intoxicated or crazy people,1
5283,fear,Bedford IN ,horror film make incredibly creative artist interview depth anatomy fear,1
5284,fear,,forever stay side special night fear loathe las vegassolitude xmas,0
5285,fear,"Thibodaux, LA",bad fear,0
5286,fear,,shakjn c magnum shake fear he s go hack planet,0
5287,fear,Brazil,world finish god say fear choosegod restoringpath,0
5290,fear,In the moment,replace fear unknown curiosity open tou,0
5291,fear,,love god fear hell,0
5292,fear,,tell bride give fear,0
5293,fear,Alliston Ontario,scottdpierce billharristv harrisgle beezersun forfeit year fantasy football pool fear may win n get ass kick,0
5295,fear,,right reopening xfile fear thexfilesday,0
5296,fear,SaudI arabia - riyadh ,live balanced life balance fear allah hope mercy love,0
5297,fear,New York. NY,big fear eventually way,0
5298,fear,Athens - Nicosia,couple less sex fear let internet movie book say sex ought pu,0
5299,fear,,nothing fear take risk,1
5300,fear,Southern California,untangle require partner fill need love without fear besttalkradio listen,0
5301,fear,"Bremerton, WA",walk dead spin fear walk dead rd,1
5302,fear,"Tulalip, Washington",mcnabbychic fear,0
5304,fear,Indonesia,fear lord start knowledge foolish use wisdom teach amsal,0
5305,fear,Halifax,number people deny climate change polar bear article make fear future we also humanity general,0
5306,fear,"Hilton Head, SC  ",sensander gd idea wrke hard almost nothing fear live poor fran reed,0
5308,fear,New York,never let fear get way achieve dream deltachildren instaquote quoteoftheday disney waltdisney,0
5309,fear,"St. Louis, MO",fear motivator,0
5310,fear,USA,daily reflection august drive drive hundred form fear selfdelusion selfseeke selfpity,0
5313,fire,,morganite gemstone white fire opal sterling silver ring size r,0
5315,fire,SÌ£o Paulo,marquei como visto game throne x kiss fire bancodeserie,0
5316,fire,,save date saturday august   salisbury fire department open house cypress st be,0
5317,fire,,put fire still burn,0
5319,fire,2 high 2 come down ,misshomasttopa fire fire fire yeah fire fire fire nowwwwww,1
5320,fire,,avi header combo fire,0
5321,fire,Wrex,auction shoe retro fire red,0
5322,fire,,asshole fire,0
5323,fire,big boy Û¢ 0802,cry song end set fire,0
5324,fire,,set thing fire always option,1
5325,fire,,sit around fire sound great right,0
5326,fire,,fire,0
5328,fire,Brooklyn,put flood fire top list,1
5330,fire,Canada,fire,0
5331,fire,To The Right of You!,politifiact harry reids percent woman serve plan parenthood claim pant fire lie tcot,0
5332,fire,"St.Cloud, MN",dear canonusaimaging bring canonbringit fire canontattoo mn theresmorewherethatcamefrom,0
5335,fire,,seanhannity scottwalker yeah need another middle class hate republican get hard work cop fire fighter teacher,0
5336,fire,,fire way close wtf go,1
5337,fire,on a catwalk somewhere,fire meet gasoline always get get play twice lol,0
5338,fire,  å_ ,wcw catsandsyrup tha bitch fire,0
5339,fire,Zac Newsome loves me,well feel like fire,0
5341,fire,"louisville, kentucky",eye word icy burn like rum fire,0
5342,fire,,politifiact harry reids percent woman serve plan parenthood claim pant fire lie,0
5343,fire,,nothing like good fire,1
5344,fire,Makai,daughterofnai tenshi activate yukis fire card,0
5345,fire,"Fort Valley,GA/Fayetteville,AR",california shakingcatching fireand overcharge people rent past year go nowhere,1
5346,fire,Arizona,fire catalinas look kind cool picture justice,1
5347,fire,,zaynmalik overwork album go fire overwork stress love take care,0
5349,fire,"Vancouver, BC",justinle promise tax pancake rainbow die fire,0
5350,fire,"Newark, NJ",nigga cyhi diss meek suppose shit actually fire,0
5351,fire,the road to success,set shit fire,1
5352,fire,The Desert,word charlie daniels fire mountain run boy runu,1
5353,fire,"Sydney, Australia",check uo fire zomatoaus lovefood,1
5354,fire,"Yuba City, CA",heart big obstacle front euro dontexpectnothe july fire euro,0
5355,fire,,fire wave darkness,0
5356,fire,University of South Florida,may seem like fire little burn,0
5357,fire,,smell bon fire driving make sit near make smore,1
5359,fire,the moon,drop fire selfie tomorrow say welcome ahead time,0
5362,fire truck,"Niagara Falls, Ontario",fire call brant av drummond rd fire structure single unit car call truck,1
5365,fire truck,"Woodcreek HS, Roseville, CA",psa day fire truck behind light go move get call,0
5366,fire truck,United States,rfp fire truck service body f fire fight rescue safety equipment transporta,0
5367,fire truck,,reno truck trailer catch fire reno,1
5368,fire truck,,wild night village pugwash every fire truck town like fire truck every house population,1
5371,fire truck,Here & There,wheeler come along strike fire truck spin around degree cause roll,1
5372,fire truck,District 12 - Orange County,sigalert update n closed fwy ufn trash truck fire,1
5373,fire truck,Plain O' Texas,brooktekle like murder scene cop fire truck fire assistance car along helicopter,1
5375,fire truck,SouthEast Asia,former township fire truck use philippine langley times philippine,1
5377,fire truck,,former township fire truck use philippines township langley assistant fire chief pat walker spen,1
5378,fire truck,,garbage truck really catch fire lmfao,0
5379,fire truck,,kapokekito northgate taco truck fire,1
5380,fire truck,,never good sign pull work five ambulance fire truck bay wompppp least friday,1
5381,fire truck,"Saipan, CNMI",fire truck ambulance k phase hope everyone okay prayforsaipan,1
5382,fire truck,"Orange County, Calif.",sigalert north southbound closed btwn fwy irvine blvd due truck fire chp detour traffic,1
5383,fire truck,lost in my thoughts,eeenice true truck catch fire,1
5384,fire truck,,justinejayyy ohgod xd mean p fire truck back good xd,0
5385,fire truck,Five down from the Coffeeshop,come across fire video mineenjoybabe way say hi he s fire truck fireman u,0
5386,fire truck,Los Angeles,n past l lane reopen lane close lane open trash truck fire cleanup knx,1
5387,fire truck,"Orange County, CA",sigalert north southbound closed btwn fwy irvine blvd due truck fire chp detour traffic,1
5389,fire truck,Five down from the Coffeeshop,find cool photo mine dodge wayne bodied window bus ex libby mt fire department truck oriu,1
5391,fire truck,,trident chevy fire truck w pumper im fire dept red ho plastic,0
5392,fire truck,"Tallahassee, FL",toddler bedding firetruck bundle fire truck firefighter sticker decal sign wall,0
5396,fire truck,,monster truck racer catch fire fair,1
5397,fire truck,"Laguna Beach, Calif. ",truck fire clogs canyon road,1
5400,fire truck," Nevada Carson City,Freeman St",rgj truck trailer catch fire reno,1
5403,fire truck,,philippine former township fire truck use philippine u emergency equipment cebu philippi,1
5404,fire truck,LA ??,fire truck parking lot,0
5406,fire truck,,evening sun article nno,0
5407,fire truck,,choose happy fire truck rest review kick push jaymcleanauthor,0
5408,fire truck,,former township fire truck use philippine langley times filipino,0
5409,fire truck,,jacksonville fire rescue engine awesome truck official jade fl youtube,1
5410,fire truck,Aracaju - Sergipe,njturnpike a njturnpike reopen hour truck fire,1
5411,first responders,,lukebox something first responder military true hero besides music,0
5412,first responders,"Nashville, Tennessee",grateful first responder mnpdnashville nashvillefd other act swiftly save countless life today,1
5413,first responders,Texas,usatoday pray god heal safety first responder,0
5416,first responders,Long Eaton åá Derbyshire åá UK,join charity k run event doningtondash be start sun sept castle donington community first responder,0
5417,first responders,WorldWide,love way book write include many vantage point first responders detkenlang kindle,0
5418,first responders,,first responder would never send wrong address w smarttek gpsbase panic button mper safety,0
5420,first responders,"Portage, IN / Worldwide",u / we helpua say denver firefighter working curb first responder suicide,1
5423,first responders,"Victoria, BC  Canada",cool teen become like call digital first responder friend need little help support,0
5425,first responders,,carmike cinemas antioch shoot grateful staff first responder safety high priority,1
5426,first responders,Roads/Trails Everywhere,roadid thanks alex story first responder need u,0
5428,first responders,New York City,add sandy first responder lose home vip home page group vimeo,1
5430,first responders,"Nashville, TN",thankful first responder especially mnpdnashville life save response today antioch,1
5432,first responders,,juneau empire first responder turn national night,0
5437,first responders,"Liberty Township, Ohio",red throw word hero around lightly usually reserve first responder military he s hero,0
5439,first responders,Aberdeenshire,we want future first responder hightech,0
5442,first responders,"Los Angeles, CA",still room party first responder around country rd annual well ever,0
5443,first responders,A Hoop Somewhere,incase accident first responder would baby present,0
5444,first responders,Michigan,kirsten gillibrand extend health care first responder,1
5445,first responders,"Bloomington, Indiana",help say denver firefighter work curb first responder suicide,1
5446,first responders,USA,first responder convene national summit awards gis technology gisuserpr geotech,0
5448,first responders,,york co first responder compete save life u / badge bloodua paramedic ems,0
5449,first responders,"Washington, DC",good info help first responder cope individual resilience factsheet responder,0
5450,first responders,,iafflocal life lose except first responder public charge protect,1
5452,first responders,"Basking Ridge, NJ",first responder get int bridgeportspeed free saturday detail,0
5454,first responders,"Stalybridge, Tameside",day emergency service display meet brave police firefighter first responder help keep we safe,1
5455,first responders,,week first responder dart member participate four day intensive technical large animal,1
5458,first responders,"Sacramento, CA",firefighter gain rockyfire jerry brown heading area meet first responder tomorrow morning,1
5459,first responders,"Franklin, TN near Nashville",shoot event theater starbuck give free coffee first responder police firefighter antiochhickoryhollowtn,1
5460,first responders,"St. Louis, Missouri",lender fee veteran first responder past present linkedin,0
5461,flames,Bandung,giant flame giant full black pantofel infoorder sms pin pictwittercompnpizody,1
5462,flames,New York,snap tool black baseball hatcap silvergray embroider logo flame full reu,0
5465,flames,New York,snap tool black baseball hatcap silvergray embroider logo flame full reu,0
5466,flames,"Louisville, KY ",viro go table flame ultimalucha luchaunderground elreynetwork,0
5467,flames,,cabin fever flame,0
5468,flames,"Manhattan, NY",can not summon flame directly hell store buy fineme momdie,0
5469,flames,Freeport Ny,add fire flame saturday rick wonder spin guest set along chachi,0
5471,flames,650/559,kelworldpeace taxstone yoga flame,0
5473,flames,,sbnation flame make good penalty killer,0
5475,flames,dreamy lake,guess ig hope go flame,0
5476,flames,,ill cry pity partys flame,0
5477,flames,houstn,lil b x chance nothing flame,0
5479,flames,hell,gilderoy wish good enough add flame nail fire,1
5480,flames,"Asheville, NC",gang walk round brown flame nd,0
5481,flames,New York,snap tool black baseball hatcap silvergray embroider logo flame full reu,0
