id,keyword,location,text,target
1,,,deed reason earthquake may allah forgive we,1
4,,,forest fire near la ronge sask canada,1
5,,,resident ask shelter place notify officer evacuation shelter place order expect,1
6,,,people receive wildfire evacuation order california,1
7,,,get send photo ruby alaska smoke wildfire pour school,1
8,,,rockyfire update california hwy closed direction due lake county fire cafire wildfire,1
10,,,flood disaster heavy rain cause flash flooding street manitou colorado spring area,1
13,,,top hill fire wood,1
14,,,emergency evacuation happen building across street,1
15,,,afraid tornado come area,1
16,,,three people die heat wave far,1
17,,,haha south ta getting flood hah wait second live south ta go go fvck flooding,1
18,,,rain flood florida tabay ta   day lose count,1
19,,,flood bago myanmar arrive bago,1
20,,,damage school bus multi car crash breaking,1
23,,,man,0
24,,,love fruit,0
25,,,summer lovely,0
26,,,car fast,0
28,,,goooooooaaaaaal,0
31,,,ridiculous,0
32,,,london cool,0
33,,,love skiing,0
34,,,wonderful day,0
36,,,looooool,0
37,,,wayi can not eat shit,0
38,,,nyc last week,0
39,,,love girlfriend,0
40,,,cooool,0
41,,,like pasta,0
44,,,end,0
48,ablaze,Birmingham,bbcmtd wholesale market ablaze,1
49,ablaze,Est. September 2012 - Bristol,always try bring heavy metal,0
50,ablaze,AFRICA,africanbaze break newsnigeria flag set ablaze aba,1
52,ablaze,"Philadelphia, PA",cry set ablaze,0
53,ablaze,"London, UK",plus side sky last night ablaze,0
54,ablaze,Pretoria,phdsquare mufc build much hype around acquisition doubt set epl ablaze season,0
55,ablaze,World Wide!!,inec office abia set ablaze,1
56,ablaze,,barbado bridgetown jamaica uo two car set ablaze santa cruz uo head st elizabeth police superintende,1
57,ablaze,Paranaque City,ablaze lord,0
59,ablaze,Live On Webcam,check nsfw,0
61,ablaze,,outside ablaze alive dead inside,0
62,ablaze,milky way,awesome time visit cfc head office ancop site ablaze thanks tita vida take care we,0
63,ablaze,,soooo pump ablaze southridgelife,0
64,ablaze,,want set chicago ablaze preach hotel,0
65,ablaze,,gain follower last week stat grow,0
66,ablaze,"GREENSBORO,NORTH CAROLINA",west burn thousand wildfire ablaze california alone,1
67,ablaze,,build perfect tracklist life leave street ablaze,0
68,ablaze,Live On Webcam,check nsfw,0
71,ablaze,England.,first night retainer quite weird well get use wear every single night next year least,0
73,ablaze,"Sheffield Township, Ohio",deputy man shoot brighton home set ablaze,1
74,ablaze,India,man wife get six year jail set ablaze niece,1
76,ablaze,Barbados,santa cruz uo head st elizabeth police superintendent lanford salmon,0
77,ablaze,Anaheim,police arsonist deliberately set black church north carolinaaeablaze,1
78,ablaze,Abuja,noches elbestia alexissanchez happy teammate train hard goodnight gunner,0
79,ablaze,USA,kurd trle turkman flag later set ablaze other vandalize office turkmen front diyala,1
80,ablaze,South Africa,truck ablaze r voortrekker ave outside tambo intl cargo section,1
81,ablaze,"Sao Paulo, Brazil",set heart ablaze every city gift every skyline like kiss upon lip u,0
82,ablaze,hollywoodland ,sky ablaze tonight los angeles expect ig fb fill sunset shot peep,0
83,ablaze,"Edmonton, Alberta - Treaty 6",west burn thousand wildfire ablaze california alone climate energy,1
85,ablaze,,revel wmv video mean mac farewell ablaze wmv en route dvd gtxrwm,0
86,ablaze,Inang Pamantasan,progressive greeting month student would set pen ablaze torch publication,0
89,ablaze,Twitter Lockout in progress,rene ablaze jacinta secret k fall sky edit mar,0
91,ablaze,"Concord, CA",navista steve fire something else california tinderbox clown set hood ablaze news,1
92,ablaze,"Calgary, AB",nowplaying rene ablaze ian buff magnitude edm,0
93,ablaze,Birmingham,nxwestmidland huge fire wholesale market ablaze,1
95,ablaze,San Francisco,ablaze time talk due work,0
96,accident,CLVLND,can not kid cuz get bicycle accident split testicle impossible kid michael father,0
97,accident,"Nashville, TN",accident I w nashvilletraffic traffic move m slow usual,1
98,accident,"Santa Clara, CA",accident center lane block santaclara we nb great america pkwy bayarea traffic,1
100,accident,UK,personalinjury accident summer read advice solicitor help otleyhour,0
102,accident,"St. Louis, MO",stlouis caraccidentlawyer speeding among top cause teen accident car accident teeu,0
104,accident,"Walker County, Alabama",report motor vehicle accident curry herman rd near stephenson involve overturn vehicle please use,1
105,accident,Australia,bigrigradio live accident awareness,1
107,accident,North Carolina,I mile marker south mooresville iredell vehicle accident r close   pm,1
109,accident,,sleepjunkie sleep pill double risk car accident,0
110,accident,Norf Carolina,accident know gon happen,0
112,accident,"San Mateo County, CA",traffic accident n cabrillo hwymagellan av mir,1
113,accident,North Carolina,I mile marker   south mooresville iredell vehicle accident congestion   pm,1
114,accident,"Njoro, Kenya",pastor scene accidentwho owner range rover,1
117,accident,,mom get home fast wish mom accident truck spilt mayonnaise,0
118,accident,Your Sister's Bedroom,horrible car accident past sunday finally able get around thank god,1
119,accident,,wait piss donnie tell another accident,0
120,accident,"Arlington, TX",truckcrash overturn fortworth interstate click crashgt,1
121,accident,"South Bloomfield, OH",accident ashville us sb sr traffic,1
126,accident,,carolina accident motorcyclist die I crash car cross median motorcycle rider travel,1
128,accident,"New Hanover County, NC",fyi cadfyi accident property damagenhs piner rdhorndale dr,1
129,accident,Maldives,naayf first accident year turn onto chandanee magu near mma taxi ram halfway turn everyone confu,1
130,accident,"Manchester, NH",accident leave lane block manchester nb eddy rd stop traffic back nha delay min traffic,1
131,accident,"Wilmington, NC",accident property damage piner rdhorndale dr,1
132,accident,,accident,0
133,accident,"New Hanover County, NC",fyi cadfyi accident property damagewpd th st,1
134,accident,,pm traffic accident injury willis foreman rd,1
135,accident,global,aashiqui actress anu aggarwal nearfatal accident,1
136,accident,Alberta | Sask. | Montana,suffield alberta accident,1
137,accident,Charlotte,mile backup I southaccident block right lane exit langtree rdconsider nc nc nc alternate,1
138,accident,"Baton Rouge, LA",accident change life help determine option financially support life care plan ongoing treatment,0
139,accident,"Hagerstown, MD",break deadly motorcycle car accident happen hagerstown today ill detail yourstate whag,1
141,accident,"Gloucestershire , UK",flowri marinade accident,0
143,accident,,car even week get fucking car accident mfs can not fucking drive,1
144,accident,UK,norwaymfa bahrain police previously die road accident kill explosion,1
145,accident,"Nairobi, Kenya",still hear church leader kenya come forward comment accident issue disciplinary measuresarrestpastornganga,0
146,aftershock,Instagram - @heyimginog ,aftershockdelo scuf ps live game ya,0
149,aftershock,304,man drive effort get painful man win roger bannister,0
151,aftershock,Switzerland,ir icemoon aftershock djicemoon dubstep trapmusic dnb edm dance icesu,0
153,aftershock,304,victory bargain basement price dwight david eisenhower,0
156,aftershock,US,ir icemoon aftershock djicemoon dubstep trapmusic dnb edm dance icesu,0
157,aftershock,304,nobody remember come second charle schulz,0
158,aftershock,Instagram - @heyimginog ,aftershockdelo speak someone use scuf xb people end get ps also,0
159,aftershock,304,hard conflict glorious triumph thomas paine,0
160,aftershock,,growingupspoile go clay pigeon shoot cry aftershock,0
161,aftershock,Somewhere Only We Know ?,guess actually want free aftershock tc,0
162,aftershock,,aftershock terrify good roller coaster ever disclaimer,0
163,aftershock,Belgium,aftershock,0
164,aftershock,Switzerland,ir icemoon aftershock djicemoon dubstep trapmusic dnb edm dance icesu,0
165,aftershock,US,ir icemoon aftershock djicemoon dubstep trapmusic dnb edm dance icesu,0
168,aftershock,,ir icemoon aftershock djicemoon dubstep trapmusic dnb edm dance icesu,0
170,aftershock,dope show,kjforday see issue aftershock,0
171,aftershock,Switzerland,ir icemoon aftershock djicemoon dubstep trapmusic dnb edm dance icesu,0
172,aftershock,Switzerland,ir icemoon aftershock djicemoon dubstep trapmusic dnb edm dance icesu,0
173,aftershock,"Oshawa, Canada",wisdomwe bonus minute daily habit could really improve life many already lifehack,0
174,aftershock,Baker City Oregon,aftershock protect profit next global financial meltdown david wiedemer http,0
175,aftershock,,moment get scary roller coaster guy behind scream bloody murder silverwood aftershock,0
176,aftershock,,aftershock ac/ fullac/ streaming youtube,0
178,aftershock,United States,gtgt aftershock protect profit next global financial book esquireattire,0
180,aftershock,304,sometimes face difficulty something wrong something right joel osteen,0
182,aftershock,304,thing stand dream try belief actually possible joel brown,0
183,aftershock,marysville ca ,praise god ministry tell like wdyouth biblestudy,0
184,aftershock,304,remember go die good way avoid trap think something lose uo steve job,0
185,aftershock,"Hermosa Beach, CA",try orange aftershock today life never,0
187,aftershock,,onfireander love bb,0
190,aftershock,,aftershock,0
191,aftershock,,aftershock back school kick great thank everyone make possible great night,0
193,aftershock,304,people can not do interrupt uo george bernard shaw,0
194,aftershock,304,first man get oyster second man get andrew carnegie,0
195,aftershock,,anyone need pu tonight play hybrid slayer ps eu hmu codsandscrim empirikgaming codawscrim tpkotc tpfa aftershockorg,0
196,airplane accident,"19.600858, -99.047821",expert france begin examine airplane debris find reunion island french air accident expert,1
197,airplane accident,Pennsylvania,strict liability context airplane accident pilot error common component aviation cr,1
198,airplane accident,"Salt Lake City, Utah",crobscarla lifetime odd die airplane accident,0
199,airplane accident,"Palo Alto, CA",expert france begin examine airplane debris find reunion island french air accident expert wedn,1
201,airplane accident,,alexalltimelow awwww airplane accident go die cutie good job,1
203,airplane accident,"Spain but Opa-Locka, FL",family member osama bin laden die airplane accident ironic mhmmm gov shit suspect,1
204,airplane accident,"Jaipur, India",man go airplane engine accident youtube,1
205,airplane accident,Hyderabad Telangana INDIA,horrible accident man die wing airplane,1
208,airplane accident,"Eagle Pass, Texas",cessna airplane accident oco coahuila mexico july   kill four man include state coahuila government official,1
209,airplane accident,bangalore,horrible accident man die wing airplane watchthevideo,1
210,airplane accident,Financial News and Views,expert france begin examine airplane debris find reunion island french air accident expert wednesdayu,1
211,airplane accident,,expert france begin examine airplane debris find reunion island french air accident expert wednesday begin examine,1
212,airplane accident,Indonesia,kca votejktid mbataweel rip binladen family member kill airplane accident,1
213,airplane accident,y(our) boyfriends legs ,almost send coworker nude accident thank god airplane mode,0
215,airplane accident,"New Mexico, USA",mickinyman theatlantic might kill airplane accident night car wreck politic well,0
216,airplane accident,Somewhere Out There,expert france begin examine airplane debris find reunion island french air accident expert mlb,1
218,airplane accident,,unbelievably insane man airport airplane aircraft aeroplane runway accident freakyu,1
219,airplane accident,Mumbai india,horrible accident man die wing airplaneae,1
220,airplane accident,sri lanka,horrible accident man die wing airplane,1
221,airplane accident,Not a U.S resident,usama bin ladin family dead airplane crash naturally accident,1
222,airplane accident,,pilot die plane crash car festival youtube crash aircraft airplane pilot death accident carf,1
225,airplane accident,"Lehigh Valley, PA",strict liability context airplane accident,1
226,airplane accident,Canada,dtn brazil experts france begin examine airplane debris find reunion island french air accident exp,1
229,airplane accident,,expert france begin examine airplane debris find reunion island french air accident expert wedn,1
231,airplane accident,Thrissur,horrible accident man die wing uiairplaneu wtf canuat believe eye uo,1
232,airplane accident,Havenford,nicole fletcher victim crash airplane time ago accident leave little bit trauma although,1
235,airplane accident,India,omg horrible accident man die wing airplane,1
237,airplane accident,92,omg believe rip bro airplane accident jetengine turbojet boe g,1
238,airplane accident,,expert france begin examine airplane debris find reunion island french air accident expert wednesday begin examine,1
240,airplane accident,Israel,airplane accident,1
241,airplane accident,Fashion Heaven. IG: TMId_,phone look like car ship airplane accident terrible,0
242,airplane accident,"San Francisco, CA",statistically risk getting kill cop die airplane accident,0
243,airplane accident,italy,airplane crash house colombia people die accident,1
244,airplane accident,nyc,shoot airplane accident,1
245,airplane accident,Toronto,could drone airplane accident pilot worry use drone esp close vicinity airport,1
246,ambulance,,early wake call sister beg ride wher ambulance hospital rodkiai,1
247,ambulance,Jackson,twelve fear kill pakistani air ambulance helicopter crash,1
248,ambulance,New York / Worldwide,two air ambulance scene serious crash two car lorry emsneu,1
249,ambulance,,twelve fear kill pakistani air ambulance helicopter crash reuter yugvani,1
251,ambulance,"New Orleans, LA",lead emergency service boss welcome ambulance charity,0
252,ambulance,West Wales,anyone travel aberystwythshrewsbury right incident service halt outside shrews ambulance scene,1
253,ambulance,,twelve fear kill pakistani air ambulance helicopter crash,1
254,ambulance,Happily Married with 2 kids ,ambulance sprinter automatic frontline vehicle choice lez compliant ebay,0
256,ambulance,"Cambridge, MA",nanotech device able target destroy blood clot,0
258,ambulance,Arizona ,skyhawkmm traplord fredosantana lilreese hella crazy fight ambulance couple mosh pit,1
260,ambulance,Mumbai,get run ambulance lucky justsaying randomthought,0
261,ambulance,,twelve fear kill pakistani air ambulance helicopter crash tilnow dna,1
262,ambulance,Amsterdam,twelve fear kill pakistani air ambulance helicopter crash,1
263,ambulance,"Swindon,England ",tanslash wait ambulance,0
264,ambulance,,fouseytube ok need ambulance hahahah good,0
265,ambulance,Happily Married with 2 kids ,ambulance sprinter automatic frontline vehicle choice lez compliant ebay,0
266,ambulance,,pakistan air ambulance helicopter crash kill nine,1
267,ambulance,"Williamstown, VT",thenissonian rejectdcartoon nissan ok need medical assistance call ambulance need,0
268,ambulance,"North Carolina, USA",ems ny emts petition per hour u / minimum wageua ems paramedics ambulance,0
269,ambulance,,twelve fear kill pakistani air ambulance helicopter crash,1
270,ambulance,Karachi,twelve fear kill pakistani air ambulance helicopter crash,1
271,ambulance,Happily Married with 2 kids ,ambulance sprinter automatic frontline vehicle choice lez compliant ebay,0
272,ambulance,Happily Married with 2 kids ,ambulance sprinter automatic frontline vehicle choice lez compliant ebay,0
273,ambulance,Loveland Colorado,kiwikaryn check parking lot say last year ambulance st johns,0
274,ambulance,|| c h i c a g o ||,way ambulance come ltlt,1
276,ambulance,,reuter twelve fear kill pakistani air ambulance helicopter crash,1
277,ambulance,L. A.,twelve fear kill pakistani air ambulance helicopter crash,1
279,ambulance,,ambulance right outside work,0
280,ambulance,Canada,uileoblakecarter dog think he s ambulance,0
281,ambulance,VISIT MY YOUTUBE CHANNEL.,happen hatzolah ems ambulance respond dual siren andu,0
283,ambulance,Lexington,twelve fear kill pakistani air ambulance helicopter crash,1
285,ambulance,,twelve fear kill pakistani air ambulance helicopter crash,1
287,ambulance,USA,twelve fear kill pakistani air ambulance helicopter crash worldnew,1
289,ambulance,"Hannover, Germany",twelve fear kill pakistani air ambulance helicopter crash worldnew,1
290,ambulance,,police ambulance number lesotho body,0
291,ambulance,,medic aaceorg surprise still can not standardised clinical practice across nhs ambulance trust,0
293,ambulance,Playa,twelve fear kill pakistani air ambulance helicopter crash,1
294,ambulance,"Davidson, NC",people try jwalk ambulance pass hate,0
296,annihilated,Higher Places,episode trunk annihilate freiza clean shit ever show nigga mercy,0
297,annihilated,"Horsemind, MI",shall annihilate petebest dessicate lay bare shall kneel,0
298,annihilated,"New York, NY",uribe annihilate baseball met,0
299,annihilated,Boksburg,marksmaponyane heysundown annihilate previous meeting celticindeed improvement,0
301,annihilated,,volfan tneazzy mizzou annihilate florida past season even end muschs career can not compete bama,0
302,annihilated,,annihilate ab,1
303,annihilated,,annihilate status education mba behalf easy street careen eovm,0
307,annihilated,"V-RP @OZRP_ ?MV, AU, R18+?",luka die everything annihilate alois trancy,0
309,annihilated,"Greater Manchester, UK",acarewornheart good un fella sorry get annihilate,0
310,annihilated,Boston,cop pull drunk driver safety second car hit train viralspell,1
312,annihilated,,must annihilate,0
313,annihilated,,cop pull drunk driver safety second car hit train viralspell,1
314,annihilated,The Canopy Kingdom,boom country entirely annihilate hu uo britain,0
315,annihilated,,amirkingkhan would annihilated might well thank floydmayweather,0
316,annihilated,USA,thing suregod promise israel annihilate butthe horror iran wnukes,0
318,annihilated,,violentfeminazi guess ok armenian since spend history getting annihilate,1
320,annihilated,,year since annihilate people instantly become aware ability annihilate whole humanity,1
321,annihilated,the own zone layer ,day tryout go good minus fact stop quickly get short ball annihilate toenail injury even,0
322,annihilated,London,s oryx symbol arabian peninsula annihilate hunter,1
327,annihilated,Trancy Manor,luka die everything annihilate alois trancy,0
328,annihilated,,ready get annihilate bucs game,1
329,annihilated,South 37,philipduncan breakfastone people annihilate last night weather really philip think would forecast,1
330,annihilated,,domain sophistication annihilate closely uptotheminute feat zrnf,0
331,annihilated,"West Lancashire, UK.",stormbeard steellord see judas priest rob come back scorpion support fucking annihilate place astonish gig,0
332,annihilated,PA,officially skip fantasticfourfantsticwhatever hashtag get annihilate review bummer,0
334,annihilated,,tomcatart thus explain annihilated case survivor evolve become godlike,1
335,annihilated,Û¢ Views From The Six Û¢,completely annihilate cech paul keegan time alive,0
336,annihilated,,tomcatart annihilate legion survivor imperfect hybrid project quickly form secret cell,0
337,annihilated,University of Toronto,sirbrandonknt exactly lesnarcena match summerslam last year great brock annihilate guy,0
338,annihilated,,cop pull drunk driver safety second car hit train viralspell,1
340,annihilated,Swaning Around,annihilate damascus syrian army grind u / alloosh gang manure pile,1
341,annihilated,,thatde ok completely forthright may also food coma kebabtahinipickle also annihilate wfrie,0
344,annihilated,London,fun fill happyhour simmon bar camden handsome get annihilate apart game,0
345,annihilated,Albany/NY,juanny beisbol sr annihilate ball lgm,0
346,annihilation,"California, USA",rvfriedmann hell fraction belief total annihilation destruction usa lodisilverado ritzyjewel,1
347,annihilation,,potus maybe call israel tell sorry pre sell river annihilation,0
348,annihilation,,evildead annihilation civilization,0
349,annihilation,,us national park service tonto national forest stop annihilation salt river wild horse change,0
352,annihilation,Wild Wild Web,annihilate quarterstaff annihilation,1
353,annihilation,Subconscious LA,world annihilation vs self transformation alien attack exterminate human,0
354,annihilation,Spain,starmade stardate planetary annihilation youtube,1
355,annihilation,,us national park service tonto national forest stop annihilation salt river wild horse change,0
356,annihilation,CA physically- Boston Strong?,us national park service tonto national forest stop annihilation salt river wild horse change,1
358,annihilation,"Yeezy Taught Me , NV",kimkardashian please sign share petition save wild horse arizona,0
360,annihilation,,us national park service tonto national forest stop annihilation salt river wild horse change,1
361,annihilation,CA physically- Boston Strong?,theellenshow please check salt river horse help stop annihilation happen without signatureschange org thank,0
363,annihilation,United States,soul punish withaeannihilation,0
364,annihilation,,calfreedommom steph mention major contributor annihilation israel,1
365,annihilation,,willienelson need help horse dieplease sign petitiontake stand voice gilbert,1
368,annihilation,"Rock Hill, SC",reject law misguide false prophet imprison nation fuel self annihilation,0
370,annihilation,"Coolidge, AZ",us national park service tonto national forest stop annihilation salt river wild horse change,0
371,annihilation,Republic of Texas,annihilation jeb christie kasich less hour away please god allow least full day,0
372,annihilation,,barbitwin need helphorse die please sign petition take stand voice gilbert,0
375,annihilation,,whippenz need help horse dieplease sign petitiontake stand voice gilbert,0
380,annihilation,"Phoenix, AZ",hey az sign petition save wildhorse tantonationalforest rollingstone singalong order,0
381,annihilation,"Ljubljana, Slovenia",stop annihilation salt river wild horse change,1
383,annihilation,Connecticut,sonofbaldwin he s current nova bookslast checkedhe tie book rider die annihilation,0
384,annihilation,"Tacoma,Washington",us national park service tonto national forest stop annihilation salt river wild horse change,0
386,annihilation,,please sign save saltriverwildhorse,0
389,annihilation,,thank count dante join we follow annihilation zone johnny,0
390,annihilation,Subconscious LA,world annihilation vs self transformation alien attack exterminate human,1
393,annihilation,BIG D  HOUSTON/BOSTON/DENVER,us national park service tonto national forest stop annihilation salt river wild horse change,0
394,annihilation,"Chandler, AZ",us national park service tonto national forest stop annihilation salt river wild horse change,1
396,apocalypse,ColoRADo,go fight taylor soon get,0
397,apocalypse,sindria,ohh fukurodani survive apocalypse bokuto feel horrible poor boy ppor child,1
398,apocalypse,,another jocelyn birthday apocalypse,0
401,apocalypse,,janenelson stephenscifi adaptation watch charlie human apocalypse optione film sciencefiction u,0
402,apocalypse,Texas,apocalypse please,0
404,apocalypse,"Elk Grove, CA, USA",another hour august   pm red rover zombie apocalypse internetradio collegeradiu,1
406,apocalypse,Texas,honeybunzgem primalkitchen feel like pullup stage apocalypse,0
407,apocalypse,,kind hot play radio today next disease apocalypse start everyone careful,0
409,apocalypse,The Shire,apocalypse lol gf m,0
410,apocalypse,"Austin, TX",question interpretation sign apocalypse call,1
412,apocalypse,Oakland,julie r apocalypse version romeo juliet warmbodie,0
413,apocalypse,,apocalypse upon we,0
415,apocalypse,,fittscott minecraft night lucky block mod bob apocalypse wither   mod showcase popularmmos viu,0
418,apocalypse,Albuquerque,begin day snow apocalypse,1
419,apocalypse,,ourmothermary short reading apocalypse spirit angel take top enormous high mountain u,0
420,apocalypse,"Buenos Aires, Argentina",candylit imagine sarumi zombie apocalypse fight back back heart heart conversation,0
421,apocalypse,,zonewolf like youtube video minecraft night lucky block mod bob apocalypse wither   mou,0
423,apocalypse,,planet lone audience apocalypse,0
424,apocalypse,"San Antonio-ish, TX",dad buy dvd look like science doc front read back actually impend biblical apocalypse,1
426,apocalypse,San Francisco,alexandrapullin indeed apocalypse come week ill,0
427,apocalypse,"Oregon, USA",grizzly peak right look like begin dystopian apocalypse movie,0
429,apocalypse,"Harlingen, TX",niece ask would scared apocalypse,0
432,apocalypse,Buffalo NY,storm cairo late xmen apocalypse set photo yahootv,1
435,apocalypse,,minecraft night lucky block mod bob apocalypse wither   mod showcase popularmmos youtube,0
436,apocalypse,,shot heart xv going totally give love bad name heart pierc,0
437,apocalypse,,geekapocalypse pm gmt hesse play dark souls day etcpb,0
438,apocalypse,Las Vegas,zombie take,0
440,apocalypse,,late bryansinger reveal storm queen apocalypse rupaul alexshipppp,1
442,apocalypse,,shadow box apocalypse,1
443,apocalypse,,short reading apocalypse spirit angel take top enormous high mountain,1
444,apocalypse,Tokyo,enjoy liveaction attack titan every time poster remind freshly clean coiffed everyone apocalypse,0
445,apocalypse,,like youtube video minecraft night lucky block mod bob apocalypse wither   mod showcase,0
446,armageddon,"California, United States",pbban temporary avysss armageddon kill flag fast xp reason,0
447,armageddon,"California, United States",pbban temporary russaky armageddon kill flag fast xp reason,0
448,armageddon,#FLIGHTCITY UK  ,official vid doublecup gtgt gtgt trubgme prod thisizbwright gtgt armageddon,0
450,armageddon,,ouvindo peace love armageddon,0
451,armageddon,,good movie ever see armageddon,0
