id,keyword,location,text,target
2573,crash,Darlington,sit rant snapchat apparent fan follower hope train crash xoxo,0
2575,crash,,crash burn,1
2576,crash,,cpanel crash course course,0
2579,crash,"  Melbourne, Australia",destinythegame bungie playstation get kick crash bad experience play video game,0
2582,crash,"Kenton, Ohio",chelsdelong kendraleigh ill crash,1
2585,crash,Galatians 2:20 ,please keep josh salyersblairhall families jennas friends prayer take far soon rip,0
2587,crash,,night go crash party invite feelin sou,0
2588,crash,"Charleston, SC",fatal crash report johns island,1
2590,crash,,photoshop tool crash course complete photoshop tool guide course,0
2591,crash,,photoshop cs crash course course,0
2592,crash,,kinetic typography crash course effect video course,0
2593,crash,"Lancaster, Pennsylvania, USA",police respond crash find suspect heroin,1
2594,crash,,dat liable fuck crash,0
2597,crash,In my own world!!!,akilah world cop pull man car avoid,1
2598,crash,,man kill crash barrington hills hoffman estate man kill singlecar crash wednesday afte,1
2599,crash,,crash helmet silvery floor karnal fat shoot sling pbcanpcx,0
2602,crash,"San Francisco, CA",crash test trailer paul scheer rob huebels comedy special record,0
2603,crashed,Definitely NOT the stables,spicybread coxytown try download crash tutorial,0
2604,crashed,Pakistan,maj muzzamil pilot offr mi crash near mansehra today,1
2605,crashed,"Cuernavaca, Morelos, MÌ©xico.",bin laden family plane crash avoid microlight landi peritoengrafoscopia,1
2606,crashed,,son sleep night finally be lay bed crash,0
2608,crashed,Scotland,neileastwood knobhead bin laden family plane crash avoid microlight landing u,1
2609,crashed,,bin laden family plane crash avoid microlight landing far runway three member,1
2611,crashed,,brianroemmele ux fail emv people insert remove quickly like gas pump stripe reader person tell crash pos,1
2612,crashed,,major hamayun shaheed pilot mi heli crash mansehra,1
2614,crashed,"Va Beach, Virginia",uk bin laden family plane crash avoid microlight landing far runway three member,1
2616,crashed,"52.479722, 62.184971",rosewell crash many time past couple hour,0
2617,crashed,The Pig Sty,gt bin laden family plane crash avoid microlight landing far runway rochdale heywood,1
2619,crashed,,ipod crash weloveyoulouis mtvhott direction,1
2621,crashed,"Bangor, Co.Down",johndcgow hear day ago drive near crashed car laugh much,0
2622,crashed,Weston super mare,olliebailey havnt crash,0
2624,crashed,,could anyone tell crash take long time window please,0
2625,crashed,"Victoria, Tx.",intactmhpartliftsoddsplaneglidednotcrashedintosea yahoofinancehope answer,1
2627,crashed,"Pakistan, Islamabad",pak army helicopter crash mansehra,1
2628,crashed,"Lincoln, NE",uo bug almost crash euro,1
2629,crashed,,pakistan say army helicopter crash countrys restive northwest killing least,1
2631,crashed,,bin laden family plane crash avoid microlight landing far runway,1
2632,crashed,London,guy buy car tuesday police knock door yday cos crash n run day text ask send log book,1
2633,crashed,"Gujranwala, Pakistan",maj muzzamil pilot offr mi crash near mansehra today may almighty give strength family bear loss,1
2635,crashed,Lindenhurst,thief break front window hicksville store stole cell phone flee crash,0
2637,crashed,Islamabad,army source person board include team doctor die helicopter crash near mansehra weather seem crash,1
2640,crashed,Somewhere,smusx skype crash host,0
2641,crashed,,already phone update somehow phone crash restore let restore,0
2642,crashed,too far,second fast overtook twice crash tru love lt lt,0
2643,crashed,Kingswinford,nearly crash car type paul rudd attack fly ant note phone,0
2644,crashed,i love the smurfs 2,honestly nightmarish god drive place always stressful shit hate much ugh almost crash time,0
2645,crashed,,crash car park car day modestmouseremix truestory,0
2647,crashed,,fd mhtwfnet pakistan say army helicopter crash countrys restive northwest fox,1
2648,crashed,International ,ttw todays bin laden family plane crash avoid microlight landing far runway,1
2649,crashed,Viterbo BFA Acting '18,hear skh radio first time almost crash car sos ashtonsos lukesos michaelsos calumsos,1
2651,crashed,Buenos Aires,mh intact part lifts odd plane glide crash sea,1
2655,crush,Kaneohe,kuualohax like love husband post another man man crush monday lol,0
2656,crush,Houma La,womem crush wednesday mommyisbomb,0
2657,crush,,jorrynja bfgfcrush terell,1
2658,crush,,guy make woman crush first ever,0
2659,crush,EastAtlanta ??#WestGeorgia'18,wce can not even lie even though can not stand still always crush explicitpretty,0
2660,crush,"San Antonio, TX",woman crush,0
2661,crush,"Cleveland, Ohio",woman crush wedneday go beautiful taykreidler loveyouuuu aintsheperty,0
2663,crush,,bestfriend high school crush yourboyshawn,0
2664,crush,,ina bute girl crush,1
2666,crush,Everywhere,samelsamel crush,0
2667,crush,,woman crush,0
2668,crush,"San Diego, Texas.",love love love remember first crush,0
2670,crush,GLOBAL,minute alone crushit overrate experiencesmh,0
2671,crush,05/04/2014 18:23 ?,pydisney que crushmtvhott justin bieber,0
2672,crush,Everywhere,masterfsloth crush,0
2673,crush,,lil brother crush mariah,0
2675,crush,,ron fez dave high school crush youtube,1
2676,crush,"Bolivar, MO",girlfriend completely gorgeous woman crush stuff,0
2677,crush,taking pain like pleasure,high moe bouta crush friday,0
2679,crush,San Fransokyo,big crush ever,0
2680,crush,"Washington, DC NATIVE",mrrobinson give thesteveharveyshow vibe music teacher look student crush girl go high school,0
2682,crush,,seriously big girl crush ever blake lively,0
2683,crush,,crush stand vine khadidon,0
2684,crush,Everywhere,yhngsjlg tweet secret crush,0
2687,crush,"Miami, FL",starflamegirl yeah crush,0
2688,crush,,try cute wen crush pass,0
2689,crush,Utah,crush content marketingaemediocrity,0
2691,crush,,crush girl high school even realize lol,0
2692,crush,Everywhere,sevenfigz crush,1
2693,crush,,man crush every fucking day,0
2694,crush,Everywhere,tiffanyfrizzell crush,0
2695,crush,w. Nykae ,crush wce nykae,0
2696,crush,honeymoon avenue,jaureguiswisdom lmao well crush sooo,0
2698,crush,"Toronto, Worldwide ",nowplaying fitz tantrums league crush listen nowplaying,0
2700,crush,,man crush everyday cristianinspire,0
2701,crush,,love love playa crush lot,0
2702,crush,,kenny holland crush da vida,0
2703,crushed,,crush,0
2706,crushed,,popeyes bout get crush,0
2707,crushed,11/4/14,crush holy shit,0
2708,crushed,wherever there's netflix,bhavanas mom crush everyone soul,0
2709,crushed,,crush,0
2711,crushed,,wrapup us cable tv company share crush disney disappoint,0
2714,crushed,"Chicago, IL",jimmyfallon crush squirrel bone mortar pestle schools bio dept really sure worstsummerjob,0
2715,crushed,#HAMont,edwin wow crush,0
2719,crushed,,mango juice crush icegtgtgtgt,0
2720,crushed,U.K.,man crush death car,1
2723,crushed,ph,diamond piece charcoal handle stress exceptionally well hard press every side crush cor,1
2724,crushed,,wow crush edwing bluejay,0
2725,crushed,,crush gym crush butterfinger flurry clearly priority straight,0
2726,crushed,online ,wrapup us cable tv company share crush disney disappoint,0
2727,crushed,,jmastrodonato question would crush ortiz bunt sport writing forefather crush williams,0
2728,crushed,"Conroe, TX",cbsbigbrother ouch clelliyou could almost hear hope dream crush,0
2729,crushed,"Ontario, Canada. ",jesus christ ball fucking crush bluejay,0
2730,crushed,Guayaquil,crush km run pace nike sportwatch gps nikeplus,0
2731,crushed,bahstun/porta reeko,papi absolutely crush ball,0
2732,crushed,"Bucks County, Pa",crush mile run tonight awesome,0
2733,crushed,Sunny South florida ,wrapup us cable tv company share crush disney disappoint,0
2734,crushed,Rio,oil price fall driver could reap benefit,0
2736,crushed,Neverland,crush km run pace nike sportwatch gps nikeplus,0
2739,crushed,Pennsylvania,nick williams hit another bomb crush,0
2740,crushed,,holy moly crush,1
2741,crushed,,ayekoradio play brasswork agency crush shake radio netlabel electronicmusic listen ccmusic,0
2743,crushed,,many youtube commenter say dothraki would get crush come westerosnah bro underestimate dothraki,1
2744,crushed,Trinidad & Tobago,disillusion lead character check happy lucky free spirit girl check dream life crush check great music check crowe trope intact,0
2748,crushed,Chicago - Lake Buena Vista,remember nora jones crush two week notice,0
2749,crushed,"Toronto, Ontario",empire avenue crush soul markwschaefer,0
2752,crushed,"Liberty Lake, WA",chapoutier croze hermitage much purple violet slate crush gravel white pepper yum france wine dc,0
2753,curfew,,thecomedyquote shadezofgrey thirst curfew pperez,0
2755,curfew,Ankara - Malatya - ad Orontem,ara report jan fighter infiltrate ashrafiyah district afrin aim carry suicide attack ypg impose curfew,1
2756,curfew,,keurley thirst curfew,0
2757,curfew,,fact curfew,0
2758,curfew,"antioch, california",michelleellle shut freshman past curfew need sleep spend much time watch tv instead go outside,0
2759,curfew,"State College, PA",night curfew cus find,0
2760,curfew,"Chicago, IL",police teenager arrest curfew violation evanston ride steal bicycle two teenager take cus chicago,1
2761,curfew,,reason listen curfew overtime stick kodak,0
2763,curfew,somewhere in cali ,bobbyxfisher give curfew,0
2765,curfew,Im Around ... Jersey,curfew really help,0
2766,curfew,Garden Grove,exofficio mens boxer brief curfew large,0
2767,curfew,"Adelaide, Australia",info wnd cld sct bkn exp inst apch rwy curfew oper z taxiways foxtrot   foxtrot navbl tmp,0
2768,curfew,,emaaalay thank city wide curfew,0
2769,curfew,,say curfew nope,0
2770,curfew,BKI-KUA,curfew start right private class end tutor must woman preferably someone,0
2771,curfew,,aptlyengineerd curfew,0
2773,curfew,urÌ£nus,past curfew grove,0
2774,curfew,"Illinois, USA",emmychappy clock mom say everyone home curfew,1
2777,curfew,A.A.S my Aztec Princess,reddakushgodd say month get curfew time smfh,0
2778,curfew,turner fenton,ball curfew,0
2780,curfew,,scotrail see turn blind eye bloke drinking smoking curfew time cosit worth hassle,1
2782,curfew,"KLA,Uganda",next may ill freefrom school obligation like family good damn curfew,1
2783,curfew,Uganda,daviskawalya mauryn say final goodbyes grandpa see rip always open idea may curfew,0
2784,curfew,,people really still curfew even   graduate high school,0
2785,curfew,253,stupidniggr tell mom past curfew oth,0
2786,curfew,"Elkhart, IN",cancel cat doctor appointment decide play home curfew,0
2787,curfew,"Adelaide, Australia",info r curfew oper z taxiways foxtrot   foxtrot navbl wnd exp inst apch rwy d tmp qnh,0
2788,curfew,California,lie though pay old sometimes like first get car curfew freedom donthate,0
2792,curfew,"Adelaide, Australia",info cld sct bkn exp inst apch rwy curfew oper z taxiways foxtrot   foxtrot navbl tmp wnd,0
2793,curfew,Pon Di Gully,rite man tlk widout nuh curfew long side aka cum fi steal di show itz rubbery di whole dem fi knw sound music,0
2794,curfew,Benedict College,even worried curfew bc,0
2795,curfew,HTX,get whole curfew,0
2796,curfew,,hour late curfew pray dog bark unlocking door,0
2797,curfew,IM LOST ,da judge give dis girl pm curfew,0
2799,curfew,Miami,begin summer mom make curfew back never wonder always home,0
2801,curfew,,charlie lim start pm sunday curfew leh,0
2802,curfew,"Hamilton, ON",bomb try get home curfew,0
2803,cyclone,United Kingdom,awwww baby walter rewatchingthepilot teamscorpion cyclone,0
2807,cyclone,"Des Moines, Iowa ",big ten annual football medium day get cyclone hoop recruit nugget,1
2808,cyclone,USA,camera art photography boltaecyclone dr ppdr dual outlet power packaefor external camera flash u,0
2811,cyclone,Rural Northern Nevada,mccauleysdesign abysmaljoiner dyamiplotke work purpose large cyclone would better k,0
2813,cyclone,Republic of the Philippines,tropical cyclone form near guam form call molave,1
2815,cyclone,,video de jhaustin thomas cyclone ame tribune ame tribune video de jhaustin thomas onu,0
2817,cyclone,,xhnews need plant pacific cyclone season would help,1
2819,cyclone,,bbc force retract false claim cyclone pam wordpressdotcom,1
2820,cyclone,,great condition easton cyclone softball bat fastpitch   sk,1
2821,cyclone,Philippines ,severe weather bulletin typhoon uihannaphu soudelor tropical cyclone warning issue pm,1
2822,cyclone,"Washington, DC",cyclone derive power calm center person norman vincent peale,1
2825,cyclone,hyderabad,roughdeal ante hudhud cyclone chandrababu valle ne ante ga,1
2826,cyclone,Vancouver (HQ) and worldwide,cyclone komen devastate family myanmar week need help today,1
2827,cyclone,"Quezon City, Philippines",severe weather bulletin tropical cyclone warning typhoon hanna issue pm thursday august,1
2828,cyclone,Geneva,back future vanuatu cyclone pam encourage traditional way live,1
2829,cyclone,"Hartford,  connecticut",bank manager ask tom interview cyclone tom loan give purchase bicycle,0
2830,cyclone,"Sioux Falls, SD",excite cyclone football,0
2831,cyclone,Cornwall,bbc force retract false claim cyclone pam wordpressdotcom,1
2832,cyclone,Beside Basketball,talent misdirection cyclone pass ignite pass vanish drive phantom shot kurokobot,1
2833,cyclone,"Rome, Italy",comdev asia radio station bangladesh broadcasting program address upcoming cyclone koman,1
2835,cyclone,Tafekop Ga-Matsepe,like cyclone imperialism spin across globe militarism crush people suck blood like,1
2836,cyclone,,mercury cyclone gt hood mould nice core cobra jet cj gt,0
2838,cyclone,,cyclone passion overblown,0
2839,cyclone,,majesty emperor salman khan unstoppable cyclone entertainment humanity bajrangi bhaijaan create history everywhere crose cr,0
2841,cyclone,,mercury cyclone gt quarter panel ds rear trim mould cobra jet cj,1
2842,cyclone,,tropical cyclone info soudelor hpa maximum wind speed ms maximum wind gust speed ms,1
2843,cyclone,Melbourne,cyclonereizei may ask cyclonesama read jail fate rindou,0
2844,cyclone,Vilnius,drug alcohol jackson vroman house,0
2846,cyclone,Geneva,blend old vanuatu prepare future emergency,0
2849,cyclone,,wfp wfp deliver food bangladesh flood victim tropical cyclone komen dhaka uothe united na,1
2851,cyclone,,rohingya houses kyee nockthie hamlet taungbazar region buthidaung severely damage cyclone kasitaroch vivianunhcr,1
2852,cyclone,Made in America,cyclone double g would cherry top outfit ootd doubleghat,0
2853,damage,"PS4, now stop asking",thelegendblue cozmo probably allow we ascend get damage max value,0
2854,damage,,drop nigga damage,0
2855,damage,Cheshire. London. #allover,union supportive london yet prepare damage economically aPSm last time,0
2856,damage,"Texas, USA",like youtube video gta online collateral damage gta v online pc,0
2857,damage,"Bartholomew County, Indiana",fyi accident property damage limestone lncolyellowstone wayfieldstone dr,1
2858,damage,U.S,fitness knee damage solution,0
2860,damage,My mind is my world,complain phoenix mode fire emblem turn ray gigant difficulty option take damage,0
2861,damage,,capicapricapri brentobento wha kids damage,0
2863,damage,Catskills,clear accident property damage ny eb ny,1
2864,damage,,crazy phone much damage person,0
2865,damage,"Columbia, SC",writebothfist get pretty windy damage,0
2866,damage,,reuse advanced life equipment transit drum chaign damage fdbdp,0
2867,damage,Right here,indigoe carful spot damage time check time give away baggage loss wy,0
2869,damage,Texas,storm damage report west tennessee,1
2870,damage,"Lawrence, KS via Emporia, KS",hey royal love damage out,1
2871,damage,http://twitch.tv/jcmonkey,drothvader cmnevalistis keep please arachy piece deal weapon damage,1
2872,damage,Indonesia,mage fairy tail specialize property damage natsu dragneel,0
2873,damage,Unknown,bradleybrad yeah fast extremely high damage fast go get,1
2875,damage,Unknown,bradleybrad see fast af great damage upgrade shitton use exclusively whole playthrough,0
2877,damage,"Marysville, MI",let we tree fall fence homeowner insurance may help,0
2878,damage,"New Haven, Connecticut",joedawg tor tor situation wind damage enhance word key going,1
2879,damage,,hfxstanfield beelievedc discoverycntr happen hear runway lighting damage contractor,1
2880,damage,Austin | San Diego,swb nda write damage ability offer service future probably work anyway,0
2881,damage,??? ?? ??????? ,trillion crosse line rd time fieldwide attack instant kill damage,1
2882,damage,"Pontevedra, Galicia",np metallica damage inc,0
2883,damage,Somewhere in the Canada,nine inmate charge cause damage calgary remand centre riot,1
2884,damage,London/New York,pt crosssectarian protest powerful shia cleric say militia must withdrawur fightin isis forget damage uve do people,1
2885,damage,"261 5th Avenue New York, NY ",homeowner insurance cover water damage good thing,1
2886,damage,,beach damage shit,1
2887,damage,,wonderousallure cross arm cover hand anymore damage hhello,0
2888,damage,,post blog thesensualeye model cam damage toronto apr nsfw pussy ass boob asian nude u,0
2889,damage,Charlotte NC,report hit runin roadwayproperty damage statesville rd,1
2890,damage,,devil may cry special edition vergil vs agnus window mission dmd damage leedstraif,0
2891,damage,"Rockville, Maryland",glaucoma occur fluid build pressure inside eye level may damage optic nerve eyefact,1
2893,damage,,jsunnews storm damage report madison county thunderstorm damage report ar,1
2895,damage,,sa puncture wound without foreign body leave index finger without damage nail initial encounter icd,1
2896,damage,Australia,thank richarkkirkarch ausinstarchitect word warn queenswharf brisbane financialreview,0
2898,damage,Your Conversation,real shit damage bitch,0
2899,damage,USAoV,lmao fuckboy change damage control pseudojuuzo,0
2900,damage,"Bhopal, Madhya Pradesh, India.",michaelwestbiz standard damage control,1
2902,damage,Tennessee,gettinglost jennellensbb munclejim say superficial wound pepper spray damage,1
2905,danger,,blizzheroe dustinbrowder dad chase constantly time frequently great deal danger distraction lt,0
2907,danger,#LemonGang ,believe shirt company every animal ever danger well start see change wildlife,0
2908,danger,ayr,danger union bear,0
2909,danger,,signup open fall danger release day blast review tour signup,1
2910,danger,Worldwide,dyannbridge yeshayad check rockin preview claytonbryant danger zone come soon artistsunite,0
2911,danger,"San Jose, California",red flag warning fire danger dry thunderstorms bay area weather cawx nwsbayarea,1
2912,danger,Worldwide,carsonrex spaceangelseven check rockin preview claytonbryant danger zone come soon artistsunite,0
2913,danger,"Loughborough, England",like could danger something,1
2915,danger,Killarney,last tree cut last fish eat last stream poison realize,0
2916,danger,"Brooklyn, NY",take away preservation park r imposition danger african people never imagine,0
2917,danger,Lahar & Gwalior,indian govt medium take serious concern safety danger,1
2920,danger,"St Paul, MN",training grain wheat bare gold august heat anger trespass lest seek danger,0
2921,danger,Atlanta Georgia ,therealrittz fettilootch slanglucci oppression great danger come soon album,0
2922,danger,,morehouse appear govt lose ethical moral relevance mean whole usa population danger,0
2924,danger,"Lincoln, IL",like head first slide especially home danger,0
2925,danger,World,permit bear hunt danger outnumber actual bear license floridas fir st petersburg,0
2927,danger,Spinning through time.,riverroame much danger please,0
2929,danger,Atlanta Georgia ,bluebirddenver fettilootch slanglucci oppression great danger come soon album,1
2931,danger,"Boston, MA",uber look repair recent bad rap nonprofit partnership,0
2932,danger,Hailing from Dayton ,wish could get victoria secret front good,0
2933,danger,Worldwide,turnedonfetaboo hsjb check rockin preview claytonbryant danger zone come soon artistsunite,0
2934,danger,"Newcastle Upon Tyne, England",thetxi gunnersfan would arsenal fan west ham relegation battle season danger afc sun,0
2935,danger,Atlanta Georgia ,remainontop fettilootch slanglucci oppression great danger come soon album,0
2936,danger,Atlanta Georgia ,nugget fettilootch slanglucci oppression great danger come soon album,0
2937,danger,,danger excitement underwater cave diving,0
2939,danger,,girl save like danger health try somebody somebody else,0
2941,danger,Instagram: trillrebel_,gun protection shit really use unless life danger,0
2942,danger,ALWAYS DYING NEVER RESTING,thirsty danger dehydration,1
2943,danger,"San Jose, CA",thunderstorm little rain expect central california high fire danger weather cawx,1
2944,danger,2005 |-/,get danger day tattoo bad cool would spider like someone wrist smth,0
2945,danger,Israel,experience always angry critical pundit grave danger go rail,0
2946,danger,Uruguay / Westeros / Gallifrey,danger skyler danger,0
2947,danger,"Kansas City, MO",dangerous ok rest us danger,0
2948,danger,"Silver Spring, MD",investigate robert mueller respond complaint since nov   leave meson danger,0
2950,danger,Jersey - C.I,honestly though modibo maiga steal live fuck past good still danger fucktard coyi,1
2952,danger,,fear way make we danger none contemplate logic behind situation find courage engage,0
2953,dead,,joel book act,0
2954,dead,Afghanistan,dead afghanistan aircraft crash afghan military helicopter crash remote region,1
2955,dead,Sweden,silentsiris even awesome norse landscapes load atmosphere life boringdead snotgreen wasteland,0
2956,dead,,miss long hairbut dead anyways even hair,0
2957,dead,,cjbanning sake argsuppose preborn attain individl rightsgenerally courtof law forbid kill unless dead person something,0
2959,dead,London,remember time goku give life dead birb hell goku,0
2960,dead,"Orlando, FL",naaa bee dead like legit zombie feel every sore part body,0
2963,dead,,happen get road right behind bus dead serious,0
2965,dead,Atmosphere,lmfao fucking luis hhahaha dead,0
2969,dead,,watch emmerdale nd slightly attractive man name ross get beat nd he s dead,1
2970,dead,Glasgow,soapscoop need confirm ross dead trust anyone else yh,0
2971,dead,,gailsimone iwasdisappointedby telltale walk dead good character story real gameplay many performance issue,0
2973,dead,,beforeitsnew hundred fear dead libyan migrant boat capsize rescue u,1
2974,dead,somewhere in Portugal,ituas war came never wave white flag front canuat end dead mislead,0
2975,dead,South Stand,joneskyle oh fuck sake dead,0
2976,dead,dundalk ireland,emmerdale ross really dead askcharley,0
2980,dead,,avoid wear dead black flame red stark white much esp debate blue gold brown even shoe,0
2982,dead,,perspective grateful dead critical writing contribution study,1
2983,dead,"Sochi, KDA, RU",hlportal hello look mod cold ice see site link download dead maybe share thank,0
2984,dead,"ÌÏT: -26.695807,27.837865",kgvaal lmaovv hard ny trend babalmaowelcome nyozi kwaaaaadead,0
2987,dead,South Stand,joneskyle say he s dead else die,0
2988,dead,You're not 19 forever   ,ross dead noooooooooooo mikeparractor,0
2990,dead,"Kettering, OH",think time friend bail nite dead showwent alone great time alone free dance front row,0
2991,dead,United States,typhoon soudelor take dead aim taiwan,1
2992,dead,,askcharley emmerdale emotional ross dead emmerdale,0
2993,dead,Planet Earth,man find dead demi moore swim pool,1
2995,dead,Spare 'Oom,val dead suing,1
2998,dead,,atchisonsean dead,0
3000,dead,United States,wyrmwood road dead fucking awesome awesome end awesome,0
3001,dead,Milton Keynes ,can not believe ross dead emmerdale mikeparractor emmerdale summerfate,0
3003,death,,call text niggas bff boyfriend love boy death niggas hold attention like,0
3004,death,ATL??AL??,hate talk otp grandma mean love death talk damn much ssshhheeesshh,0
3005,death,UPTOWN ,death ill forever rep jet,1
3006,death,,vibrator shape vape done bust,0
3009,death,PROV,death threat nigga life well gon,0
3010,death,"Novi, MI",adult die plague colorado,1
3011,death,New York,xbox pro console red ring death full read ebay,0
3012,death,"Buenos Aires, Argentina",go back gainesville death,1
3013,death,on the go,year later ferguson see change ask ituas real,0
3014,death,,papiichoo enjoy obama era civility prez say gop support iranian death,0
3015,death,,feel like death,0
3016,death,The UK,like youtube video jeromekem dj hazard death sport,0
3018,death,,tell cousin hang text say come honestly death wish,0
3019,death,,rss judge orders texas recognize spouse samesex death certificate,0
3021,death,mpls. ,loyalty mission involve kick shitty nobleman death love elven weirdo,0
3022,death,"Kensington, MD",way seemeth right unto man end thereof way death,1
3023,death,Buffalo/DC,kellkane thank narrowly avert death fun right,1
3025,death,,arianagrande screamqueen katherine death,0
3026,death,"Sylacauga, Alabama",allahsfinest death muslim,1
3027,death,,go starve death,0
3029,death,,ted cruz bash obama comparison gop iranians shout death america,0
3030,death,,arianagrande screamqueen katherine death,0
3034,death,,crime know right punishable death,0
3036,death,USA,issue upload death smoochy awakening clip youtube reason bicentennial man pain ass,0
3037,death,To The Right of You!,ted cruz bash obama comparison gop iranians shout death america tcot,1
3038,death,Cyprus,cyprus analysis mullah omars death may split taliban rank omar demise would certainly lead,1
3039,death,kansas,feel like deathholy moly,0
3042,death,"Los Angeles,CA, USA",video slay mexican journalist unknowingly predict death breitbartnew,0
3043,death,"Portland, OR",old lady rockin death metal sedan downtown smoking cigarette find real mom,0
3044,death,Carry On Jutta!!!,afghan peace talk doubt mullah omars death financial times mullah,0
3045,death,Home of the Takers.,pusssssssssy shoook death,0
3047,death,"New York, New York",first trial death cecilthelion postpone,0
3048,death,,year ago week anniversary marilyn monroe death ripriprip,0
