id,keyword,location,text,target
7970,razed,,late home raze northern california wildfire lynchburg advance,1
7971,razed,WorldWide,late home raze northern california wildfire york times tafs fb,1
7972,razed,,late home raze northern california wildfire abc,1
7973,razed,,late home raze northern california wildfire abc,1
7976,razed,,late home raze northern california wildfire,1
7977,razed,,late home raze northern california wildfire,1
7978,razed,,late home raze northern california wildfire,1
7980,razed,North,petereallen huffpostuk bbclive significant iconic pic church maybe ruin less substantial effort raze,0
7981,razed,,late home raze northern california wildfire,1
7982,razed,,late home raze northern california wildfire,1
7983,razed,,late home raze northern california wildfire abc,1
7984,razed,"Ames, IA",davidvonderhaar least sincere,1
7987,razed,,late home raze northern california wildfire abc,1
7988,razed,,late home raze northern california wildfire abc,1
7989,razed,,late home raze northern california wildfire,1
7990,razed,San Diego California 92101,home raze northern calif wildfire sandiego,1
7991,razed,Nairobi-KENYA,george njenga hero save burn friend raze wildfire,1
7992,razed,"Erie, PA",today another dualcom imraze enjoy yesterday check today pm easter,0
7994,razed,,late home raze northern california wildfire abc gn,1
7996,razed,,late home raze northern california wildfire abc,1
7999,razed,,late home raze northern california wildfire abc,1
8000,razed,,late home raze northern california wildfire abc,1
8001,razed,,late home raze northerncalifornia wildfire zippednews,1
8002,razed,,late home raze northern california wildfire,1
8003,razed,Nairobi-KENYA,george njenga hero save burn friend raze wildfire,1
8005,razed,,late home raze northern california wildfire,1
8006,razed,,late home raze northern california wildfire abc,1
8008,razed,"Augusta, Maine, 04330",vassalboro house raze way public gazebo petelmcguire report,0
8009,refugees,,justmarrie turkish couple give syrian refugee incredible gift feed instead family friend,1
8010,refugees,Ad Majorem Dei Glorium,police monitor jihadis poland freedomoutpost,1
8012,refugees,"Aurora, Ontario ",turkish newlywed donate wedding money beautiful gesture still faith humanity,0
8013,refugees, Baku & Erzurum ,justmarrie turkish couple give syrian refugee incredible gift washingtonpost,1
8015,refugees,Statute Of Limitations_,repulsive refugeesvictimiserdutton evangelicalliarabbott co lnp dupe press overdrive choppergatebronwynbishopauspol,0
8016,refugees,paradise,retweet cameroon repatriate nigerian refugee due boko haram,1
8017,refugees," BC, US, Asia or Europe.",newlywed feed syrian refugee wedding cbc late canada world entertainment business,0
8018,refugees,,wowo nigerian refugee repatriate cameroon,1
8019,refugees,,hmm nigerian refugee repatriate cameroon,1
8020,refugees,,whao nigerian refugee repatriate cameroon,1
8021,refugees,St PetersburgFL,imagine entire aisle dedicated make people like serbian refugee director whole food clothing section,0
8023,refugees,EspaÌ±a,viralspell couple spend wedding day feed syrian refugee,0
8024,refugees,,reaad plsss nigerian refugee repatriate cameroon,1
8025,refugees,Tarragona,top story viralspell couple spend wedding day feed syrian refugeesu,0
8026,refugees,,refugee connection indiegogo caign go live tomorrow support we help launch online community refugee,1
8028,refugees,,read nigerian refugee repatriate cameroon,1
8029,refugees,,short throw overboard leader could much bad refugee tonyabbottmhr bad pm ever,1
8030,refugees,Warri,cameroon repatriate nigerian refugee,1
8031,refugees,Melbourne Australia,captain abbott must lnp boat refugee christianvalue,0
8032,refugees,,turkish couple spend wedding day feed syrian refugee turkish couple get marrie u,0
8034,refugees,"21.462446,-158.022017",couple use drone save refugee world deadly border,1
8035,refugees,,whao nigerian refugee repatriate cameroon,1
8036,refugees,,hmm nigerian refugee repatriate cameroon,1
8037,refugees,"Bangalore, India",turkish couple decide feed syrian refugee part wedding celebration,0
8038,refugees,Skyhold,fadelurker dalinthanelan lt right even two year still refugee ce south redcliffe village aidan gt,1
8039,refugees,Australia,newlywed feed thousand syrian refugee instead host banquet wedding dinner age,0
8040,refugees,"Amman,Jordan",photo young refugee force flee burundis violence vice,1
8043,refugees,tripoli international airport,kristindavis un refugees thank un refugee help many people need world u,0
8044,refugees,,wowo nigerian refugee repatriate cameroon,0
8045,refugees,,newlywed feed thousand syrian refugee instead host banquet wedding dinner smh,1
8047,refugees,"Auckland, New Zealand",pacic media centre article australia rsf protests security gag report,0
8049,refugees,,recap nigerian refugee repatriate cameroon,1
8055,refugees,"NYC,US - Cali, Colombia",generous bride earth couple feed syrian refugee wedding day thedailybeast love,0
8056,refugees,,whao nigerian refugee repatriate cameroon,1
8057,refugees,QLD Australia,return refugee flee vietnamese govt treat return dutton presser,1
8058,refugees,"Geneva, Switzerland",chpsre refugee follower paris visit dream humanity exhibition rezaphotography u u,1
8060,rescue,Trinidad & Tobago,policyholder object clico rescue plan,1
8061,rescue,SF Bay Area,panik kelbytomlinson rescue,0
8062,rescue,#HarleyChick#PJNT#RunBenRun,coastal german shepherd rescue oc share link animalrescue,0
8064,rescue,"Toronto, Ontario",ud rescue structural collapse scott road ypres road york truck,1
8065,rescue,New Jersey,rescue day ituas world cat day saturday aug th black blackwhite cat newbeginningsanimalrescue,0
8066,rescue,Big NorthEast Litter Box,blood pressure med still probably roof long ppact story break involve animal rescue,0
8067,rescue,Sand springs oklahoma,coastal german shepherd rescue oc share link animalrescue,0
8068,rescue,,coastal german shepherd rescue oc share link ecstatic rescue racco animalrescue,0
8069,rescue,,suggs vivian rescue psychrewatch,0
8070,rescue,"Surry Hills, Sydney",length rescue cat need,0
8071,rescue,Sand springs oklahoma,last chance animal rescue post animalrescue,0
8073,rescue,#HarleyChick#PJNT#RunBenRun,last chance animal rescue post animalrescue,0
8074,rescue,,sammy todd always rescue may uniform still rescue lmao forever kfc fam,0
8079,rescue,USA,lunch crew make night night long day peaceloverescue,0
8081,rescue,Thornton  Colorado,tell united nations plantation forest rainforestresq,0
8083,rescue,Wanderlust,mary come troy rescue,0
8084,rescue,"Toronto, Ontario",ud rescue structural collapse scott road ypres road york truck,1
8085,rescue,Karachi,floodzone general raheel sharif visit chitral also laud effort fwo army troop army aviation rescue opera,1
8087,rescue,,last chance animal rescue post animalrescue,0
8088,rescue,,lisavanderpump many dog rescue dog,0
8089,rescue,India,official rescue migrant libya body find fox,1
8091,rescue,U.S.A.   FEMA Region 5,coastal german shepherd rescue oc share link animalrescue,0
8094,rescued,United States,zakbagan sabrina dad rescue dude keep cage since,1
8095,rescued,,briton rescue amid himalaya flood,1
8096,rescued,Nigeria,kidnap lady rescue police enugu nigerian tribune,1
8097,rescued,Jakarta,rescue med migrant arrive sicily,1
8098,rescued,"Ohio, USA",tennoatax hand glass water sit rescue tenno live ship around dojo year,0
8100,rescued,watford,trust we get rescue dopey one val hilarious shame probably go die emmerdale,0
8101,rescued,West Hollywood,summer summervibes california puppy pitmix rescue brixton banksy happy mybabie,0
8102,rescued,Kent,man bury dog alive thought would find rescue time,0
8103,rescued,Canada,monthold baby girl rescue coastguard float half mile sea socialnew,1
8105,rescued,The Multiverse,skyrim await rescuedagain,0
8106,rescued,USA,rescue med migrant arrive sicily,1
8109,rescued,Bournemouth,finnish hip hop pioneer paleface rescue drift raft bring container later enkelbiljett menolippu,0
8110,rescued,Jammu | Kashmir | Delhi,bovine rescue smugglersaenabbe,1
8111,rescued,,fund need rescue abandon cocker spaniel,0
8112,rescued,,like youtube video romanatwoodvlog rescue sick kitten,0
8113,rescued,,briton rescue amid himalaya flood,1
8116,rescued,southern california,brave little dog get rescue river recovery inspi youtube,0
8118,rescued,"Philadelphia, Pennsylvania USA",homeless man travel across usa stray dog rescue get help hand stranger reshareworthy,0
8119,rescued,,brittanypetko break tonight kid rescue play room week food water parent sex life haha,1
8120,rescued,"Winston-Salem, NC",rescue actually pretend giorgio hiatt,0
8121,rescued,"Huntley, IL",rescue dog least year ago old still sweet ever zakbagan,0
8122,rescued,NIGERIA,rescue med migrant arrive sicily hundred migrant rescuedu,1
8125,rescued,The green and pleasant land.,take back africa rescue cnews,1
8126,rescued,Earth,migrant rescue boat capsize libya,1
8128,rescued,,young child among rescue capsize boat libya irishtimesworld,1
8129,rescued,,heroes springer spaniel dog dad rescue strand baby dolphin,1
8130,rescued,"Leeds, U.K.",trust we get rescue dopey one emmerdale summerfate,0
8131,rescued,Ireland,three beach whale rescue kerry,1
8133,rescued,,rescue tb go ribbon hit offtrackhorse,0
8135,rescued,,turn back rescue sweep away sin though clouds isaiah contemporary english version,0
8136,rescued,"Pennsylvania, USA",zakbagan pet r like part family love animal last pet rescue break heart animal mistreat,0
8137,rescued,Boston MA,like youtube video homeless dog live cardboard box get rescue heartwarming,0
8138,rescued,Canada,angry mistrustful rescue elephant find peace friendship home photo onegreenplanet,0
8140,rescued,Jakarta/Kuala Lumpur/S'pore,photo hundred rescue migrant await disembarkment irish naval vessel palermo italy tconnellyru,1
8141,rescued,Cape Town,rescue med migrant arrive sicily,1
8142,rescuers,Nigeria,video picking body water rescuer search hundred migrant africa,1
8143,rescuers,Westerland,video picking body water rescuer search hundred migrant mediterran,1
8144,rescuers,Kuala Lumpur,video picking body water rescuer search hundred migrant mediterran,1
8146,rescuers,Surabaya,video picking body water rescuer search hundred migrant mediterran,1
8147,rescuers,#iminchina,video picking body water rescuer search hundred migrant mediterranean,1
8149,rescuers,,world fear miss migrant med rescuer search survivor boat carry many,1
8150,rescuers,Africa,durbanknight rescuer search hundred migrant mediterranean boat carr nosybe,1
8154,rescuers,,unexplainable desire watch rescuer childhooddefine,0
8155,rescuers,Nigeria,roddypiperauto fear miss migrant med rescuer search survivor boat carry,1
8156,rescuers,Birmingham,andygilder channel rspca dog rescuersthe infomercial creep back door,0
8158,rescuers,,video picking body water rescuer search hundred migrant mediterranean boat carryi,1
8159,rescuers,,womanuas gps app guide rescuer injure biker marin county,1
8161,rescuers,,video picking body water rescuer search hundred migrant mediterran,1
8162,rescuers,London,video picking body water rescuer search hundred migrant mediterran,1
8163,rescuers,,video picking body water rescuer search hundred migrant mediterranean boat carryi,1
8164,rescuers,,video picking body water rescuer search hundred migrant africa,1
8165,rescuers,,last second ebay bid shaolin rescuers dvd shen chan nan chiang five venom kung fu please favori,0
8168,rescuers,,video picking body water rescuer search hundred migrant mediterranean boat carryi,1
8169,rescuers,,worldnews video picking body water bbc home rescuer search hundred,1
8170,rescuers,"?????????????, Thailand ",video picking body water rescuer search hundred migrant mediterran,1
8171,rescuers,,video picking body water rescuer search hundredsu,1
8172,rescuers,17th Dimension,ahmaze story power animal rescuer starve homeless dog future rescue person,1
8175,rescuers,,rescuer search hundred migrant mediterranean boat carry many people capsize coast ofu,1
8176,rescuers,Washington,many death shipwreck rescuer try save hundred migrant thenewshype,1
8177,rescuers,USA - Canada - Europe - Asia,video picking body water rescuer search hundred migrant mediterran,1
8180,rescuers,worldwide,video picking body water rescuer search hundred migrant mediterran,1
8181,rescuers,Phoenix,rescuer find barely alive idea allergic,1
8182,rescuers,,fear miss migrant med rescuer search survivor boat carry many migrant,1
8183,rescuers,,video picking body water rescuer search hundred migrant mediterranean boat carryi,1
8184,rescuers,,womans gps app guide rescuer injure biker marin county sfgate,1
8187,rescuers,,fear miss migrant med rescuer search survivor boat carry many migrantsu,1
8188,rescuers,,rescuer find survivor nepal earthquake bury,1
8189,rescuers,"Paris, France",rescuer recover body yearold calgary man lake near vulcan u,1
8190,rescuers,,fear miss migrant med rescuer search survivor boat carry many migrantsu,1
8191,rescuers,"Here, there and everywhere",video picking body water rescuer search hundred migrant bbc,1
8195,riot,Belgrade,meatlove feminist world riot grill arrive pop quiz prefer fem art,0
8196,riot,India,stuart broad take eight joe root run riot aussie,0
8201,riot,"Cardiff, UK",piprhys predict riot,1
8202,riot,,teamvodg discover nickcannon listenbuy realmandyrain riot itunesmusic itune u blowmandyup,0
8203,riot,,meatlove feminist world riot grill arrive art,0
8204,riot,Bossland,rascal flatts riot tour atlantic city beach concertaugust   ticket,0
8205,riot,World Wide Web,meatlove feminist world riot grill hasaearrive,0
8208,riot,"Uppsala, Sweden",seriously tactical riot headquarters disney marvel,0
8209,riot,East London,daniriot keep eye well look lot team member come daysweek,0
8210,riot,"Detroit, MI",meatlove feminist world riot grill arrive pop quiz prefer feminist,0
8211,riot,,liveworkshop selfie booth riot kappa,1
8212,riot,,acaciapenn ill start big ass riot send jail today mfs shidddd,0
8213,riot,,riot kit bah part concept gear come autumnwinter menswear fashion urbanfashionu,0
8214,riot,,abrancaballero discover nickcannon listenbuy realmandyrain riot itunesmusic itune u blowmandyup,0
8215,riot,,like youtube video thorin thought riot sandbox mode lol,0
8216,riot,,stuart broad take eight joe root run riot aussie stuart broad take careerbest figure,0
8217,riot,"Los Angeles, CA",retweete sarah silverman sarahksilverman soundtrack walk start w tracey ullman perfect,0
8218,riot,,meatlove feminist world riot grill arrive,1
8219,riot,,time riot really official satan teemo skin,0
8221,riot,"Montana, USA",like youtube video sick riot shield slide spot,0
8223,riot,"Utah, USA",bytorrecilla torrecilla always info secret lol game check secret get riot point bio,0
8224,riot,"Frankfort, KY",transwoman drag queens color lead riot well know butch lesbian usually credit incite,0
8225,riot,Los Angeles,eacau preorder film itune watch yay,0
8226,riot,United Kingdom,without ally near can not use skill get hire really make every riot staff member incompetent,0
8231,riot,In Space,pop quiz prefer feminist revolution fry ravioliaewith porcini ricottau,0
8232,riot,,meatlove feminist world riot grill arrive oliviamile,0
8234,riot,"Sligo and Galway, Ireland",davidjordan stephanenny except start riot even make sense credit particular individual,1
8235,riot,"Los Angeles, CA",trollkrattos juan carlos salvador secret tip get riot point lol check secret bio,0
8236,riot,Seattle,southeast dirt riot series crown chion southeast dirt riot series crowns chionsblackfoot i d,0
8237,riot,Tipperary (Long Way) ,sweetpea run riot allotment brighten rainy day,1
8238,riot,Mumbai,stuart broad take eight joe root run riot aussie,0
8239,riot,Malang,riot police intervene southton vitesse arnhem supporter clash uC/ fan clash buildup second,1
8240,riot,,jwalkerlyle discover nickcannon listenbuy realmandyrain riot itunesmusic itune u blowmandyup,0
8241,riot,"San Francisco, CA",cracker white riot nowplaying,0
8242,rioting,hertfordshire.,government care police stop riot eventually protestor eventually skyscraper become plantcovered,1
8243,rioting,Dublin,doco tonight pm setanta sports ireland freeview large police presence soccer game ireland stop prevent rioting,0
8244,rioting,,eric clapton shot sheriff guess many people riot right none,1
8245,rioting,Spare 'Oom,kill val rioting emmerdale,0
8246,rioting,SURROUNDED BY WEEABOOS,money can not buy happiness lie tell poor people keep rioting,1
8247,rioting,,bloody hell already upgrade riot hyperbole saintsfc,1
8250,rioting,Australia,twitter count riot financial collapse brazil rio,1
8251,rioting,,would black dude antioch would riot,0
8252,rioting,NYC,runjewel recently meet bbc discuss race relation america benefit rioting loveislove,0
8253,rioting,Vidalia GA,reuter people like charge inevitable rioting contribute lie,0
8254,rioting,"Vista, CA",cindy noonancindynoonanheartbreak baltimore rioting yahistorical undergroundrailraod,1
8256,rioting,Serva Fidem,leed fan rioting embra low tier league cup final dee dum,1
8257,rioting,,still riot couple hour leave class,1
8258,rioting,"Bellville, Ohio",cloydriver plenty black people riot tosu chionship well,0
8259,rioting,trapped in America,evacide ferguson riot work next time rioting change anything fix,1
8261,rioting,A little house in the outback.,bbcnew ass british insurer say rioting cost insurer million police number reduce blind fat contr,1
8262,rioting,tri state,bhramabull watch run jewel use fact defend riot ferguson socially minded duo take,1
8264,rioting,Upstate New York,twitter invent keep we insomniac riot wee small hour,0
8266,rioting,,blutz people rioting justice serve murderer behind bar simple justiceno peace justicepeace,1
8267,rioting,,still riot gmail,0
8270,rioting,"Scotland, United Kingdom",jasalhad brianboru jimskiv hijinks rioting,1
8271,rioting,,ryleedowns nevaehburton get money tomorrow rioting,0
8274,rioting,,sweden venezuela day riot venezuela riot direct gru,1
8276,rioting,Chicora ?? Oakland,davidolszak riot happy valley penn state lose,0
8278,rioting,,aelinrhee group mascara smear girl riot horrific,1
8279,rioting,,last time high profile name due sign nffc city rioting wesley verhoek household name dontpanic,1
8280,rioting,"heart of darkness, unholy ?",georgous alternative legal alternative protest rioting may peaceful thing demonstration,0
8283,rioting,"Colonial Heights, VA",halljh sick criminal parent friend rioting kill police give damn officer,1
8284,rioting,,blutz rioting begin prior decision indictment really make sense pointu,1
8285,rioting,India,ashe test match currently interesting stupid congress rioting,1
8286,rioting,The Weird Part of Wonderland,people riot everywhere i d usamisan lt,1
8287,rioting,,football hooligan jail rioting game scotland already ban match england uknew,1
8288,rioting,Alabama,cindy noonancindynoonanheartbreak baltimore rioting yahistorical undergroundrailraod,0
8289,rioting,A little house in the outback.,bbcnew ass british insurer say rioting cost insurersmillion police number reduce blind fat controller,1
8291,rioting,Cassadaga Florida,faafa live family live country looter shoot sight rioting tolerate,1
8292,rubble,"Columbus, Georgia",refuse let life reduce rubble shit keep pile get shovel expirehc,0
8294,rubble,"Minna, Nigeria",chinas stock market crash gem rubble chinauas stock market crash su forbe,0
8295,rubble,,nuclear arm race go rubble bounce winston churchill,0
8296,rubble,,"accionempresa chinauas stock market crash summer spark interest bargain hunt gerenciatodo a """,1
8297,rubble,,"accionempresa chinauas stock market crash summer spark interest bargain hunt gerenciatodo a """,0
8298,rubble,,parent impulsive sometimes remember come home room fill dust rubble want redesign,0
8300,rubble,,turn rubble disaster lego brick build house belong crazyideascollege,0
8301,rubble,"Accra,Ghana",wisenews chinas stock market crash gem rubble,0
8304,rubble,World,forbes china stock market crash gem rubble chinauas stock market crash summer ha,0
8309,rubble,"Dubai, UAE",forbes europe chinas stock market crash gem rubble,1
8310,rubble,,chinauas stock market crash summer spark interest bargain hunter bull bet rebound du,0
8311,rubble,Phoenix Az,jasonpope johnfugelsang refer main building hit rubble,1
8312,rubble,Italy,chinas stock market crash gem rubble,0
8314,rubble,London,wisenews chinas stock market crash gem rubble,1
8315,rubble,,jun yemenis search survivor rubble house old city sanuaa follow,1
8317,rubble,ON,chinas stock market crash gem rubble forbesasia,1
8318,rubble,"St. Louis, MO",steve buscemi firefightr fame workd hr shift diggin thru wtc rubble lookg survivor,1
8320,rubble,United States,chinas stock market crash gem rubble tcot p,0
8321,rubble,Spain - China - Latin America.,chinas stock market crash gem rubble chinauas stock market crash summer h forbe,0
8324,rubble,"Chester, IL",find diamond rubble,0
8329,rubble,West Africa,tnn chinas stock market crash gem rubble,1
8330,rubble,"Calgary, AB, Canada",chinas stock market crash gem rubble roimentor yycwalk,1
8332,rubble,California,chinas stock market crash gem rubble,0
8334,rubble,Made Here In Detroit ,wisenews chinas stock market crash gem rubble,1
8335,rubble,"Portland, OR",post china stock market crash gem rubble,0
8337,rubble,,chinas stock market crash gem rubble chinauas stock market crash summer spark,0
8339,rubble,"Dallas, Tejas",photo postapocalypticflimflam prod around rubble,0
8341,rubble,"ATLANTA , GEORGIA ",wisenews chinas stock market crash gem rubble,0
8344,ruin,| CA Û¢ GA  |,okgabby damn suh let ruin year bruh year well start carpoole like back day,0
8345,ruin,"Nashville, TN",can not ruin mood may lost direction,0
8346,ruin,,ruin everything,0
8347,ruin,Depok,quote never let problem ruin faith,0
8348,ruin,London / Birmingham,anxious though many people watch meet make uncomfortable can not let ruin moment,0
8349,ruin,texas,smoker ruin car smell,0
8350,ruin,"Yulee, FL",chrisdyson wait friend mta ruin sorrybutitstrue,0
8351,ruin,austin tx,really sad red closing yuppie n tourist ruin everything,0
8352,ruin,,always get ruin mood,0
8355,ruin,,understand want hang guy friend ill give space ruin trust,0
8356,ruin,Garrett,like earth would anybody unhappy purposely ruin somebody else happiness,0
8360,ruin,followurDREAMS(& my instagram),fresh da shower lookss still love hair ruin brand yes,0
8361,ruin,,savannahross tryna ruin life,0
8362,ruin,sheffield // rotherham,well do everyone applaud terrific never ruin anything,0
8363,ruin,"Wailuku, Maui",four thing may ruin personal injury accident claim,1
8364,ruin,,ruin holidays wordk zmne,0
8365,ruin,"Lima, OH",every time really good day someone ruin,0
8366,ruin,"Long Beach, CA",ruin relationship ask intention,0
8367,ruin,Belfast,ruin something awful minion,0
8368,ruin,fujo garbage heaven ,really awful can not even work artist ruin thing,0
8369,ruin,New York - Connecticut,damn wale know ruin song,0
8370,ruin,,play like symphony play till finger bleed great masterpiece ruin,0
8371,ruin,snapchat~ maddzz_babby ,family ruin something actually go good,0
8372,ruin,"2,360 miles away",hate awkward ruin thing,0
8374,ruin,,long road ruin foo fighter,0
8375,ruin,"Winnipeg, Manitoba",ruin everything tarbox ruin sour cream put brick cheese freezerdummy,0
8377,ruin,,let asshole ruin night,0
8378,ruin,Boston,lol real issue way nfl try ruin guy legacy,0
8382,ruin,Florida Forever,ruin connormidd day,0
8383,ruin,"Sacramento, CA",greedy bastard fullscreen way ruin creativity censorship youtube,0
8385,ruin,#RedSoxNation,juliechen go ruin game vanessa great player,0
8386,ruin,MNL,clnv yes yes ruin life lol,0
8387,ruin,youtube.com/channel/UCHWTLC9B4ZjUGh7yDlb55Iw,nbc reboot fresh prince belair bring back original cast everything nothing ruin show,0
8388,ruin,,happy fuck tryna ruin keep smile,0
8389,ruin,CA ??DC,people i d let ruin life soul cervix everything odell definitely top list,0
8390,ruin,"Des Moines, IA",ill ruin life,0
8391,ruin,"MÌ©rida, YucatÌÁn",babe go ruin let stay,0
8392,sandstorm,"Scituate, MA",ctaztrophe everything must ok listening sandstorm,0
8393,sandstorm,USA,watch airport get swallow sandstorm minute,1
8394,sandstorm,,watch airport get swallow sandstorm minute,1
8396,sandstorm,United States,hienshi gbay would turn sandstorm riot give good answer instead give dumb excuse least client,0
8397,sandstorm,,watch airport get swallow sandstorm minute,1
8399,sandstorm,United States,like youtube video darude sandstorm,0
8400,sandstorm,USA,watch airport get swallow sandstorm minute,1
8401,sandstorm,hkXfYMhEx,watch airport get swallow sandstorm minute,1
8402,sandstorm,US,watch airport get swallow sandstorm minute,1
8404,sandstorm,USA,watch airport get swallow sandstorm minute,1
8405,sandstorm,USA,watch airport get swallow sandstorm minute,1
8406,sandstorm,,sandstorm jordan coat middle eastuas large refugee c layer grit,1
8408,sandstorm,"Hamilton County, IN",sandstorm woo hoo,1
8409,sandstorm,United States,watch airport get swallow sandstorm minute,1
8410,sandstorm,USA,watch airport get swallow sandstorm minute,1
8411,sandstorm,USA,watch airport get swallow sandstorm minute,1
8412,sandstorm,USA,watch airport get swallow sandstorm minute,1
8414,sandstorm,,need friend booze darude sandstorm,0
8415,sandstorm,Dakar,socialwots globiinclusion nrcmiddleeast sandstorm engulfs caravans tent zaatari refugee c u,1
8416,sandstorm,United States,watch airport get swallow sandstorm minute,1
8418,sandstorm,USA,watch airport get swallow sandstorm minute,1
8419,sandstorm,USA,watch airport get swallow sandstorm minute,1
8422,sandstorm,USA,watch airport get swallow sandstorm minute,1
8423,sandstorm,USA,watch airport get swallow sandstorm minute,1
8425,sandstorm,In your head,sundercr two hour sandstorm remixe merge together betweensong silence,0
8428,sandstorm,USA,watch airport get swallow sandstorm minute,1
8429,sandstorm,,watch airport get swallow sandstorm minute,1
